tcpdump: verbose output suppressed, use -v or -vv for full protocol decode
listening on eth0, link-type EN10MB (Ethernet), capture size 262144 bytes
19:05:00.804430 IP 138.197.151.74.ssh > 24-212-207-43.cable.teksavvy.com.56051: Flags [P.], seq 1995903235:1995903343, ack 1979416349, win 501, length 108
19:05:00.804602 IP 138.197.151.74.ssh > 24-212-207-43.cable.teksavvy.com.56051: Flags [P.], seq 108:252, ack 1, win 501, length 144
19:05:00.804703 IP 138.197.151.74.ssh > 24-212-207-43.cable.teksavvy.com.56051: Flags [P.], seq 252:288, ack 1, win 501, length 36
19:05:00.805468 IP 138.197.151.74.52295 > dns.google.domain: 53438+ PTR? 43.207.212.24.in-addr.arpa. (44)
19:05:00.814762 IP dns.google.domain > 138.197.151.74.52295: 53438 1/0/0 PTR 24-212-207-43.cable.teksavvy.com. (90)
19:05:00.815157 IP 138.197.151.74.58839 > dns.google.domain: 1901+ PTR? 74.151.197.138.in-addr.arpa. (45)
19:05:00.818506 IP 24-212-207-43.cable.teksavvy.com.56051 > 138.197.151.74.ssh: Flags [.], ack 288, win 3089, length 0
19:05:00.913917 IP dns.google.domain > 138.197.151.74.58839: 1901 NXDomain 0/1/0 (112)
19:05:00.914313 IP 138.197.151.74.ssh > 24-212-207-43.cable.teksavvy.com.56051: Flags [P.], seq 288:476, ack 1, win 501, length 188
19:05:00.914431 IP 138.197.151.74.ssh > 24-212-207-43.cable.teksavvy.com.56051: Flags [P.], seq 476:512, ack 1, win 501, length 36
19:05:00.914561 IP 138.197.151.74.ssh > 24-212-207-43.cable.teksavvy.com.56051: Flags [P.], seq 512:684, ack 1, win 501, length 172
19:05:00.914649 IP 138.197.151.74.ssh > 24-212-207-43.cable.teksavvy.com.56051: Flags [P.], seq 684:720, ack 1, win 501, length 36
19:05:00.914757 IP 138.197.151.74.ssh > 24-212-207-43.cable.teksavvy.com.56051: Flags [P.], seq 720:884, ack 1, win 501, length 164
19:05:00.914839 IP 138.197.151.74.ssh > 24-212-207-43.cable.teksavvy.com.56051: Flags [P.], seq 884:920, ack 1, win 501, length 36
19:05:00.915095 IP 138.197.151.74.50446 > dns.google.domain: 19841+ PTR? 8.8.8.8.in-addr.arpa. (38)
19:05:00.915728 IP dns.google.domain > 138.197.151.74.50446: 19841 1/0/0 PTR dns.google. (62)
19:05:00.915912 IP 138.197.151.74.ssh > 24-212-207-43.cable.teksavvy.com.56051: Flags [P.], seq 920:1060, ack 1, win 501, length 140
19:05:00.916034 IP 138.197.151.74.ssh > 24-212-207-43.cable.teksavvy.com.56051: Flags [P.], seq 1060:1096, ack 1, win 501, length 36
19:05:00.916162 IP 138.197.151.74.ssh > 24-212-207-43.cable.teksavvy.com.56051: Flags [P.], seq 1096:1252, ack 1, win 501, length 156
19:05:00.916391 IP 138.197.151.74.ssh > 24-212-207-43.cable.teksavvy.com.56051: Flags [P.], seq 1252:1428, ack 1, win 501, length 176
19:05:00.923280 IP 24-212-207-43.cable.teksavvy.com.56051 > 138.197.151.74.ssh: Flags [.], ack 920, win 3086, length 0
19:05:00.923378 IP 138.197.151.74.ssh > 24-212-207-43.cable.teksavvy.com.56051: Flags [P.], seq 1428:4216, ack 1, win 501, length 2788
19:05:00.923653 IP 138.197.151.74.ssh > 24-212-207-43.cable.teksavvy.com.56051: Flags [P.], seq 4216:4372, ack 1, win 501, length 156
19:05:00.923803 IP 138.197.151.74.ssh > 24-212-207-43.cable.teksavvy.com.56051: Flags [P.], seq 4372:4408, ack 1, win 501, length 36
19:05:00.923934 IP 138.197.151.74.ssh > 24-212-207-43.cable.teksavvy.com.56051: Flags [P.], seq 4408:4580, ack 1, win 501, length 172
19:05:00.924055 IP 138.197.151.74.ssh > 24-212-207-43.cable.teksavvy.com.56051: Flags [P.], seq 4580:4616, ack 1, win 501, length 36
19:05:00.924167 IP 138.197.151.74.ssh > 24-212-207-43.cable.teksavvy.com.56051: Flags [P.], seq 4616:4788, ack 1, win 501, length 172
19:05:00.924254 IP 138.197.151.74.ssh > 24-212-207-43.cable.teksavvy.com.56051: Flags [P.], seq 4788:4824, ack 1, win 501, length 36
19:05:00.924362 IP 138.197.151.74.ssh > 24-212-207-43.cable.teksavvy.com.56051: Flags [P.], seq 4824:4996, ack 1, win 501, length 172
19:05:00.924441 IP 138.197.151.74.ssh > 24-212-207-43.cable.teksavvy.com.56051: Flags [P.], seq 4996:5032, ack 1, win 501, length 36
19:05:00.924545 IP 138.197.151.74.ssh > 24-212-207-43.cable.teksavvy.com.56051: Flags [P.], seq 5032:5204, ack 1, win 501, length 172
19:05:00.924625 IP 138.197.151.74.ssh > 24-212-207-43.cable.teksavvy.com.56051: Flags [P.], seq 5204:5240, ack 1, win 501, length 36
19:05:00.926754 IP 24-212-207-43.cable.teksavvy.com.56051 > 138.197.151.74.ssh: Flags [.], ack 1428, win 3091, length 0
19:05:00.926798 IP 138.197.151.74.ssh > 24-212-207-43.cable.teksavvy.com.56051: Flags [P.], seq 5240:6696, ack 1, win 501, length 1456
19:05:00.927003 IP 138.197.151.74.ssh > 24-212-207-43.cable.teksavvy.com.56051: Flags [P.], seq 6696:6852, ack 1, win 501, length 156
19:05:00.927066 IP 138.197.151.74.ssh > 24-212-207-43.cable.teksavvy.com.56051: Flags [P.], seq 6852:6888, ack 1, win 501, length 36
19:05:00.927174 IP 138.197.151.74.ssh > 24-212-207-43.cable.teksavvy.com.56051: Flags [P.], seq 6888:7060, ack 1, win 501, length 172
19:05:00.927261 IP 138.197.151.74.ssh > 24-212-207-43.cable.teksavvy.com.56051: Flags [P.], seq 7060:7096, ack 1, win 501, length 36
19:05:00.927370 IP 138.197.151.74.ssh > 24-212-207-43.cable.teksavvy.com.56051: Flags [P.], seq 7096:7268, ack 1, win 501, length 172
19:05:00.927527 IP 138.197.151.74.ssh > 24-212-207-43.cable.teksavvy.com.56051: Flags [P.], seq 7268:7304, ack 1, win 501, length 36
19:05:00.927760 IP 138.197.151.74.ssh > 24-212-207-43.cable.teksavvy.com.56051: Flags [P.], seq 7304:7476, ack 1, win 501, length 172
19:05:00.939244 IP 24-212-207-43.cable.teksavvy.com.56051 > 138.197.151.74.ssh: Flags [.], ack 7476, win 3089, length 0
19:05:00.939323 IP 138.197.151.74.ssh > 24-212-207-43.cable.teksavvy.com.56051: Flags [P.], seq 7476:8552, ack 1, win 501, length 1076
19:05:00.939591 IP 138.197.151.74.ssh > 24-212-207-43.cable.teksavvy.com.56051: Flags [P.], seq 8552:8708, ack 1, win 501, length 156
19:05:00.939721 IP 138.197.151.74.ssh > 24-212-207-43.cable.teksavvy.com.56051: Flags [P.], seq 8708:8744, ack 1, win 501, length 36
19:05:00.939838 IP 138.197.151.74.ssh > 24-212-207-43.cable.teksavvy.com.56051: Flags [P.], seq 8744:8916, ack 1, win 501, length 172
19:05:00.939923 IP 138.197.151.74.ssh > 24-212-207-43.cable.teksavvy.com.56051: Flags [P.], seq 8916:8952, ack 1, win 501, length 36
19:05:00.940100 IP 138.197.151.74.ssh > 24-212-207-43.cable.teksavvy.com.56051: Flags [P.], seq 8952:9124, ack 1, win 501, length 172
19:05:00.940235 IP 138.197.151.74.ssh > 24-212-207-43.cable.teksavvy.com.56051: Flags [P.], seq 9124:9332, ack 1, win 501, length 208
19:05:00.940305 IP 138.197.151.74.ssh > 24-212-207-43.cable.teksavvy.com.56051: Flags [P.], seq 9332:9368, ack 1, win 501, length 36
19:05:00.940423 IP 138.197.151.74.ssh > 24-212-207-43.cable.teksavvy.com.56051: Flags [P.], seq 9368:9540, ack 1, win 501, length 172
19:05:00.940528 IP 138.197.151.74.ssh > 24-212-207-43.cable.teksavvy.com.56051: Flags [P.], seq 9540:9576, ack 1, win 501, length 36
19:05:00.940628 IP 138.197.151.74.ssh > 24-212-207-43.cable.teksavvy.com.56051: Flags [P.], seq 9576:9748, ack 1, win 501, length 172
19:05:00.940703 IP 138.197.151.74.ssh > 24-212-207-43.cable.teksavvy.com.56051: Flags [P.], seq 9748:9784, ack 1, win 501, length 36
19:05:00.940801 IP 138.197.151.74.ssh > 24-212-207-43.cable.teksavvy.com.56051: Flags [P.], seq 9784:9956, ack 1, win 501, length 172
19:05:00.940861 IP 138.197.151.74.ssh > 24-212-207-43.cable.teksavvy.com.56051: Flags [P.], seq 9956:9992, ack 1, win 501, length 36
19:05:00.940937 IP 138.197.151.74.ssh > 24-212-207-43.cable.teksavvy.com.56051: Flags [P.], seq 9992:10164, ack 1, win 501, length 172
19:05:00.940997 IP 138.197.151.74.ssh > 24-212-207-43.cable.teksavvy.com.56051: Flags [P.], seq 10164:10200, ack 1, win 501, length 36
19:05:00.941071 IP 138.197.151.74.ssh > 24-212-207-43.cable.teksavvy.com.56051: Flags [P.], seq 10200:10372, ack 1, win 501, length 172
19:05:00.941129 IP 138.197.151.74.ssh > 24-212-207-43.cable.teksavvy.com.56051: Flags [P.], seq 10372:10408, ack 1, win 501, length 36
19:05:00.941242 IP 138.197.151.74.ssh > 24-212-207-43.cable.teksavvy.com.56051: Flags [P.], seq 10408:10580, ack 1, win 501, length 172
19:05:00.941311 IP 138.197.151.74.ssh > 24-212-207-43.cable.teksavvy.com.56051: Flags [P.], seq 10580:10616, ack 1, win 501, length 36
19:05:00.941389 IP 138.197.151.74.ssh > 24-212-207-43.cable.teksavvy.com.56051: Flags [P.], seq 10616:10788, ack 1, win 501, length 172
19:05:00.941448 IP 138.197.151.74.ssh > 24-212-207-43.cable.teksavvy.com.56051: Flags [P.], seq 10788:10824, ack 1, win 501, length 36
19:05:00.941523 IP 138.197.151.74.ssh > 24-212-207-43.cable.teksavvy.com.56051: Flags [P.], seq 10824:10996, ack 1, win 501, length 172
19:05:00.941583 IP 138.197.151.74.ssh > 24-212-207-43.cable.teksavvy.com.56051: Flags [P.], seq 10996:11032, ack 1, win 501, length 36
19:05:00.941656 IP 138.197.151.74.ssh > 24-212-207-43.cable.teksavvy.com.56051: Flags [P.], seq 11032:11204, ack 1, win 501, length 172
19:05:00.941715 IP 138.197.151.74.ssh > 24-212-207-43.cable.teksavvy.com.56051: Flags [P.], seq 11204:11240, ack 1, win 501, length 36
19:05:00.941803 IP 138.197.151.74.ssh > 24-212-207-43.cable.teksavvy.com.56051: Flags [P.], seq 11240:11412, ack 1, win 501, length 172
19:05:00.941863 IP 138.197.151.74.ssh > 24-212-207-43.cable.teksavvy.com.56051: Flags [P.], seq 11412:11448, ack 1, win 501, length 36
19:05:00.941937 IP 138.197.151.74.ssh > 24-212-207-43.cable.teksavvy.com.56051: Flags [P.], seq 11448:11620, ack 1, win 501, length 172
19:05:00.941997 IP 138.197.151.74.ssh > 24-212-207-43.cable.teksavvy.com.56051: Flags [P.], seq 11620:11656, ack 1, win 501, length 36
19:05:00.942070 IP 138.197.151.74.ssh > 24-212-207-43.cable.teksavvy.com.56051: Flags [P.], seq 11656:11828, ack 1, win 501, length 172
19:05:00.942129 IP 138.197.151.74.ssh > 24-212-207-43.cable.teksavvy.com.56051: Flags [P.], seq 11828:11864, ack 1, win 501, length 36
19:05:00.942202 IP 138.197.151.74.ssh > 24-212-207-43.cable.teksavvy.com.56051: Flags [P.], seq 11864:12036, ack 1, win 501, length 172
19:05:00.942258 IP 138.197.151.74.ssh > 24-212-207-43.cable.teksavvy.com.56051: Flags [P.], seq 12036:12072, ack 1, win 501, length 36
19:05:00.942402 IP 138.197.151.74.ssh > 24-212-207-43.cable.teksavvy.com.56051: Flags [P.], seq 12072:12244, ack 1, win 501, length 172
19:05:00.942460 IP 138.197.151.74.ssh > 24-212-207-43.cable.teksavvy.com.56051: Flags [P.], seq 12244:12280, ack 1, win 501, length 36
19:05:00.942535 IP 138.197.151.74.ssh > 24-212-207-43.cable.teksavvy.com.56051: Flags [P.], seq 12280:12452, ack 1, win 501, length 172
19:05:00.942609 IP 138.197.151.74.ssh > 24-212-207-43.cable.teksavvy.com.56051: Flags [P.], seq 12452:12488, ack 1, win 501, length 36
19:05:00.942672 IP 138.197.151.74.ssh > 24-212-207-43.cable.teksavvy.com.56051: Flags [P.], seq 12488:12660, ack 1, win 501, length 172
19:05:00.942727 IP 138.197.151.74.ssh > 24-212-207-43.cable.teksavvy.com.56051: Flags [P.], seq 12660:12696, ack 1, win 501, length 36