root@lamp-ubuntu-s-1vcpu-1gb-tor1-01:~# tcpdump -r 0001.pcap
reading from file 0001.pcap, link-type EN10MB (Ethernet)
15:42:30.663900 IP 138.197.151.74.ssh > 24-212-207-43.cable.teksavvy.com.51275: Flags [P.], seq 2969622076:2969622120, ack 2227367422, win 501, length 44
15:42:30.664046 IP 138.197.151.74.ssh > 24-212-207-43.cable.teksavvy.com.51275: Flags [P.], seq 44:152, ack 1, win 501, length 108
15:42:30.664157 IP 138.197.151.74.ssh > 24-212-207-43.cable.teksavvy.com.51275: Flags [P.], seq 152:188, ack 1, win 501, length 36
15:42:30.676138 IP 24-212-207-43.cable.teksavvy.com.51275 > 138.197.151.74.ssh: Flags [.], ack 188, win 18771, length 0
15:42:37.951739 IP 138.197.151.74.ssh > 218.92.0.165.28722: Flags [F.], seq 3671206070, ack 955157694, win 510, options [nop,nop,TS val 2534701819 ecr 3599598713], length 0
15:42:38.185424 IP 218.92.0.165 > 138.197.151.74: ICMP host 218.92.0.165 unreachable - admin prohibited, length 60
15:42:40.853352 IP 209.141.47.230.58938 > 138.197.151.74.https: Flags [S], seq 1192756945, win 1024, length 0
15:42:40.853447 IP 138.197.151.74.https > 209.141.47.230.58938: Flags [R.], seq 0, ack 1192756946, win 0, length 0
15:42:40.960392 IP 209.141.47.230.58938 > 138.197.151.74.https: Flags [R], seq 1192756946, win 1200, length 0
15:42:42.126665 IP 123.207.94.252.64882 > 138.197.151.74.ssh: Flags [S], seq 434938066, win 29200, options [mss 1424,sackOK,TS val 2051308435 ecr 0,nop,wscale 9], length 0
15:42:42.126756 IP 138.197.151.74.ssh > 123.207.94.252.64882: Flags [S.], seq 1035478339, ack 434938067, win 65160, options [mss 1460,sackOK,TS val 2056613646 ecr 2051308435,nop,wscale 7], length 0
15:42:43.135721 IP 138.197.151.74.ssh > 123.207.94.252.64882: Flags [S.], seq 1035478339, ack 434938067, win 65160, options [mss 1460,sackOK,TS val 2056614654 ecr 2051308435,nop,wscale 7], length 0
15:42:45.151714 IP 138.197.151.74.ssh > 123.207.94.252.64882: Flags [S.], seq 1035478339, ack 434938067, win 65160, options [mss 1460,sackOK,TS val 2056616670 ecr 2051308435,nop,wscale 7], length 0
15:42:45.382660 IP 123.207.94.252.64882 > 138.197.151.74.ssh: Flags [.], ack 1, win 58, options [nop,nop,TS val 2051311692 ecr 2056613646], length 0
15:42:45.406617 IP 138.197.151.74.ssh > 123.207.94.252.64882: Flags [P.], seq 1:42, ack 1, win 510, options [nop,nop,TS val 2056616925 ecr 2051311692], length 41
15:42:45.637620 IP 123.207.94.252.64882 > 138.197.151.74.ssh: Flags [.], ack 42, win 58, options [nop,nop,TS val 2051311947 ecr 2056616925], length 0
15:42:45.637674 IP 123.207.94.252.64882 > 138.197.151.74.ssh: Flags [P.], seq 1:22, ack 42, win 58, options [nop,nop,TS val 2051311947 ecr 2056616925], length 21
15:42:45.637701 IP 138.197.151.74.ssh > 123.207.94.252.64882: Flags [.], ack 22, win 510, options [nop,nop,TS val 2056617156 ecr 2051311947], length 0
15:42:45.640830 IP 138.197.151.74.ssh > 123.207.94.252.64882: Flags [P.], seq 42:1098, ack 22, win 510, options [nop,nop,TS val 2056617160 ecr 2051311947], length 1056
15:42:45.872028 IP 123.207.94.252.64882 > 138.197.151.74.ssh: Flags [P.], seq 22:462, ack 1098, win 62, options [nop,nop,TS val 2051312181 ecr 2056617160], length 440
15:42:45.872136 IP 138.197.151.74.ssh > 123.207.94.252.64882: Flags [.], ack 462, win 507, options [nop,nop,TS val 2056617391 ecr 2051312181], length 0
15:42:46.103058 IP 123.207.94.252.64882 > 138.197.151.74.ssh: Flags [P.], seq 462:510, ack 1098, win 62, options [nop,nop,TS val 2051312412 ecr 2056617391], length 48
15:42:46.103151 IP 138.197.151.74.ssh > 123.207.94.252.64882: Flags [.], ack 510, win 507, options [nop,nop,TS val 2056617622 ecr 2051312412], length 0
15:42:46.118892 IP 138.197.151.74.ssh > 123.207.94.252.64882: Flags [P.], seq 1098:1378, ack 510, win 507, options [nop,nop,TS val 2056617638 ecr 2051312412], length 280
15:42:46.352340 IP 123.207.94.252.64882 > 138.197.151.74.ssh: Flags [P.], seq 510:526, ack 1378, win 66, options [nop,nop,TS val 2051312662 ecr 2056617638], length 16
15:42:46.352433 IP 138.197.151.74.ssh > 123.207.94.252.64882: Flags [.], ack 526, win 507, options [nop,nop,TS val 2056617871 ecr 2051312662], length 0
15:42:46.484940 IP 140.143.193.52.42140 > 138.197.151.74.ssh: Flags [S], seq 1291672906, win 29200, options [mss 1424,sackOK,TS val 3821429158 ecr 0,nop,wscale 7], length 0
15:42:46.485025 IP 138.197.151.74 > 140.143.193.52: ICMP 138.197.151.74 tcp port ssh unreachable, length 68
15:42:46.583380 IP 123.207.94.252.64882 > 138.197.151.74.ssh: Flags [P.], seq 526:578, ack 1378, win 66, options [nop,nop,TS val 2051312893 ecr 2056617871], length 52
15:42:46.583446 IP 138.197.151.74.ssh > 123.207.94.252.64882: Flags [.], ack 578, win 507, options [nop,nop,TS val 2056618102 ecr 2051312893], length 0
15:42:46.583706 IP 138.197.151.74.ssh > 123.207.94.252.64882: Flags [P.], seq 1378:1430, ack 578, win 507, options [nop,nop,TS val 2056618102 ecr 2051312893], length 52
15:42:46.780365 IP scan-02f.shadowserver.org.34602 > 138.197.151.74.50075: Flags [S], seq 517143038, win 65535, length 0
15:42:46.818054 IP 123.207.94.252.64882 > 138.197.151.74.ssh: Flags [P.], seq 578:662, ack 1430, win 66, options [nop,nop,TS val 2051313127 ecr 2056618102], length 84
15:42:46.859679 IP 138.197.151.74.ssh > 123.207.94.252.64882: Flags [.], ack 662, win 507, options [nop,nop,TS val 2056618378 ecr 2051313127], length 0
15:42:49.496747 IP 138.197.151.74.ssh > 123.207.94.252.64882: Flags [P.], seq 1430:1498, ack 662, win 507, options [nop,nop,TS val 2056621015 ecr 2051313127], length 68
15:42:49.731180 IP 123.207.94.252.64882 > 138.197.151.74.ssh: Flags [P.], seq 662:714, ack 1498, win 66, options [nop,nop,TS val 2051316041 ecr 2056621015], length 52
15:42:49.731250 IP 138.197.151.74.ssh > 123.207.94.252.64882: Flags [.], ack 714, win 507, options [nop,nop,TS val 2056621250 ecr 2051316041], length 0
15:42:49.731289 IP 123.207.94.252.64882 > 138.197.151.74.ssh: Flags [F.], seq 714, ack 1498, win 66, options [nop,nop,TS val 2051316041 ecr 2056621015], length 0
15:42:49.736330 IP 138.197.151.74.ssh > 123.207.94.252.64882: Flags [F.], seq 1498, ack 715, win 507, options [nop,nop,TS val 2056621255 ecr 2051316041], length 0
15:42:49.967244 IP 123.207.94.252.64882 > 138.197.151.74.ssh: Flags [.], ack 1499, win 66, options [nop,nop,TS val 2051316277 ecr 2056621255], length 0
15:42:55.044888 IP 45.155.205.24.51091 > 138.197.151.74.11380: Flags [S], seq 1825377408, win 1024, length 0
15:43:00.361830 IP 49.233.30.125.45786 > 138.197.151.74.ssh: Flags [S], seq 121857118, win 64240, options [mss 1424,sackOK,TS val 4153092312 ecr 0,nop,wscale 7], length 0
15:43:00.361939 IP 138.197.151.74.ssh > 49.233.30.125.45786: Flags [S.], seq 2816064751, ack 121857119, win 65160, options [mss 1460,sackOK,TS val 1604702400 ecr 4153092312,nop,wscale 7], length 0
15:43:00.598021 IP 49.233.30.125.45786 > 138.197.151.74.ssh: Flags [.], ack 1, win 502, options [nop,nop,TS val 4153092549 ecr 1604702400], length 0
15:43:00.630847 IP 138.197.151.74.ssh > 49.233.30.125.45786: Flags [P.], seq 1:42, ack 1, win 510, options [nop,nop,TS val 1604702669 ecr 4153092549], length 41
15:43:00.865690 IP 49.233.30.125.45786 > 138.197.151.74.ssh: Flags [.], ack 42, win 502, options [nop,nop,TS val 4153092816 ecr 1604702669], length 0
15:43:00.865759 IP 49.233.30.125.45786 > 138.197.151.74.ssh: Flags [P.], seq 1:22, ack 42, win 502, options [nop,nop,TS val 4153092816 ecr 1604702669], length 21
15:43:00.865792 IP 138.197.151.74.ssh > 49.233.30.125.45786: Flags [.], ack 22, win 510, options [nop,nop,TS val 1604702904 ecr 4153092816], length 0
15:43:00.868942 IP 138.197.151.74.ssh > 49.233.30.125.45786: Flags [P.], seq 42:1098, ack 22, win 510, options [nop,nop,TS val 1604702907 ecr 4153092816], length 1056
15:43:01.104215 IP 49.233.30.125.45786 > 138.197.151.74.ssh: Flags [P.], seq 22:462, ack 1098, win 501, options [nop,nop,TS val 4153093055 ecr 1604702907], length 440
15:43:01.104300 IP 138.197.151.74.ssh > 49.233.30.125.45786: Flags [.], ack 462, win 507, options [nop,nop,TS val 1604703142 ecr 4153093055], length 0
15:43:01.606682 IP 2.57.122.97.44218 > 138.197.151.74.8001: Flags [S], seq 2219954116, win 65535, length 0
15:43:01.786871 IP 49.233.30.125.45786 > 138.197.151.74.ssh: Flags [P.], seq 462:510, ack 1098, win 501, options [nop,nop,TS val 4153093738 ecr 1604702907], length 48
15:43:01.786948 IP 138.197.151.74.ssh > 49.233.30.125.45786: Flags [.], ack 510, win 507, options [nop,nop,TS val 1604703825 ecr 4153093738], length 0
15:43:01.798062 IP 138.197.151.74.ssh > 49.233.30.125.45786: Flags [P.], seq 1098:1378, ack 510, win 507, options [nop,nop,TS val 1604703836 ecr 4153093738], length 280
15:43:02.015729 IP 138.197.151.74.ssh > 218.92.0.165.28722: Flags [F.], seq 0, ack 1, win 510, options [nop,nop,TS val 2534725883 ecr 3599598713], length 0
15:43:02.249428 IP 218.92.0.165 > 138.197.151.74: ICMP host 218.92.0.165 unreachable - admin prohibited, length 60
15:43:02.463702 IP 138.197.151.74.ssh > 49.233.30.125.45786: Flags [P.], seq 1098:1378, ack 510, win 507, options [nop,nop,TS val 1604704501 ecr 4153093738], length 280
15:43:02.690037 IP 194.147.140.63.54774 > 138.197.151.74.506: Flags [S], seq 2662414989, win 1024, length 0
15:43:02.694047 IP 49.233.30.125.45786 > 138.197.151.74.ssh: Flags [P.], seq 510:526, ack 1378, win 501, options [nop,nop,TS val 4153094645 ecr 1604704501], length 16
15:43:02.694115 IP 138.197.151.74.ssh > 49.233.30.125.45786: Flags [.], ack 526, win 507, options [nop,nop,TS val 1604704732 ecr 4153094645], length 0
15:43:02.922262 IP 49.233.30.125.45786 > 138.197.151.74.ssh: Flags [P.], seq 526:578, ack 1378, win 501, options [nop,nop,TS val 4153094873 ecr 1604704732], length 52
15:43:02.922319 IP 138.197.151.74.ssh > 49.233.30.125.45786: Flags [.], ack 578, win 507, options [nop,nop,TS val 1604704960 ecr 4153094873], length 0
15:43:02.922516 IP 138.197.151.74.ssh > 49.233.30.125.45786: Flags [P.], seq 1378:1430, ack 578, win 507, options [nop,nop,TS val 1604704960 ecr 4153094873], length 52
15:43:03.150172 IP 49.233.30.125.45786 > 138.197.151.74.ssh: Flags [P.], seq 578:678, ack 1430, win 501, options [nop,nop,TS val 4153095101 ecr 1604704960], length 100
15:43:03.191728 IP 138.197.151.74.ssh > 49.233.30.125.45786: Flags [.], ack 678, win 507, options [nop,nop,TS val 1604705229 ecr 4153095101], length 0
15:43:03.818859 IP 119.45.194.246.47830 > 138.197.151.74.ssh: Flags [S], seq 3724464157, win 64240, options [mss 1424,sackOK,TS val 3678843057 ecr 0,nop,wscale 7], length 0
15:43:03.818967 IP 138.197.151.74.ssh > 119.45.194.246.47830: Flags [S.], seq 1641688724, ack 3724464158, win 65160, options [mss 1460,sackOK,TS val 1297216472 ecr 3678843057,nop,wscale 7], length 0
15:43:04.012221 IP 119.45.194.246.47830 > 138.197.151.74.ssh: Flags [.], ack 1, win 502, options [nop,nop,TS val 3678843251 ecr 1297216472], length 0
15:43:04.035317 IP 138.197.151.74.ssh > 119.45.194.246.47830: Flags [P.], seq 1:42, ack 1, win 510, options [nop,nop,TS val 1297216688 ecr 3678843251], length 41
15:43:04.228163 IP 119.45.194.246.47830 > 138.197.151.74.ssh: Flags [.], ack 42, win 502, options [nop,nop,TS val 3678843467 ecr 1297216688], length 0
15:43:04.228216 IP 119.45.194.246.47830 > 138.197.151.74.ssh: Flags [P.], seq 1:22, ack 42, win 502, options [nop,nop,TS val 3678843467 ecr 1297216688], length 21
15:43:04.618876 IP 194.147.140.18.53576 > 138.197.151.74.55250: Flags [S], seq 919815909, win 1024, length 0
15:43:04.725849 IP 88.ip-54-38-186.eu.36918 > 138.197.151.74.ssh: Flags [S], seq 2028042229, win 29200, options [mss 1460,sackOK,TS val 210736413 ecr 0,nop,wscale 7], length 0
15:43:04.725931 IP 138.197.151.74 > 88.ip-54-38-186.eu: ICMP 138.197.151.74 tcp port ssh unreachable, length 68
15:43:04.835944 IP 119.45.194.246.47830 > 138.197.151.74.ssh: Flags [P.], seq 1:22, ack 42, win 502, options [nop,nop,TS val 3678844075 ecr 1297216688], length 21
15:43:04.836020 IP 138.197.151.74.ssh > 119.45.194.246.47830: Flags [.], ack 22, win 510, options [nop,nop,TS val 1297217489 ecr 3678844075], length 0
15:43:04.838715 IP 138.197.151.74.ssh > 119.45.194.246.47830: Flags [P.], seq 42:1098, ack 22, win 510, options [nop,nop,TS val 1297217491 ecr 3678844075], length 1056
15:43:05.031421 IP 119.45.194.246.47830 > 138.197.151.74.ssh: Flags [P.], seq 22:462, ack 1098, win 501, options [nop,nop,TS val 3678844270 ecr 1297217491], length 440
15:43:05.439712 IP 138.197.151.74.ssh > 119.45.194.246.47830: Flags [P.], seq 42:1098, ack 22, win 510, options [nop,nop,TS val 1297218092 ecr 3678844075], length 1056
15:43:05.473193 IP 138.197.151.74.ssh > 49.233.30.125.45786: Flags [P.], seq 1430:1498, ack 678, win 507, options [nop,nop,TS val 1604707511 ecr 4153095101], length 68
15:43:05.632515 IP 119.45.194.246.47830 > 138.197.151.74.ssh: Flags [.], ack 1098, win 501, options [nop,nop,TS val 3678844871 ecr 1297218092,nop,nop,sack 1 {42:1098}], length 0
15:43:05.635784 IP 119.45.194.246.47830 > 138.197.151.74.ssh: Flags [P.], seq 462:510, ack 1098, win 501, options [nop,nop,TS val 3678844875 ecr 1297218092], length 48
15:43:05.635819 IP 138.197.151.74.ssh > 119.45.194.246.47830: Flags [.], ack 22, win 510, options [nop,nop,TS val 1297218289 ecr 3678844075,nop,nop,sack 1 {462:510}], length 0
15:43:06.047725 IP 138.197.151.74.ssh > 49.233.30.125.45786: Flags [P.], seq 1430:1498, ack 678, win 507, options [nop,nop,TS val 1604708085 ecr 4153095101], length 68
15:43:06.275376 IP 49.233.30.125.45786 > 138.197.151.74.ssh: Flags [P.], seq 678:730, ack 1498, win 501, options [nop,nop,TS val 4153098226 ecr 1604708085], length 52
15:43:06.275450 IP 138.197.151.74.ssh > 49.233.30.125.45786: Flags [.], ack 730, win 507, options [nop,nop,TS val 1604708313 ecr 4153098226], length 0
15:43:06.275495 IP 49.233.30.125.45786 > 138.197.151.74.ssh: Flags [F.], seq 730, ack 1498, win 501, options [nop,nop,TS val 4153098226 ecr 1604708085], length 0
15:43:06.278003 IP 138.197.151.74.ssh > 49.233.30.125.45786: Flags [F.], seq 1498, ack 731, win 507, options [nop,nop,TS val 1604708316 ecr 4153098226], length 0
15:43:06.435876 IP 119.45.194.246.47830 > 138.197.151.74.ssh: Flags [P.], seq 22:462, ack 1098, win 501, options [nop,nop,TS val 3678845675 ecr 1297218289], length 440
15:43:06.435996 IP 138.197.151.74.ssh > 119.45.194.246.47830: Flags [.], ack 510, win 507, options [nop,nop,TS val 1297219089 ecr 3678845675], length 0
15:43:06.447071 IP 138.197.151.74.ssh > 119.45.194.246.47830: Flags [P.], seq 1098:1378, ack 510, win 507, options [nop,nop,TS val 1297219100 ecr 3678845675], length 280
15:43:06.505693 IP 49.233.30.125.45786 > 138.197.151.74.ssh: Flags [.], ack 1499, win 501, options [nop,nop,TS val 4153098456 ecr 1604708316], length 0
15:43:06.639906 IP 119.45.194.246.47830 > 138.197.151.74.ssh: Flags [.], ack 1378, win 501, options [nop,nop,TS val 3678845879 ecr 1297219100], length 0
15:43:06.641510 IP 119.45.194.246.47830 > 138.197.151.74.ssh: Flags [P.], seq 510:526, ack 1378, win 501, options [nop,nop,TS val 3678845880 ecr 1297219100], length 16
15:43:06.641545 IP 138.197.151.74.ssh > 119.45.194.246.47830: Flags [.], ack 526, win 507, options [nop,nop,TS val 1297219294 ecr 3678845880], length 0
15:43:06.834244 IP 119.45.194.246.47830 > 138.197.151.74.ssh: Flags [P.], seq 526:578, ack 1378, win 501, options [nop,nop,TS val 3678846073 ecr 1297219294], length 52
15:43:06.834303 IP 138.197.151.74.ssh > 119.45.194.246.47830: Flags [.], ack 578, win 507, options [nop,nop,TS val 1297219487 ecr 3678846073], length 0
15:43:06.834515 IP 138.197.151.74.ssh > 119.45.194.246.47830: Flags [P.], seq 1378:1430, ack 578, win 507, options [nop,nop,TS val 1297219487 ecr 3678846073], length 52
15:43:07.027205 IP 119.45.194.246.47830 > 138.197.151.74.ssh: Flags [P.], seq 578:662, ack 1430, win 501, options [nop,nop,TS val 3678846266 ecr 1297219487], length 84
15:43:07.067666 IP 138.197.151.74.ssh > 119.45.194.246.47830: Flags [.], ack 662, win 507, options [nop,nop,TS val 1297219720 ecr 3678846266], length 0
15:43:08.790621 IP 138.68.255.152.34008 > 138.197.151.74.ssh: Flags [S], seq 2227744917, win 29200, options [mss 1460,sackOK,TS val 2521879667 ecr 0,nop,wscale 7], length 0
15:43:08.790751 IP 138.197.151.74.ssh > 138.68.255.152.34008: Flags [S.], seq 3172039417, ack 2227744918, win 65160, options [mss 1460,sackOK,TS val 1309427293 ecr 2521879667,nop,wscale 7], length 0
15:43:08.875230 IP 138.68.255.152.34008 > 138.197.151.74.ssh: Flags [.], ack 1, win 229, options [nop,nop,TS val 2521879752 ecr 1309427293], length 0
15:43:08.900984 IP 138.197.151.74.ssh > 138.68.255.152.34008: Flags [P.], seq 1:42, ack 1, win 510, options [nop,nop,TS val 1309427404 ecr 2521879752], length 41
15:43:08.984664 IP 138.68.255.152.34008 > 138.197.151.74.ssh: Flags [.], ack 42, win 229, options [nop,nop,TS val 2521879862 ecr 1309427404], length 0
15:43:08.984721 IP 138.68.255.152.34008 > 138.197.151.74.ssh: Flags [P.], seq 1:22, ack 42, win 229, options [nop,nop,TS val 2521879862 ecr 1309427404], length 21
15:43:08.984747 IP 138.197.151.74.ssh > 138.68.255.152.34008: Flags [.], ack 22, win 510, options [nop,nop,TS val 1309427487 ecr 2521879862], length 0
15:43:08.987684 IP 138.197.151.74.ssh > 138.68.255.152.34008: Flags [P.], seq 42:1098, ack 22, win 510, options [nop,nop,TS val 1309427490 ecr 2521879862], length 1056
15:43:09.071471 IP 138.68.255.152.34008 > 138.197.151.74.ssh: Flags [P.], seq 22:462, ack 1098, win 245, options [nop,nop,TS val 2521879948 ecr 1309427490], length 440
15:43:09.071566 IP 138.197.151.74.ssh > 138.68.255.152.34008: Flags [.], ack 462, win 507, options [nop,nop,TS val 1309427574 ecr 2521879948], length 0
15:43:09.155207 IP 138.68.255.152.34008 > 138.197.151.74.ssh: Flags [P.], seq 462:510, ack 1098, win 245, options [nop,nop,TS val 2521880032 ecr 1309427574], length 48
15:43:09.155271 IP 138.197.151.74.ssh > 138.68.255.152.34008: Flags [.], ack 510, win 507, options [nop,nop,TS val 1309427658 ecr 2521880032], length 0
15:43:09.166418 IP 138.197.151.74.ssh > 138.68.255.152.34008: Flags [P.], seq 1098:1378, ack 510, win 507, options [nop,nop,TS val 1309427669 ecr 2521880032], length 280
15:43:09.258842 IP 138.68.255.152.34008 > 138.197.151.74.ssh: Flags [P.], seq 510:526, ack 1378, win 262, options [nop,nop,TS val 2521880136 ecr 1309427669], length 16
15:43:09.258956 IP 138.197.151.74.ssh > 138.68.255.152.34008: Flags [.], ack 526, win 507, options [nop,nop,TS val 1309427762 ecr 2521880136], length 0
15:43:09.342600 IP 138.68.255.152.34008 > 138.197.151.74.ssh: Flags [P.], seq 526:578, ack 1378, win 262, options [nop,nop,TS val 2521880220 ecr 1309427762], length 52
15:43:09.342702 IP 138.197.151.74.ssh > 138.68.255.152.34008: Flags [.], ack 578, win 507, options [nop,nop,TS val 1309427845 ecr 2521880220], length 0
15:43:09.342989 IP 138.197.151.74.ssh > 138.68.255.152.34008: Flags [P.], seq 1378:1430, ack 578, win 507, options [nop,nop,TS val 1309427846 ecr 2521880220], length 52
15:43:09.428623 IP 138.68.255.152.34008 > 138.197.151.74.ssh: Flags [P.], seq 578:678, ack 1430, win 262, options [nop,nop,TS val 2521880306 ecr 1309427846], length 100
15:43:09.471735 IP 138.197.151.74.ssh > 138.68.255.152.34008: Flags [.], ack 678, win 507, options [nop,nop,TS val 1309427974 ecr 2521880306], length 0
15:43:10.645516 IP 138.197.151.74.ssh > 119.45.194.246.47830: Flags [P.], seq 1430:1498, ack 662, win 507, options [nop,nop,TS val 1297223298 ecr 3678846266], length 68
15:43:10.838350 IP 119.45.194.246.47830 > 138.197.151.74.ssh: Flags [P.], seq 662:714, ack 1498, win 501, options [nop,nop,TS val 3678850077 ecr 1297223298], length 52
15:43:10.838427 IP 138.197.151.74.ssh > 119.45.194.246.47830: Flags [.], ack 714, win 507, options [nop,nop,TS val 1297223491 ecr 3678850077], length 0
15:43:10.838479 IP 119.45.194.246.47830 > 138.197.151.74.ssh: Flags [F.], seq 714, ack 1498, win 501, options [nop,nop,TS val 3678850077 ecr 1297223298], length 0
15:43:10.842595 IP 138.197.151.74.ssh > 119.45.194.246.47830: Flags [F.], seq 1498, ack 715, win 507, options [nop,nop,TS val 1297223495 ecr 3678850077], length 0
15:43:10.875091 IP 45.155.205.23.51083 > 138.197.151.74.9979: Flags [S], seq 387145377, win 1024, length 0
15:43:11.035391 IP 119.45.194.246.47830 > 138.197.151.74.ssh: Flags [.], ack 1499, win 501, options [nop,nop,TS val 3678850274 ecr 1297223495], length 0
15:43:12.236683 IP 138.197.151.74.ssh > 138.68.255.152.34008: Flags [P.], seq 1430:1498, ack 678, win 507, options [nop,nop,TS val 1309430739 ecr 2521880306], length 68
15:43:12.320523 IP 138.68.255.152.34008 > 138.197.151.74.ssh: Flags [P.], seq 678:730, ack 1498, win 262, options [nop,nop,TS val 2521883197 ecr 1309430739], length 52
15:43:12.320602 IP 138.197.151.74.ssh > 138.68.255.152.34008: Flags [.], ack 730, win 507, options [nop,nop,TS val 1309430823 ecr 2521883197], length 0
15:43:12.320648 IP 138.68.255.152.34008 > 138.197.151.74.ssh: Flags [F.], seq 730, ack 1498, win 262, options [nop,nop,TS val 2521883197 ecr 1309430739], length 0
15:43:12.324527 IP 138.197.151.74.ssh > 138.68.255.152.34008: Flags [F.], seq 1498, ack 731, win 507, options [nop,nop,TS val 1309430827 ecr 2521883197], length 0
15:43:12.408156 IP 138.68.255.152.34008 > 138.197.151.74.ssh: Flags [.], ack 1499, win 262, options [nop,nop,TS val 2521883285 ecr 1309430827], length 0
15:43:13.970937 IP 138.68.16.178.58989 > 138.197.151.74.6012: Flags [S], seq 1238415881, win 1024, length 0
15:43:17.569913 IP 45.155.205.23.51083 > 138.197.151.74.7370: Flags [S], seq 3168942439, win 1024, length 0
15:43:19.696673 IP 106.12.131.102.36294 > 138.197.151.74.ssh: Flags [S], seq 4135983495, win 29200, options [mss 1460,sackOK,TS val 2434484316 ecr 0,nop,wscale 7], length 0
15:43:19.696756 IP 138.197.151.74 > 106.12.131.102: ICMP 138.197.151.74 tcp port ssh unreachable, length 68
15:43:20.697823 IP 106.12.131.102.36294 > 138.197.151.74.ssh: Flags [S], seq 4135983495, win 29200, options [mss 1460,sackOK,TS val 2434485318 ecr 0,nop,wscale 7], length 0
15:43:20.697915 IP 138.197.151.74 > 106.12.131.102: ICMP 138.197.151.74 tcp port ssh unreachable, length 68
15:43:26.685649 IP 45.155.205.24.51091 > 138.197.151.74.11409: Flags [S], seq 168032330, win 1024, length 0
15:43:31.099804 IP 45.155.205.24.51091 > 138.197.151.74.10580: Flags [S], seq 2214009466, win 1024, length 0

