root@lamp-ubuntu-s-1vcpu-1gb-tor1-01:~# tcpdump -i eth0 tcp
tcpdump: verbose output suppressed, use -v or -vv for full protocol decode
listening on eth0, link-type EN10MB (Ethernet), capture size 262144 bytes
15:46:46.733357 IP 138.197.151.74.ssh > 24-212-207-43.cable.teksavvy.com.51275: Flags [P.], seq 2977965204:2977965312, ack 2227374602, win 501, length 108
15:46:46.733522 IP 138.197.151.74.ssh > 24-212-207-43.cable.teksavvy.com.51275: Flags [P.], seq 108:144, ack 1, win 501, length 36
15:46:46.733576 IP 138.197.151.74.ssh > 24-212-207-43.cable.teksavvy.com.51275: Flags [P.], seq 144:252, ack 1, win 501, length 108
15:46:46.733660 IP 138.197.151.74.ssh > 24-212-207-43.cable.teksavvy.com.51275: Flags [P.], seq 252:288, ack 1, win 501, length 36
15:46:46.743975 IP 24-212-207-43.cable.teksavvy.com.51275 > 138.197.151.74.ssh: Flags [.], ack 288, win 18770, length 0
15:46:46.772404 IP 138.197.151.74.ssh > 24-212-207-43.cable.teksavvy.com.51275: Flags [P.], seq 288:476, ack 1, win 501, length 188
15:46:46.772535 IP 138.197.151.74.ssh > 24-212-207-43.cable.teksavvy.com.51275: Flags [P.], seq 476:512, ack 1, win 501, length 36
15:46:46.772694 IP 138.197.151.74.ssh > 24-212-207-43.cable.teksavvy.com.51275: Flags [P.], seq 512:676, ack 1, win 501, length 164
15:46:46.772776 IP 138.197.151.74.ssh > 24-212-207-43.cable.teksavvy.com.51275: Flags [P.], seq 676:712, ack 1, win 501, length 36
15:46:46.772888 IP 138.197.151.74.ssh > 24-212-207-43.cable.teksavvy.com.51275: Flags [P.], seq 712:884, ack 1, win 501, length 172
15:46:46.772970 IP 138.197.151.74.ssh > 24-212-207-43.cable.teksavvy.com.51275: Flags [P.], seq 884:920, ack 1, win 501, length 36
15:46:46.773080 IP 138.197.151.74.ssh > 24-212-207-43.cable.teksavvy.com.51275: Flags [P.], seq 920:1084, ack 1, win 501, length 164
15:46:46.773164 IP 138.197.151.74.ssh > 24-212-207-43.cable.teksavvy.com.51275: Flags [P.], seq 1084:1120, ack 1, win 501, length 36
15:46:46.773273 IP 138.197.151.74.ssh > 24-212-207-43.cable.teksavvy.com.51275: Flags [P.], seq 1120:1276, ack 1, win 501, length 156
15:46:46.773357 IP 138.197.151.74.ssh > 24-212-207-43.cable.teksavvy.com.51275: Flags [P.], seq 1276:1312, ack 1, win 501, length 36
15:46:46.784619 IP 24-212-207-43.cable.teksavvy.com.51275 > 138.197.151.74.ssh: Flags [.], ack 1276, win 18773, length 0
15:46:46.784712 IP 138.197.151.74.ssh > 24-212-207-43.cable.teksavvy.com.51275: Flags [P.], seq 1312:3368, ack 1, win 501, length 2056
15:46:46.784909 IP 138.197.151.74.ssh > 24-212-207-43.cable.teksavvy.com.51275: Flags [P.], seq 3368:3524, ack 1, win 501, length 156
15:46:46.785041 IP 138.197.151.74.ssh > 24-212-207-43.cable.teksavvy.com.51275: Flags [P.], seq 3524:3560, ack 1, win 501, length 36
15:46:46.785200 IP 138.197.151.74.ssh > 24-212-207-43.cable.teksavvy.com.51275: Flags [P.], seq 3560:3732, ack 1, win 501, length 172
15:46:46.785301 IP 138.197.151.74.ssh > 24-212-207-43.cable.teksavvy.com.51275: Flags [P.], seq 3732:3768, ack 1, win 501, length 36
15:46:46.785459 IP 138.197.151.74.ssh > 24-212-207-43.cable.teksavvy.com.51275: Flags [P.], seq 3768:3940, ack 1, win 501, length 172
15:46:46.785579 IP 138.197.151.74.ssh > 24-212-207-43.cable.teksavvy.com.51275: Flags [P.], seq 3940:3976, ack 1, win 501, length 36
15:46:46.785714 IP 138.197.151.74.ssh > 24-212-207-43.cable.teksavvy.com.51275: Flags [P.], seq 3976:4148, ack 1, win 501, length 172
15:46:46.785809 IP 138.197.151.74.ssh > 24-212-207-43.cable.teksavvy.com.51275: Flags [P.], seq 4148:4184, ack 1, win 501, length 36
15:46:46.785924 IP 138.197.151.74.ssh > 24-212-207-43.cable.teksavvy.com.51275: Flags [P.], seq 4184:4356, ack 1, win 501, length 172
15:46:46.786012 IP 138.197.151.74.ssh > 24-212-207-43.cable.teksavvy.com.51275: Flags [P.], seq 4356:4392, ack 1, win 501, length 36
15:46:46.786163 IP 138.197.151.74.ssh > 24-212-207-43.cable.teksavvy.com.51275: Flags [P.], seq 4392:4564, ack 1, win 501, length 172
15:46:46.786262 IP 138.197.151.74.ssh > 24-212-207-43.cable.teksavvy.com.51275: Flags [P.], seq 4564:4600, ack 1, win 501, length 36
15:46:46.786393 IP 138.197.151.74.ssh > 24-212-207-43.cable.teksavvy.com.51275: Flags [P.], seq 4600:4772, ack 1, win 501, length 172
15:46:46.786510 IP 138.197.151.74.ssh > 24-212-207-43.cable.teksavvy.com.51275: Flags [P.], seq 4772:4808, ack 1, win 501, length 36
15:46:46.786668 IP 138.197.151.74.ssh > 24-212-207-43.cable.teksavvy.com.51275: Flags [P.], seq 4808:4980, ack 1, win 501, length 172
15:46:46.786766 IP 138.197.151.74.ssh > 24-212-207-43.cable.teksavvy.com.51275: Flags [P.], seq 4980:5016, ack 1, win 501, length 36
15:46:46.798005 IP 24-212-207-43.cable.teksavvy.com.51275 > 138.197.151.74.ssh: Flags [.], ack 4184, win 18769, length 0
15:46:46.798073 IP 138.197.151.74.ssh > 24-212-207-43.cable.teksavvy.com.51275: Flags [P.], seq 5016:7096, ack 1, win 501, length 2080
15:46:46.798280 IP 138.197.151.74.ssh > 24-212-207-43.cable.teksavvy.com.51275: Flags [P.], seq 7096:7252, ack 1, win 501, length 156
15:46:46.798395 IP 138.197.151.74.ssh > 24-212-207-43.cable.teksavvy.com.51275: Flags [P.], seq 7252:7288, ack 1, win 501, length 36
15:46:46.798546 IP 138.197.151.74.ssh > 24-212-207-43.cable.teksavvy.com.51275: Flags [P.], seq 7288:7460, ack 1, win 501, length 172
15:46:46.798595 IP 24-212-207-43.cable.teksavvy.com.51275 > 138.197.151.74.ssh: Flags [.], ack 5016, win 18772, length 0
15:46:46.798682 IP 138.197.151.74.ssh > 24-212-207-43.cable.teksavvy.com.51275: Flags [P.], seq 7460:7496, ack 1, win 501, length 36
15:46:46.798803 IP 138.197.151.74.ssh > 24-212-207-43.cable.teksavvy.com.51275: Flags [P.], seq 7496:7668, ack 1, win 501, length 172
15:46:46.798891 IP 138.197.151.74.ssh > 24-212-207-43.cable.teksavvy.com.51275: Flags [P.], seq 7668:7704, ack 1, win 501, length 36
15:46:46.799061 IP 138.197.151.74.ssh > 24-212-207-43.cable.teksavvy.com.51275: Flags [P.], seq 7704:7876, ack 1, win 501, length 172
15:46:46.799203 IP 138.197.151.74.ssh > 24-212-207-43.cable.teksavvy.com.51275: Flags [P.], seq 7876:7912, ack 1, win 501, length 36
15:46:46.799350 IP 138.197.151.74.ssh > 24-212-207-43.cable.teksavvy.com.51275: Flags [P.], seq 7912:8084, ack 1, win 501, length 172
15:46:46.799461 IP 138.197.151.74.ssh > 24-212-207-43.cable.teksavvy.com.51275: Flags [P.], seq 8084:8120, ack 1, win 501, length 36
15:46:46.799706 IP 138.197.151.74.ssh > 24-212-207-43.cable.teksavvy.com.51275: Flags [P.], seq 8120:8276, ack 1, win 501, length 156
15:46:46.799817 IP 138.197.151.74.ssh > 24-212-207-43.cable.teksavvy.com.51275: Flags [P.], seq 8276:8312, ack 1, win 501, length 36
15:46:46.799931 IP 138.197.151.74.ssh > 24-212-207-43.cable.teksavvy.com.51275: Flags [P.], seq 8312:8484, ack 1, win 501, length 172
15:46:46.800015 IP 138.197.151.74.ssh > 24-212-207-43.cable.teksavvy.com.51275: Flags [P.], seq 8484:8520, ack 1, win 501, length 36
15:46:46.800126 IP 138.197.151.74.ssh > 24-212-207-43.cable.teksavvy.com.51275: Flags [P.], seq 8520:8692, ack 1, win 501, length 172
15:46:46.800216 IP 138.197.151.74.ssh > 24-212-207-43.cable.teksavvy.com.51275: Flags [P.], seq 8692:8728, ack 1, win 501, length 36
15:46:46.800350 IP 138.197.151.74.ssh > 24-212-207-43.cable.teksavvy.com.51275: Flags [P.], seq 8728:8900, ack 1, win 501, length 172
15:46:46.800461 IP 138.197.151.74.ssh > 24-212-207-43.cable.teksavvy.com.51275: Flags [P.], seq 8900:8936, ack 1, win 501, length 36
15:46:46.800572 IP 138.197.151.74.ssh > 24-212-207-43.cable.teksavvy.com.51275: Flags [P.], seq 8936:9108, ack 1, win 501, length 172
15:46:46.800682 IP 138.197.151.74.ssh > 24-212-207-43.cable.teksavvy.com.51275: Flags [P.], seq 9108:9144, ack 1, win 501, length 36
15:46:46.800816 IP 138.197.151.74.ssh > 24-212-207-43.cable.teksavvy.com.51275: Flags [P.], seq 9144:9316, ack 1, win 501, length 172
15:46:46.801007 IP 138.197.151.74.ssh > 24-212-207-43.cable.teksavvy.com.51275: Flags [P.], seq 9316:9896, ack 1, win 501, length 580
15:46:46.801397 IP 138.197.151.74.ssh > 24-212-207-43.cable.teksavvy.com.51275: Flags [P.], seq 9896:11276, ack 1, win 501, length 1380
15:46:46.801539 IP 138.197.151.74.ssh > 24-212-207-43.cable.teksavvy.com.51275: Flags [P.], seq 11276:11448, ack 1, win 501, length 172
15:46:46.801665 IP 138.197.151.74.ssh > 24-212-207-43.cable.teksavvy.com.51275: Flags [P.], seq 11448:11620, ack 1, win 501, length 172
15:46:46.801803 IP 138.197.151.74.ssh > 24-212-207-43.cable.teksavvy.com.51275: Flags [P.], seq 11620:11792, ack 1, win 501, length 172
15:46:46.801934 IP 138.197.151.74.ssh > 24-212-207-43.cable.teksavvy.com.51275: Flags [P.], seq 11792:11964, ack 1, win 501, length 172
15:46:46.802070 IP 138.197.151.74.ssh > 24-212-207-43.cable.teksavvy.com.51275: Flags [P.], seq 11964:12136, ack 1, win 501, length 172
15:46:46.802202 IP 138.197.151.74.ssh > 24-212-207-43.cable.teksavvy.com.51275: Flags [P.], seq 12136:12308, ack 1, win 501, length 172
15:46:46.802338 IP 138.197.151.74.ssh > 24-212-207-43.cable.teksavvy.com.51275: Flags [P.], seq 12308:12480, ack 1, win 501, length 172
15:46:46.802470 IP 138.197.151.74.ssh > 24-212-207-43.cable.teksavvy.com.51275: Flags [P.], seq 12480:12652, ack 1, win 501, length 172
15:46:46.802636 IP 138.197.151.74.ssh > 24-212-207-43.cable.teksavvy.com.51275: Flags [P.], seq 12652:12824, ack 1, win 501, length 172
15:46:46.802772 IP 138.197.151.74.ssh > 24-212-207-43.cable.teksavvy.com.51275: Flags [P.], seq 12824:12996, ack 1, win 501, length 172
15:46:46.802907 IP 138.197.151.74.ssh > 24-212-207-43.cable.teksavvy.com.51275: Flags [P.], seq 12996:13168, ack 1, win 501, length 172
15:46:46.803089 IP 138.197.151.74.ssh > 24-212-207-43.cable.teksavvy.com.51275: Flags [P.], seq 13168:13340, ack 1, win 501, length 172
15:46:46.803228 IP 138.197.151.74.ssh > 24-212-207-43.cable.teksavvy.com.51275: Flags [P.], seq 13340:13512, ack 1, win 501, length 172
15:46:46.807166 IP 24-212-207-43.cable.teksavvy.com.51275 > 138.197.151.74.ssh: Flags [.], ack 7668, win 18770, length 0
15:46:46.807238 IP 138.197.151.74.ssh > 24-212-207-43.cable.teksavvy.com.51275: Flags [P.], seq 13512:13684, ack 1, win 501, length 172
15:46:46.807517 IP 138.197.151.74.ssh > 24-212-207-43.cable.teksavvy.com.51275: Flags [P.], seq 13684:13984, ack 1, win 501, length 300
15:46:46.807723 IP 138.197.151.74.ssh > 24-212-207-43.cable.teksavvy.com.51275: Flags [P.], seq 13984:14156, ack 1, win 501, length 172
15:46:46.807979 IP 138.197.151.74.ssh > 24-212-207-43.cable.teksavvy.com.51275: Flags [P.], seq 14156:14328, ack 1, win 501, length 172
15:46:46.808156 IP 138.197.151.74.ssh > 24-212-207-43.cable.teksavvy.com.51275: Flags [P.], seq 14328:14500, ack 1, win 501, length 172
15:46:46.808347 IP 138.197.151.74.ssh > 24-212-207-43.cable.teksavvy.com.51275: Flags [P.], seq 14500:14672, ack 1, win 501, length 172
15:46:46.808543 IP 138.197.151.74.ssh > 24-212-207-43.cable.teksavvy.com.51275: Flags [P.], seq 14672:14844, ack 1, win 501, length 172
15:46:46.808722 IP 138.197.151.74.ssh > 24-212-207-43.cable.teksavvy.com.51275: Flags [P.], seq 14844:15016, ack 1, win 501, length 172
15:46:46.808886 IP 138.197.151.74.ssh > 24-212-207-43.cable.teksavvy.com.51275: Flags [P.], seq 15016:15188, ack 1, win 501, length 172
15:46:46.809054 IP 138.197.151.74.ssh > 24-212-207-43.cable.teksavvy.com.51275: Flags [P.], seq 15188:15360, ack 1, win 501, length 172
15:46:46.809187 IP 138.197.151.74.ssh > 24-212-207-43.cable.teksavvy.com.51275: Flags [P.], seq 15360:15532, ack 1, win 501, length 172
15:46:46.809360 IP 138.197.151.74.ssh > 24-212-207-43.cable.teksavvy.com.51275: Flags [P.], seq 15532:15704, ack 1, win 501, length 172
15:46:46.809505 IP 138.197.151.74.ssh > 24-212-207-43.cable.teksavvy.com.51275: Flags [P.], seq 15704:15876, ack 1, win 501, length 172
15:46:46.809648 IP 138.197.151.74.ssh > 24-212-207-43.cable.teksavvy.com.51275: Flags [P.], seq 15876:16048, ack 1, win 501, length 172
15:46:46.812130 IP 24-212-207-43.cable.teksavvy.com.51275 > 138.197.151.74.ssh: Flags [.], ack 9108, win 18770, length 0
15:46:46.812187 IP 138.197.151.74.ssh > 24-212-207-43.cable.teksavvy.com.51275: Flags [P.], seq 16048:16220, ack 1, win 501, length 172
15:46:46.812212 IP 24-212-207-43.cable.teksavvy.com.51275 > 138.197.151.74.ssh: Flags [.], ack 12824, win 18770, length 0
15:46:46.812447 IP 138.197.151.74.ssh > 24-212-207-43.cable.teksavvy.com.51275: Flags [P.], seq 16220:16640, ack 1, win 501, length 420
15:46:46.812592 IP 138.197.151.74.ssh > 24-212-207-43.cable.teksavvy.com.51275: Flags [P.], seq 16640:16812, ack 1, win 501, length 172
15:46:46.812637 IP 24-212-207-43.cable.teksavvy.com.51275 > 138.197.151.74.ssh: Flags [.], ack 13340, win 18774, length 0
15:46:46.812780 IP 138.197.151.74.ssh > 24-212-207-43.cable.teksavvy.com.51275: Flags [P.], seq 16812:17112, ack 1, win 501, length 300
15:46:46.812956 IP 138.197.151.74.ssh > 24-212-207-43.cable.teksavvy.com.51275: Flags [P.], seq 17112:17284, ack 1, win 501, length 172
15:46:46.813092 IP 138.197.151.74.ssh > 24-212-207-43.cable.teksavvy.com.51275: Flags [P.], seq 17284:17456, ack 1, win 501, length 172
15:46:46.813219 IP 138.197.151.74.ssh > 24-212-207-43.cable.teksavvy.com.51275: Flags [P.], seq 17456:17628, ack 1, win 501, length 172
15:46:46.813345 IP 138.197.151.74.ssh > 24-212-207-43.cable.teksavvy.com.51275: Flags [P.], seq 17628:17800, ack 1, win 501, length 172
15:46:46.813511 IP 138.197.151.74.ssh > 24-212-207-43.cable.teksavvy.com.51275: Flags [P.], seq 17800:17972, ack 1, win 501, length 172
15:46:46.813676 IP 138.197.151.74.ssh > 24-212-207-43.cable.teksavvy.com.51275: Flags [P.], seq 17972:18144, ack 1, win 501, length 172
15:46:46.813840 IP 138.197.151.74.ssh > 24-212-207-43.cable.teksavvy.com.51275: Flags [P.], seq 18144:18316, ack 1, win 501, length 172
15:46:46.814003 IP 138.197.151.74.ssh > 24-212-207-43.cable.teksavvy.com.51275: Flags [P.], seq 18316:18488, ack 1, win 501, length 172
15:46:46.814169 IP 138.197.151.74.ssh > 24-212-207-43.cable.teksavvy.com.51275: Flags [P.], seq 18488:18660, ack 1, win 501, length 172
15:46:46.814342 IP 138.197.151.74.ssh > 24-212-207-43.cable.teksavvy.com.51275: Flags [P.], seq 18660:18832, ack 1, win 501, length 172
15:46:46.814515 IP 138.197.151.74.ssh > 24-212-207-43.cable.teksavvy.com.51275: Flags [P.], seq 18832:19004, ack 1, win 501, length 172
15:46:46.814680 IP 138.197.151.74.ssh > 24-212-207-43.cable.teksavvy.com.51275: Flags [P.], seq 19004:19176, ack 1, win 501, length 172
15:46:46.814849 IP 138.197.151.74.ssh > 24-212-207-43.cable.teksavvy.com.51275: Flags [P.], seq 19176:19348, ack 1, win 501, length 172
15:46:46.815062 IP 138.197.151.74.ssh > 24-212-207-43.cable.teksavvy.com.51275: Flags [P.], seq 19348:19520, ack 1, win 501, length 172
15:46:46.815228 IP 138.197.151.74.ssh > 24-212-207-43.cable.teksavvy.com.51275: Flags [P.], seq 19520:19692, ack 1, win 501, length 172
15:46:46.815395 IP 138.197.151.74.ssh > 24-212-207-43.cable.teksavvy.com.51275: Flags [P.], seq 19692:19864, ack 1, win 501, length 172
15:46:46.815448 IP 24-212-207-43.cable.teksavvy.com.51275 > 138.197.151.74.ssh: Flags [.], ack 13684, win 18773, length 0
15:46:46.815678 IP 138.197.151.74.ssh > 24-212-207-43.cable.teksavvy.com.51275: Flags [P.], seq 19864:20164, ack 1, win 501, length 300
15:46:46.815844 IP 138.197.151.74.ssh > 24-212-207-43.cable.teksavvy.com.51275: Flags [P.], seq 20164:20336, ack 1, win 501, length 172
15:46:46.816035 IP 138.197.151.74.ssh > 24-212-207-43.cable.teksavvy.com.51275: Flags [P.], seq 20336:20508, ack 1, win 501, length 172
15:46:46.816188 IP 138.197.151.74.ssh > 24-212-207-43.cable.teksavvy.com.51275: Flags [P.], seq 20508:20680, ack 1, win 501, length 172
15:46:46.816327 IP 138.197.151.74.ssh > 24-212-207-43.cable.teksavvy.com.51275: Flags [P.], seq 20680:20852, ack 1, win 501, length 172
15:46:46.816492 IP 138.197.151.74.ssh > 24-212-207-43.cable.teksavvy.com.51275: Flags [P.], seq 20852:21024, ack 1, win 501, length 172
15:46:46.816660 IP 138.197.151.74.ssh > 24-212-207-43.cable.teksavvy.com.51275: Flags [P.], seq 21024:21196, ack 1, win 501, length 172
15:46:46.816831 IP 138.197.151.74.ssh > 24-212-207-43.cable.teksavvy.com.51275: Flags [P.], seq 21196:21368, ack 1, win 501, length 172
15:46:46.816965 IP 138.197.151.74.ssh > 24-212-207-43.cable.teksavvy.com.51275: Flags [P.], seq 21368:21540, ack 1, win 501, length 172
15:46:46.817099 IP 138.197.151.74.ssh > 24-212-207-43.cable.teksavvy.com.51275: Flags [P.], seq 21540:21712, ack 1, win 501, length 172
15:46:46.817304 IP 138.197.151.74.ssh > 24-212-207-43.cable.teksavvy.com.51275: Flags [P.], seq 21712:21884, ack 1, win 501, length 172
15:46:46.817457 IP 138.197.151.74.ssh > 24-212-207-43.cable.teksavvy.com.51275: Flags [P.], seq 21884:22056, ack 1, win 501, length 172
15:46:46.817611 IP 138.197.151.74.ssh > 24-212-207-43.cable.teksavvy.com.51275: Flags [P.], seq 22056:22228, ack 1, win 501, length 172
15:46:46.817738 IP 138.197.151.74.ssh > 24-212-207-43.cable.teksavvy.com.51275: Flags [P.], seq 22228:22400, ack 1, win 501, length 172
15:46:46.817865 IP 138.197.151.74.ssh > 24-212-207-43.cable.teksavvy.com.51275: Flags [P.], seq 22400:22572, ack 1, win 501, length 172
15:46:46.817988 IP 138.197.151.74.ssh > 24-212-207-43.cable.teksavvy.com.51275: Flags [P.], seq 22572:22744, ack 1, win 501, length 172
15:46:46.818119 IP 138.197.151.74.ssh > 24-212-207-43.cable.teksavvy.com.51275: Flags [P.], seq 22744:22916, ack 1, win 501, length 172
15:46:46.818301 IP 138.197.151.74.ssh > 24-212-207-43.cable.teksavvy.com.51275: Flags [P.], seq 22916:23088, ack 1, win 501, length 172
15:46:46.818496 IP 138.197.151.74.ssh > 24-212-207-43.cable.teksavvy.com.51275: Flags [P.], seq 23088:23260, ack 1, win 501, length 172
15:46:46.818672 IP 138.197.151.74.ssh > 24-212-207-43.cable.teksavvy.com.51275: Flags [P.], seq 23260:23432, ack 1, win 501, length 172
15:46:46.818861 IP 138.197.151.74.ssh > 24-212-207-43.cable.teksavvy.com.51275: Flags [P.], seq 23432:23604, ack 1, win 501, length 172
15:46:46.819072 IP 138.197.151.74.ssh > 24-212-207-43.cable.teksavvy.com.51275: Flags [P.], seq 23604:23776, ack 1, win 501, length 172
15:46:46.819247 IP 138.197.151.74.ssh > 24-212-207-43.cable.teksavvy.com.51275: Flags [P.], seq 23776:23948, ack 1, win 501, length 172
15:46:46.819419 IP 138.197.151.74.ssh > 24-212-207-43.cable.teksavvy.com.51275: Flags [P.], seq 23948:24120, ack 1, win 501, length 172
15:46:46.819636 IP 138.197.151.74.ssh > 24-212-207-43.cable.teksavvy.com.51275: Flags [P.], seq 24120:24292, ack 1, win 501, length 172
15:46:46.819805 IP 138.197.151.74.ssh > 24-212-207-43.cable.teksavvy.com.51275: Flags [P.], seq 24292:24464, ack 1, win 501, length 172
15:46:46.819972 IP 138.197.151.74.ssh > 24-212-207-43.cable.teksavvy.com.51275: Flags [P.], seq 24464:24636, ack 1, win 501, length 172
15:46:46.820151 IP 138.197.151.74.ssh > 24-212-207-43.cable.teksavvy.com.51275: Flags [P.], seq 24636:24808, ack 1, win 501, length 172
15:46:46.820330 IP 138.197.151.74.ssh > 24-212-207-43.cable.teksavvy.com.51275: Flags [P.], seq 24808:24980, ack 1, win 501, length 172
15:46:46.820521 IP 138.197.151.74.ssh > 24-212-207-43.cable.teksavvy.com.51275: Flags [P.], seq 24980:25152, ack 1, win 501, length 172
15:46:46.820705 IP 138.197.151.74.ssh > 24-212-207-43.cable.teksavvy.com.51275: Flags [P.], seq 25152:25324, ack 1, win 501, length 172
15:46:46.820884 IP 138.197.151.74.ssh > 24-212-207-43.cable.teksavvy.com.51275: Flags [P.], seq 25324:25496, ack 1, win 501, length 172
15:46:46.821065 IP 138.197.151.74.ssh > 24-212-207-43.cable.teksavvy.com.51275: Flags [P.], seq 25496:25668, ack 1, win 501, length 172
15:46:46.821247 IP 138.197.151.74.ssh > 24-212-207-43.cable.teksavvy.com.51275: Flags [P.], seq 25668:25840, ack 1, win 501, length 172
15:46:46.821432 IP 138.197.151.74.ssh > 24-212-207-43.cable.teksavvy.com.51275: Flags [P.], seq 25840:26012, ack 1, win 501, length 172
15:46:46.821639 IP 138.197.151.74.ssh > 24-212-207-43.cable.teksavvy.com.51275: Flags [P.], seq 26012:26184, ack 1, win 501, length 172
15:46:46.821821 IP 138.197.151.74.ssh > 24-212-207-43.cable.teksavvy.com.51275: Flags [P.], seq 26184:26356, ack 1, win 501, length 172
15:46:46.822017 IP 138.197.151.74.ssh > 24-212-207-43.cable.teksavvy.com.51275: Flags [P.], seq 26356:26528, ack 1, win 501, length 172
15:46:46.822205 IP 138.197.151.74.ssh > 24-212-207-43.cable.teksavvy.com.51275: Flags [P.], seq 26528:26700, ack 1, win 501, length 172
15:46:46.822363 IP 138.197.151.74.ssh > 24-212-207-43.cable.teksavvy.com.51275: Flags [P.], seq 26700:26872, ack 1, win 501, length 172
15:46:46.822490 IP 138.197.151.74.ssh > 24-212-207-43.cable.teksavvy.com.51275: Flags [P.], seq 26872:27044, ack 1, win 501, length 172
15:46:46.822616 IP 138.197.151.74.ssh > 24-212-207-43.cable.teksavvy.com.51275: Flags [P.], seq 27044:27216, ack 1, win 501, length 172
15:46:46.822756 IP 138.197.151.74.ssh > 24-212-207-43.cable.teksavvy.com.51275: Flags [P.], seq 27216:27388, ack 1, win 501, length 172
15:46:46.822882 IP 138.197.151.74.ssh > 24-212-207-43.cable.teksavvy.com.51275: Flags [P.], seq 27388:27560, ack 1, win 501, length 172
15:46:46.822995 IP 24-212-207-43.cable.teksavvy.com.51275 > 138.197.151.74.ssh: Flags [.], ack 16220, win 18769, length 0
15:46:46.823097 IP 138.197.151.74.ssh > 24-212-207-43.cable.teksavvy.com.51275: Flags [P.], seq 27560:27732, ack 1, win 501, length 172
15:46:46.823251 IP 138.197.151.74.ssh > 24-212-207-43.cable.teksavvy.com.51275: Flags [P.], seq 27732:28032, ack 1, win 501, length 300
15:46:46.823381 IP 138.197.151.74.ssh > 24-212-207-43.cable.teksavvy.com.51275: Flags [P.], seq 28032:28204, ack 1, win 501, length 172
15:46:46.823507 IP 138.197.151.74.ssh > 24-212-207-43.cable.teksavvy.com.51275: Flags [P.], seq 28204:28376, ack 1, win 501, length 172
15:46:46.823734 IP 138.197.151.74.ssh > 24-212-207-43.cable.teksavvy.com.51275: Flags [P.], seq 28376:28548, ack 1, win 501, length 172
15:46:46.823868 IP 138.197.151.74.ssh > 24-212-207-43.cable.teksavvy.com.51275: Flags [P.], seq 28548:28720, ack 1, win 501, length 172
15:46:46.823995 IP 138.197.151.74.ssh > 24-212-207-43.cable.teksavvy.com.51275: Flags [P.], seq 28720:28892, ack 1, win 501, length 172
15:46:46.824172 IP 138.197.151.74.ssh > 24-212-207-43.cable.teksavvy.com.51275: Flags [P.], seq 28892:29064, ack 1, win 501, length 172
15:46:46.824308 IP 138.197.151.74.ssh > 24-212-207-43.cable.teksavvy.com.51275: Flags [P.], seq 29064:29236, ack 1, win 501, length 172
15:46:46.824441 IP 138.197.151.74.ssh > 24-212-207-43.cable.teksavvy.com.51275: Flags [P.], seq 29236:29408, ack 1, win 501, length 172
15:46:46.824568 IP 138.197.151.74.ssh > 24-212-207-43.cable.teksavvy.com.51275: Flags [P.], seq 29408:29580, ack 1, win 501, length 172
15:46:46.824656 IP 24-212-207-43.cable.teksavvy.com.51275 > 138.197.151.74.ssh: Flags [.], ack 19004, win 18774, length 0
15:46:46.824796 IP 138.197.151.74.ssh > 24-212-207-43.cable.teksavvy.com.51275: Flags [P.], seq 29580:29880, ack 1, win 501, length 300
15:46:46.824978 IP 138.197.151.74.ssh > 24-212-207-43.cable.teksavvy.com.51275: Flags [P.], seq 29880:30052, ack 1, win 501, length 172
15:46:46.825152 IP 138.197.151.74.ssh > 24-212-207-43.cable.teksavvy.com.51275: Flags [P.], seq 30052:30224, ack 1, win 501, length 172
15:46:46.825324 IP 138.197.151.74.ssh > 24-212-207-43.cable.teksavvy.com.51275: Flags [P.], seq 30224:30396, ack 1, win 501, length 172
15:46:46.825497 IP 138.197.151.74.ssh > 24-212-207-43.cable.teksavvy.com.51275: Flags [P.], seq 30396:30568, ack 1, win 501, length 172
15:46:46.825687 IP 138.197.151.74.ssh > 24-212-207-43.cable.teksavvy.com.51275: Flags [P.], seq 30568:30740, ack 1, win 501, length 172
15:46:46.825886 IP 138.197.151.74.ssh > 24-212-207-43.cable.teksavvy.com.51275: Flags [P.], seq 30740:30912, ack 1, win 501, length 172
15:46:46.826105 IP 138.197.151.74.ssh > 24-212-207-43.cable.teksavvy.com.51275: Flags [P.], seq 30912:31084, ack 1, win 501, length 172
15:46:46.826304 IP 138.197.151.74.ssh > 24-212-207-43.cable.teksavvy.com.51275: Flags [P.], seq 31084:31256, ack 1, win 501, length 172
15:46:46.826457 IP 138.197.151.74.ssh > 24-212-207-43.cable.teksavvy.com.51275: Flags [P.], seq 31256:31428, ack 1, win 501, length 172
15:46:46.826585 IP 138.197.151.74.ssh > 24-212-207-43.cable.teksavvy.com.51275: Flags [P.], seq 31428:31600, ack 1, win 501, length 172
15:46:46.826721 IP 138.197.151.74.ssh > 24-212-207-43.cable.teksavvy.com.51275: Flags [P.], seq 31600:31772, ack 1, win 501, length 172
15:46:46.826849 IP 138.197.151.74.ssh > 24-212-207-43.cable.teksavvy.com.51275: Flags [P.], seq 31772:31944, ack 1, win 501, length 172
15:46:46.826978 IP 138.197.151.74.ssh > 24-212-207-43.cable.teksavvy.com.51275: Flags [P.], seq 31944:32116, ack 1, win 501, length 172
15:46:46.827144 IP 138.197.151.74.ssh > 24-212-207-43.cable.teksavvy.com.51275: Flags [P.], seq 32116:32288, ack 1, win 501, length 172
15:46:46.827280 IP 138.197.151.74.ssh > 24-212-207-43.cable.teksavvy.com.51275: Flags [P.], seq 32288:32460, ack 1, win 501, length 172
15:46:46.827401 IP 138.197.151.74.ssh > 24-212-207-43.cable.teksavvy.com.51275: Flags [P.], seq 32460:32632, ack 1, win 501, length 172
15:46:46.827519 IP 24-212-207-43.cable.teksavvy.com.51275 > 138.197.151.74.ssh: Flags [.], ack 20852, win 18772, length 0
15:46:46.827663 IP 138.197.151.74.ssh > 24-212-207-43.cable.teksavvy.com.51275: Flags [P.], seq 32632:32932, ack 1, win 501, length 300
15:46:46.827807 IP 138.197.151.74.ssh > 24-212-207-43.cable.teksavvy.com.51275: Flags [P.], seq 32932:33104, ack 1, win 501, length 172
15:46:46.827945 IP 138.197.151.74.ssh > 24-212-207-43.cable.teksavvy.com.51275: Flags [P.], seq 33104:33276, ack 1, win 501, length 172
15:46:46.828101 IP 138.197.151.74.ssh > 24-212-207-43.cable.teksavvy.com.51275: Flags [P.], seq 33276:33448, ack 1, win 501, length 172
15:46:46.828298 IP 138.197.151.74.ssh > 24-212-207-43.cable.teksavvy.com.51275: Flags [P.], seq 33448:33620, ack 1, win 501, length 172
15:46:46.828439 IP 138.197.151.74.ssh > 24-212-207-43.cable.teksavvy.com.51275: Flags [P.], seq 33620:33792, ack 1, win 501, length 172
15:46:46.828682 IP 138.197.151.74.ssh > 24-212-207-43.cable.teksavvy.com.51275: Flags [P.], seq 33792:33964, ack 1, win 501, length 172
15:46:46.828818 IP 138.197.151.74.ssh > 24-212-207-43.cable.teksavvy.com.51275: Flags [P.], seq 33964:34136, ack 1, win 501, length 172
15:46:46.828953 IP 138.197.151.74.ssh > 24-212-207-43.cable.teksavvy.com.51275: Flags [P.], seq 34136:34308, ack 1, win 501, length 172
15:46:46.829095 IP 138.197.151.74.ssh > 24-212-207-43.cable.teksavvy.com.51275: Flags [P.], seq 34308:34480, ack 1, win 501, length 172
15:46:46.829218 IP 138.197.151.74.ssh > 24-212-207-43.cable.teksavvy.com.51275: Flags [P.], seq 34480:34652, ack 1, win 501, length 172
15:46:46.829357 IP 138.197.151.74.ssh > 24-212-207-43.cable.teksavvy.com.51275: Flags [P.], seq 34652:34824, ack 1, win 501, length 172
15:46:46.829483 IP 138.197.151.74.ssh > 24-212-207-43.cable.teksavvy.com.51275: Flags [P.], seq 34824:34996, ack 1, win 501, length 172
15:46:46.829605 IP 138.197.151.74.ssh > 24-212-207-43.cable.teksavvy.com.51275: Flags [P.], seq 34996:35168, ack 1, win 501, length 172
15:46:46.829731 IP 138.197.151.74.ssh > 24-212-207-43.cable.teksavvy.com.51275: Flags [P.], seq 35168:35340, ack 1, win 501, length 172
15:46:46.829854 IP 138.197.151.74.ssh > 24-212-207-43.cable.teksavvy.com.51275: Flags [P.], seq 35340:35512, ack 1, win 501, length 172
15:46:46.830000 IP 138.197.151.74.ssh > 24-212-207-43.cable.teksavvy.com.51275: Flags [P.], seq 35512:35684, ack 1, win 501, length 172
15:46:46.830126 IP 138.197.151.74.ssh > 24-212-207-43.cable.teksavvy.com.51275: Flags [P.], seq 35684:35856, ack 1, win 501, length 172
15:46:46.830250 IP 138.197.151.74.ssh > 24-212-207-43.cable.teksavvy.com.51275: Flags [P.], seq 35856:36028, ack 1, win 501, length 172
15:46:46.830371 IP 138.197.151.74.ssh > 24-212-207-43.cable.teksavvy.com.51275: Flags [P.], seq 36028:36200, ack 1, win 501, length 172
15:46:46.830498 IP 138.197.151.74.ssh > 24-212-207-43.cable.teksavvy.com.51275: Flags [P.], seq 36200:36372, ack 1, win 501, length 172
15:46:46.830620 IP 138.197.151.74.ssh > 24-212-207-43.cable.teksavvy.com.51275: Flags [P.], seq 36372:36544, ack 1, win 501, length 172
15:46:46.830772 IP 138.197.151.74.ssh > 24-212-207-43.cable.teksavvy.com.51275: Flags [P.], seq 36544:36716, ack 1, win 501, length 172
15:46:46.830914 IP 138.197.151.74.ssh > 24-212-207-43.cable.teksavvy.com.51275: Flags [P.], seq 36716:36888, ack 1, win 501, length 172
15:46:46.831091 IP 138.197.151.74.ssh > 24-212-207-43.cable.teksavvy.com.51275: Flags [P.], seq 36888:37060, ack 1, win 501, length 172
15:46:46.831233 IP 138.197.151.74.ssh > 24-212-207-43.cable.teksavvy.com.51275: Flags [P.], seq 37060:37232, ack 1, win 501, length 172
15:46:46.831363 IP 138.197.151.74.ssh > 24-212-207-43.cable.teksavvy.com.51275: Flags [P.], seq 37232:37404, ack 1, win 501, length 172
15:46:46.831422 IP 24-212-207-43.cable.teksavvy.com.51275 > 138.197.151.74.ssh: Flags [.], ack 24636, win 18771, length 0
15:46:46.831568 IP 138.197.151.74.ssh > 24-212-207-43.cable.teksavvy.com.51275: Flags [P.], seq 37404:37704, ack 1, win 501, length 300
15:46:46.831722 IP 138.197.151.74.ssh > 24-212-207-43.cable.teksavvy.com.51275: Flags [P.], seq 37704:37876, ack 1, win 501, length 172
15:46:46.831850 IP 138.197.151.74.ssh > 24-212-207-43.cable.teksavvy.com.51275: Flags [P.], seq 37876:38048, ack 1, win 501, length 172
15:46:46.831976 IP 138.197.151.74.ssh > 24-212-207-43.cable.teksavvy.com.51275: Flags [P.], seq 38048:38220, ack 1, win 501, length 172
15:46:46.832107 IP 138.197.151.74.ssh > 24-212-207-43.cable.teksavvy.com.51275: Flags [P.], seq 38220:38392, ack 1, win 501, length 172
15:46:46.832229 IP 138.197.151.74.ssh > 24-212-207-43.cable.teksavvy.com.51275: Flags [P.], seq 38392:38564, ack 1, win 501, length 172
15:46:46.832363 IP 138.197.151.74.ssh > 24-212-207-43.cable.teksavvy.com.51275: Flags [P.], seq 38564:38736, ack 1, win 501, length 172
15:46:46.832486 IP 138.197.151.74.ssh > 24-212-207-43.cable.teksavvy.com.51275: Flags [P.], seq 38736:38908, ack 1, win 501, length 172
15:46:46.832612 IP 138.197.151.74.ssh > 24-212-207-43.cable.teksavvy.com.51275: Flags [P.], seq 38908:39080, ack 1, win 501, length 172
15:46:46.832737 IP 138.197.151.74.ssh > 24-212-207-43.cable.teksavvy.com.51275: Flags [P.], seq 39080:39252, ack 1, win 501, length 172
15:46:46.832858 IP 138.197.151.74.ssh > 24-212-207-43.cable.teksavvy.com.51275: Flags [P.], seq 39252:39424, ack 1, win 501, length 172
15:46:46.832980 IP 138.197.151.74.ssh > 24-212-207-43.cable.teksavvy.com.51275: Flags [P.], seq 39424:39596, ack 1, win 501, length 172
15:46:46.833103 IP 138.197.151.74.ssh > 24-212-207-43.cable.teksavvy.com.51275: Flags [P.], seq 39596:39768, ack 1, win 501, length 172
15:46:46.833234 IP 138.197.151.74.ssh > 24-212-207-43.cable.teksavvy.com.51275: Flags [P.], seq 39768:39940, ack 1, win 501, length 172
15:46:46.833359 IP 138.197.151.74.ssh > 24-212-207-43.cable.teksavvy.com.51275: Flags [P.], seq 39940:40112, ack 1, win 501, length 172
15:46:46.833481 IP 138.197.151.74.ssh > 24-212-207-43.cable.teksavvy.com.51275: Flags [P.], seq 40112:40284, ack 1, win 501, length 172
15:46:46.833600 IP 138.197.151.74.ssh > 24-212-207-43.cable.teksavvy.com.51275: Flags [P.], seq 40284:40456, ack 1, win 501, length 172
15:46:46.833729 IP 138.197.151.74.ssh > 24-212-207-43.cable.teksavvy.com.51275: Flags [P.], seq 40456:40628, ack 1, win 501, length 172
15:46:46.833850 IP 138.197.151.74.ssh > 24-212-207-43.cable.teksavvy.com.51275: Flags [P.], seq 40628:40800, ack 1, win 501, length 172
15:46:46.833981 IP 138.197.151.74.ssh > 24-212-207-43.cable.teksavvy.com.51275: Flags [P.], seq 40800:40972, ack 1, win 501, length 172
15:46:46.834102 IP 138.197.151.74.ssh > 24-212-207-43.cable.teksavvy.com.51275: Flags [P.], seq 40972:41144, ack 1, win 501, length 172
15:46:46.834272 IP 138.197.151.74.ssh > 24-212-207-43.cable.teksavvy.com.51275: Flags [P.], seq 41144:41316, ack 1, win 501, length 172
15:46:46.834491 IP 138.197.151.74.ssh > 24-212-207-43.cable.teksavvy.com.51275: Flags [P.], seq 41316:41488, ack 1, win 501, length 172
15:46:46.834670 IP 138.197.151.74.ssh > 24-212-207-43.cable.teksavvy.com.51275: Flags [P.], seq 41488:41660, ack 1, win 501, length 172
15:46:46.834831 IP 138.197.151.74.ssh > 24-212-207-43.cable.teksavvy.com.51275: Flags [P.], seq 41660:41832, ack 1, win 501, length 172
15:46:46.834962 IP 138.197.151.74.ssh > 24-212-207-43.cable.teksavvy.com.51275: Flags [P.], seq 41832:42004, ack 1, win 501, length 172
15:46:46.835121 IP 138.197.151.74.ssh > 24-212-207-43.cable.teksavvy.com.51275: Flags [P.], seq 42004:42176, ack 1, win 501, length 172
15:46:46.835260 IP 138.197.151.74.ssh > 24-212-207-43.cable.teksavvy.com.51275: Flags [P.], seq 42176:42348, ack 1, win 501, length 172
15:46:46.835434 IP 138.197.151.74.ssh > 24-212-207-43.cable.teksavvy.com.51275: Flags [P.], seq 42348:42520, ack 1, win 501, length 172
15:46:46.835578 IP 138.197.151.74.ssh > 24-212-207-43.cable.teksavvy.com.51275: Flags [P.], seq 42520:42692, ack 1, win 501, length 172
15:46:46.835734 IP 138.197.151.74.ssh > 24-212-207-43.cable.teksavvy.com.51275: Flags [P.], seq 42692:42864, ack 1, win 501, length 172
15:46:46.835859 IP 138.197.151.74.ssh > 24-212-207-43.cable.teksavvy.com.51275: Flags [P.], seq 42864:43036, ack 1, win 501, length 172
15:46:46.836006 IP 138.197.151.74.ssh > 24-212-207-43.cable.teksavvy.com.51275: Flags [P.], seq 43036:43208, ack 1, win 501, length 172
15:46:46.836161 IP 138.197.151.74.ssh > 24-212-207-43.cable.teksavvy.com.51275: Flags [P.], seq 43208:43380, ack 1, win 501, length 172
15:46:46.836296 IP 138.197.151.74.ssh > 24-212-207-43.cable.teksavvy.com.51275: Flags [P.], seq 43380:43552, ack 1, win 501, length 172
15:46:46.836419 IP 138.197.151.74.ssh > 24-212-207-43.cable.teksavvy.com.51275: Flags [P.], seq 43552:43724, ack 1, win 501, length 172
15:46:46.836596 IP 138.197.151.74.ssh > 24-212-207-43.cable.teksavvy.com.51275: Flags [P.], seq 43724:43896, ack 1, win 501, length 172
15:46:46.836726 IP 138.197.151.74.ssh > 24-212-207-43.cable.teksavvy.com.51275: Flags [P.], seq 43896:44068, ack 1, win 501, length 172
15:46:46.837427 IP 24-212-207-43.cable.teksavvy.com.51275 > 138.197.151.74.ssh: Flags [.], ack 27044, win 18774, length 0
15:46:46.837476 IP 138.197.151.74.ssh > 24-212-207-43.cable.teksavvy.com.51275: Flags [P.], seq 44068:44240, ack 1, win 501, length 172
15:46:46.837514 IP 24-212-207-43.cable.teksavvy.com.51275 > 138.197.151.74.ssh: Flags [.], ack 31600, win 18772, length 0
15:46:46.837550 IP 24-212-207-43.cable.teksavvy.com.51275 > 138.197.151.74.ssh: Flags [.], ack 36028, win 18774, length 0
15:46:46.837764 IP 138.197.151.74.ssh > 24-212-207-43.cable.teksavvy.com.51275: Flags [P.], seq 44240:44780, ack 1, win 501, length 540
15:46:46.837899 IP 138.197.151.74.ssh > 24-212-207-43.cable.teksavvy.com.51275: Flags [P.], seq 44780:44952, ack 1, win 501, length 172
15:46:46.838028 IP 138.197.151.74.ssh > 24-212-207-43.cable.teksavvy.com.51275: Flags [P.], seq 44952:45124, ack 1, win 501, length 172
15:46:46.838150 IP 138.197.151.74.ssh > 24-212-207-43.cable.teksavvy.com.51275: Flags [P.], seq 45124:45296, ack 1, win 501, length 172
15:46:46.838273 IP 138.197.151.74.ssh > 24-212-207-43.cable.teksavvy.com.51275: Flags [P.], seq 45296:45468, ack 1, win 501, length 172
15:46:46.838396 IP 138.197.151.74.ssh > 24-212-207-43.cable.teksavvy.com.51275: Flags [P.], seq 45468:45640, ack 1, win 501, length 172
15:46:46.838528 IP 138.197.151.74.ssh > 24-212-207-43.cable.teksavvy.com.51275: Flags [P.], seq 45640:45812, ack 1, win 501, length 172
15:46:46.838654 IP 138.197.151.74.ssh > 24-212-207-43.cable.teksavvy.com.51275: Flags [P.], seq 45812:45984, ack 1, win 501, length 172
15:46:46.838776 IP 138.197.151.74.ssh > 24-212-207-43.cable.teksavvy.com.51275: Flags [P.], seq 45984:46156, ack 1, win 501, length 172
15:46:46.838896 IP 138.197.151.74.ssh > 24-212-207-43.cable.teksavvy.com.51275: Flags [P.], seq 46156:46328, ack 1, win 501, length 172
15:46:46.839022 IP 138.197.151.74.ssh > 24-212-207-43.cable.teksavvy.com.51275: Flags [P.], seq 46328:46500, ack 1, win 501, length 172
15:46:46.839212 IP 138.197.151.74.ssh > 24-212-207-43.cable.teksavvy.com.51275: Flags [P.], seq 46500:46672, ack 1, win 501, length 172
15:46:46.839339 IP 138.197.151.74.ssh > 24-212-207-43.cable.teksavvy.com.51275: Flags [P.], seq 46672:46844, ack 1, win 501, length 172
15:46:46.839461 IP 138.197.151.74.ssh > 24-212-207-43.cable.teksavvy.com.51275: Flags [P.], seq 46844:47016, ack 1, win 501, length 172
15:46:46.839583 IP 138.197.151.74.ssh > 24-212-207-43.cable.teksavvy.com.51275: Flags [P.], seq 47016:47188, ack 1, win 501, length 172
15:46:46.839646 IP 24-212-207-43.cable.teksavvy.com.51275 > 138.197.151.74.ssh: Flags [.], ack 38392, win 18772, length 0
15:46:46.839803 IP 138.197.151.74.ssh > 24-212-207-43.cable.teksavvy.com.51275: Flags [P.], seq 47188:47488, ack 1, win 501, length 300
15:46:46.839931 IP 138.197.151.74.ssh > 24-212-207-43.cable.teksavvy.com.51275: Flags [P.], seq 47488:47660, ack 1, win 501, length 172
15:46:46.840052 IP 138.197.151.74.ssh > 24-212-207-43.cable.teksavvy.com.51275: Flags [P.], seq 47660:47832, ack 1, win 501, length 172
15:46:46.840176 IP 138.197.151.74.ssh > 24-212-207-43.cable.teksavvy.com.51275: Flags [P.], seq 47832:48004, ack 1, win 501, length 172
15:46:46.840305 IP 138.197.151.74.ssh > 24-212-207-43.cable.teksavvy.com.51275: Flags [P.], seq 48004:48176, ack 1, win 501, length 172
15:46:46.840451 IP 138.197.151.74.ssh > 24-212-207-43.cable.teksavvy.com.51275: Flags [P.], seq 48176:48348, ack 1, win 501, length 172
15:46:46.840647 IP 138.197.151.74.ssh > 24-212-207-43.cable.teksavvy.com.51275: Flags [P.], seq 48348:48520, ack 1, win 501, length 172
15:46:46.840809 IP 138.197.151.74.ssh > 24-212-207-43.cable.teksavvy.com.51275: Flags [P.], seq 48520:48692, ack 1, win 501, length 172
15:46:46.840936 IP 138.197.151.74.ssh > 24-212-207-43.cable.teksavvy.com.51275: Flags [P.], seq 48692:48864, ack 1, win 501, length 172
15:46:46.841063 IP 138.197.151.74.ssh > 24-212-207-43.cable.teksavvy.com.51275: Flags [P.], seq 48864:49036, ack 1, win 501, length 172
15:46:46.841264 IP 138.197.151.74.ssh > 24-212-207-43.cable.teksavvy.com.51275: Flags [P.], seq 49036:49208, ack 1, win 501, length 172
15:46:46.841420 IP 138.197.151.74.ssh > 24-212-207-43.cable.teksavvy.com.51275: Flags [P.], seq 49208:49380, ack 1, win 501, length 172
15:46:46.841548 IP 138.197.151.74.ssh > 24-212-207-43.cable.teksavvy.com.51275: Flags [P.], seq 49380:49552, ack 1, win 501, length 172
15:46:46.841670 IP 138.197.151.74.ssh > 24-212-207-43.cable.teksavvy.com.51275: Flags [P.], seq 49552:49724, ack 1, win 501, length 172
15:46:46.841790 IP 138.197.151.74.ssh > 24-212-207-43.cable.teksavvy.com.51275: Flags [P.], seq 49724:49896, ack 1, win 501, length 172
15:46:46.841916 IP 138.197.151.74.ssh > 24-212-207-43.cable.teksavvy.com.51275: Flags [P.], seq 49896:50068, ack 1, win 501, length 172
15:46:46.842038 IP 138.197.151.74.ssh > 24-212-207-43.cable.teksavvy.com.51275: Flags [P.], seq 50068:50240, ack 1, win 501, length 172
15:46:46.842163 IP 138.197.151.74.ssh > 24-212-207-43.cable.teksavvy.com.51275: Flags [P.], seq 50240:50412, ack 1, win 501, length 172
15:46:46.842295 IP 138.197.151.74.ssh > 24-212-207-43.cable.teksavvy.com.51275: Flags [P.], seq 50412:50584, ack 1, win 501, length 172
15:46:46.842420 IP 138.197.151.74.ssh > 24-212-207-43.cable.teksavvy.com.51275: Flags [P.], seq 50584:50756, ack 1, win 501, length 172
15:46:46.842542 IP 138.197.151.74.ssh > 24-212-207-43.cable.teksavvy.com.51275: Flags [P.], seq 50756:50928, ack 1, win 501, length 172
15:46:46.842676 IP 138.197.151.74.ssh > 24-212-207-43.cable.teksavvy.com.51275: Flags [P.], seq 50928:51100, ack 1, win 501, length 172
15:46:46.842814 IP 138.197.151.74.ssh > 24-212-207-43.cable.teksavvy.com.51275: Flags [P.], seq 51100:51272, ack 1, win 501, length 172
