root@lamp-ubuntu-s-1vcpu-1gb-tor1-01:~# tcpdump -i eth0 port 22
tcpdump: verbose output suppressed, use -v or -vv for full protocol decode
listening on eth0, link-type EN10MB (Ethernet), capture size 262144 bytes
15:47:33.293578 IP 138.197.151.74.ssh > 24-212-207-43.cable.teksavvy.com.51275: Flags [P.], seq 2983280928:2983281036, ack 2227378330, win 501, length 108
15:47:33.293714 IP 138.197.151.74.ssh > 24-212-207-43.cable.teksavvy.com.51275: Flags [P.], seq 108:144, ack 1, win 501, length 36
15:47:33.293850 IP 138.197.151.74.ssh > 24-212-207-43.cable.teksavvy.com.51275: Flags [P.], seq 144:252, ack 1, win 501, length 108
15:47:33.293967 IP 138.197.151.74.ssh > 24-212-207-43.cable.teksavvy.com.51275: Flags [P.], seq 252:288, ack 1, win 501, length 36
15:47:33.305370 IP 24-212-207-43.cable.teksavvy.com.51275 > 138.197.151.74.ssh: Flags [.], ack 288, win 18770, length 0
15:47:33.325285 IP 138.197.151.74.ssh > 24-212-207-43.cable.teksavvy.com.51275: Flags [P.], seq 288:476, ack 1, win 501, length 188
15:47:33.325420 IP 138.197.151.74.ssh > 24-212-207-43.cable.teksavvy.com.51275: Flags [P.], seq 476:512, ack 1, win 501, length 36
15:47:33.325583 IP 138.197.151.74.ssh > 24-212-207-43.cable.teksavvy.com.51275: Flags [P.], seq 512:676, ack 1, win 501, length 164
15:47:33.325694 IP 138.197.151.74.ssh > 24-212-207-43.cable.teksavvy.com.51275: Flags [P.], seq 676:712, ack 1, win 501, length 36
15:47:33.325835 IP 138.197.151.74.ssh > 24-212-207-43.cable.teksavvy.com.51275: Flags [P.], seq 712:884, ack 1, win 501, length 172
15:47:33.325953 IP 138.197.151.74.ssh > 24-212-207-43.cable.teksavvy.com.51275: Flags [P.], seq 884:920, ack 1, win 501, length 36
15:47:33.326123 IP 138.197.151.74.ssh > 24-212-207-43.cable.teksavvy.com.51275: Flags [P.], seq 920:1084, ack 1, win 501, length 164
15:47:33.326228 IP 138.197.151.74.ssh > 24-212-207-43.cable.teksavvy.com.51275: Flags [P.], seq 1084:1120, ack 1, win 501, length 36
15:47:33.326377 IP 138.197.151.74.ssh > 24-212-207-43.cable.teksavvy.com.51275: Flags [P.], seq 1120:1276, ack 1, win 501, length 156
15:47:33.326480 IP 138.197.151.74.ssh > 24-212-207-43.cable.teksavvy.com.51275: Flags [P.], seq 1276:1312, ack 1, win 501, length 36
15:47:33.340388 IP 24-212-207-43.cable.teksavvy.com.51275 > 138.197.151.74.ssh: Flags [.], ack 712, win 18769, length 0
15:47:33.340489 IP 138.197.151.74.ssh > 24-212-207-43.cable.teksavvy.com.51275: Flags [P.], seq 1312:3368, ack 1, win 501, length 2056
15:47:33.340519 IP 24-212-207-43.cable.teksavvy.com.51275 > 138.197.151.74.ssh: Flags [.], ack 1312, win 18773, length 0
15:47:33.340792 IP 138.197.151.74.ssh > 24-212-207-43.cable.teksavvy.com.51275: Flags [P.], seq 3368:3524, ack 1, win 501, length 156
15:47:33.340916 IP 138.197.151.74.ssh > 24-212-207-43.cable.teksavvy.com.51275: Flags [P.], seq 3524:3560, ack 1, win 501, length 36
15:47:33.341044 IP 138.197.151.74.ssh > 24-212-207-43.cable.teksavvy.com.51275: Flags [P.], seq 3560:3732, ack 1, win 501, length 172
15:47:33.341144 IP 138.197.151.74.ssh > 24-212-207-43.cable.teksavvy.com.51275: Flags [P.], seq 3732:3768, ack 1, win 501, length 36
15:47:33.341263 IP 138.197.151.74.ssh > 24-212-207-43.cable.teksavvy.com.51275: Flags [P.], seq 3768:3924, ack 1, win 501, length 156
15:47:33.341358 IP 138.197.151.74.ssh > 24-212-207-43.cable.teksavvy.com.51275: Flags [P.], seq 3924:3960, ack 1, win 501, length 36
15:47:33.341481 IP 138.197.151.74.ssh > 24-212-207-43.cable.teksavvy.com.51275: Flags [P.], seq 3960:4132, ack 1, win 501, length 172
15:47:33.341577 IP 138.197.151.74.ssh > 24-212-207-43.cable.teksavvy.com.51275: Flags [P.], seq 4132:4168, ack 1, win 501, length 36
15:47:33.341706 IP 138.197.151.74.ssh > 24-212-207-43.cable.teksavvy.com.51275: Flags [P.], seq 4168:4340, ack 1, win 501, length 172
15:47:33.341800 IP 138.197.151.74.ssh > 24-212-207-43.cable.teksavvy.com.51275: Flags [P.], seq 4340:4376, ack 1, win 501, length 36
15:47:33.341917 IP 138.197.151.74.ssh > 24-212-207-43.cable.teksavvy.com.51275: Flags [P.], seq 4376:4548, ack 1, win 501, length 172
15:47:33.342009 IP 138.197.151.74.ssh > 24-212-207-43.cable.teksavvy.com.51275: Flags [P.], seq 4548:4584, ack 1, win 501, length 36
15:47:33.342125 IP 138.197.151.74.ssh > 24-212-207-43.cable.teksavvy.com.51275: Flags [P.], seq 4584:4756, ack 1, win 501, length 172
15:47:33.342225 IP 138.197.151.74.ssh > 24-212-207-43.cable.teksavvy.com.51275: Flags [P.], seq 4756:4792, ack 1, win 501, length 36
15:47:33.342347 IP 138.197.151.74.ssh > 24-212-207-43.cable.teksavvy.com.51275: Flags [P.], seq 4792:4964, ack 1, win 501, length 172
15:47:33.342437 IP 138.197.151.74.ssh > 24-212-207-43.cable.teksavvy.com.51275: Flags [P.], seq 4964:5000, ack 1, win 501, length 36
15:47:33.342599 IP 138.197.151.74.ssh > 24-212-207-43.cable.teksavvy.com.51275: Flags [P.], seq 5000:5172, ack 1, win 501, length 172
15:47:33.342756 IP 138.197.151.74.ssh > 24-212-207-43.cable.teksavvy.com.51275: Flags [P.], seq 5172:5208, ack 1, win 501, length 36
15:47:33.356609 IP 24-212-207-43.cable.teksavvy.com.51275 > 138.197.151.74.ssh: Flags [.], ack 4340, win 18774, length 0
15:47:33.356726 IP 138.197.151.74.ssh > 24-212-207-43.cable.teksavvy.com.51275: Flags [P.], seq 5208:7704, ack 1, win 501, length 2496
15:47:33.356757 IP 24-212-207-43.cable.teksavvy.com.51275 > 138.197.151.74.ssh: Flags [.], ack 5208, win 18771, length 0
15:47:33.357046 IP 138.197.151.74.ssh > 24-212-207-43.cable.teksavvy.com.51275: Flags [P.], seq 7704:7860, ack 1, win 501, length 156
15:47:33.357196 IP 138.197.151.74.ssh > 24-212-207-43.cable.teksavvy.com.51275: Flags [P.], seq 7860:7896, ack 1, win 501, length 36
15:47:33.357385 IP 138.197.151.74.ssh > 24-212-207-43.cable.teksavvy.com.51275: Flags [P.], seq 7896:8068, ack 1, win 501, length 172
15:47:33.357521 IP 138.197.151.74.ssh > 24-212-207-43.cable.teksavvy.com.51275: Flags [P.], seq 8068:8104, ack 1, win 501, length 36
15:47:33.357667 IP 138.197.151.74.ssh > 24-212-207-43.cable.teksavvy.com.51275: Flags [P.], seq 8104:8260, ack 1, win 501, length 156
15:47:33.357796 IP 138.197.151.74.ssh > 24-212-207-43.cable.teksavvy.com.51275: Flags [P.], seq 8260:8296, ack 1, win 501, length 36
15:47:33.357964 IP 138.197.151.74.ssh > 24-212-207-43.cable.teksavvy.com.51275: Flags [P.], seq 8296:8468, ack 1, win 501, length 172
15:47:33.358079 IP 138.197.151.74.ssh > 24-212-207-43.cable.teksavvy.com.51275: Flags [P.], seq 8468:8504, ack 1, win 501, length 36
15:47:33.358219 IP 138.197.151.74.ssh > 24-212-207-43.cable.teksavvy.com.51275: Flags [P.], seq 8504:8676, ack 1, win 501, length 172
15:47:33.358321 IP 138.197.151.74.ssh > 24-212-207-43.cable.teksavvy.com.51275: Flags [P.], seq 8676:8712, ack 1, win 501, length 36
15:47:33.358452 IP 138.197.151.74.ssh > 24-212-207-43.cable.teksavvy.com.51275: Flags [P.], seq 8712:8884, ack 1, win 501, length 172
15:47:33.358617 IP 138.197.151.74.ssh > 24-212-207-43.cable.teksavvy.com.51275: Flags [P.], seq 8884:8920, ack 1, win 501, length 36
15:47:33.358778 IP 138.197.151.74.ssh > 24-212-207-43.cable.teksavvy.com.51275: Flags [P.], seq 8920:9092, ack 1, win 501, length 172
15:47:33.358890 IP 138.197.151.74.ssh > 24-212-207-43.cable.teksavvy.com.51275: Flags [P.], seq 9092:9128, ack 1, win 501, length 36
15:47:33.359119 IP 138.197.151.74.ssh > 24-212-207-43.cable.teksavvy.com.51275: Flags [P.], seq 9128:9300, ack 1, win 501, length 172
15:47:33.359350 IP 138.197.151.74.ssh > 24-212-207-43.cable.teksavvy.com.51275: Flags [P.], seq 9300:10008, ack 1, win 501, length 708
15:47:33.359552 IP 138.197.151.74.ssh > 24-212-207-43.cable.teksavvy.com.51275: Flags [P.], seq 10008:10716, ack 1, win 501, length 708
15:47:33.359802 IP 138.197.151.74.ssh > 24-212-207-43.cable.teksavvy.com.51275: Flags [P.], seq 10716:10888, ack 1, win 501, length 172
15:47:33.359977 IP 138.197.151.74.ssh > 24-212-207-43.cable.teksavvy.com.51275: Flags [P.], seq 10888:11204, ack 1, win 501, length 316
15:47:33.360151 IP 138.197.151.74.ssh > 24-212-207-43.cable.teksavvy.com.51275: Flags [P.], seq 11204:11376, ack 1, win 501, length 172
15:47:33.360238 IP 123.207.94.252.53837 > 138.197.151.74.ssh: Flags [.], ack 1317596417, win 58, options [nop,nop,TS val 2051599666 ecr 2056904645], length 0
15:47:33.366190 IP 24-212-207-43.cable.teksavvy.com.51275 > 138.197.151.74.ssh: Flags [.], ack 8504, win 18773, length 0
15:47:33.367808 IP 138.197.151.74.ssh > 24-212-207-43.cable.teksavvy.com.51275: Flags [P.], seq 11376:11548, ack 1, win 501, length 172
15:47:33.368214 IP 138.197.151.74.ssh > 24-212-207-43.cable.teksavvy.com.51275: Flags [P.], seq 11548:11584, ack 1, win 501, length 36
15:47:33.369025 IP 138.197.151.74.ssh > 24-212-207-43.cable.teksavvy.com.51275: Flags [P.], seq 11584:12172, ack 1, win 501, length 588
15:47:33.369183 IP 138.197.151.74.ssh > 24-212-207-43.cable.teksavvy.com.51275: Flags [P.], seq 12172:12344, ack 1, win 501, length 172
15:47:33.369320 IP 138.197.151.74.ssh > 24-212-207-43.cable.teksavvy.com.51275: Flags [P.], seq 12344:12516, ack 1, win 501, length 172
15:47:33.369451 IP 138.197.151.74.ssh > 24-212-207-43.cable.teksavvy.com.51275: Flags [P.], seq 12516:12688, ack 1, win 501, length 172
15:47:33.369587 IP 138.197.151.74.ssh > 24-212-207-43.cable.teksavvy.com.51275: Flags [P.], seq 12688:12860, ack 1, win 501, length 172
15:47:33.369718 IP 138.197.151.74.ssh > 24-212-207-43.cable.teksavvy.com.51275: Flags [P.], seq 12860:13032, ack 1, win 501, length 172
15:47:33.369844 IP 138.197.151.74.ssh > 24-212-207-43.cable.teksavvy.com.51275: Flags [P.], seq 13032:13204, ack 1, win 501, length 172
15:47:33.369977 IP 138.197.151.74.ssh > 24-212-207-43.cable.teksavvy.com.51275: Flags [P.], seq 13204:13376, ack 1, win 501, length 172
15:47:33.370103 IP 138.197.151.74.ssh > 24-212-207-43.cable.teksavvy.com.51275: Flags [P.], seq 13376:13548, ack 1, win 501, length 172
15:47:33.370279 IP 138.197.151.74.ssh > 24-212-207-43.cable.teksavvy.com.51275: Flags [P.], seq 13548:13720, ack 1, win 501, length 172
15:47:33.370448 IP 138.197.151.74.ssh > 24-212-207-43.cable.teksavvy.com.51275: Flags [P.], seq 13720:13892, ack 1, win 501, length 172
15:47:33.370583 IP 138.197.151.74.ssh > 24-212-207-43.cable.teksavvy.com.51275: Flags [P.], seq 13892:14064, ack 1, win 501, length 172
15:47:33.370711 IP 138.197.151.74.ssh > 24-212-207-43.cable.teksavvy.com.51275: Flags [P.], seq 14064:14236, ack 1, win 501, length 172
15:47:33.370854 IP 138.197.151.74.ssh > 24-212-207-43.cable.teksavvy.com.51275: Flags [P.], seq 14236:14408, ack 1, win 501, length 172
15:47:33.370991 IP 24-212-207-43.cable.teksavvy.com.51275 > 138.197.151.74.ssh: Flags [.], ack 11376, win 18774, length 0
15:47:33.371060 IP 138.197.151.74.ssh > 24-212-207-43.cable.teksavvy.com.51275: Flags [P.], seq 14408:14580, ack 1, win 501, length 172
15:47:33.371216 IP 138.197.151.74.ssh > 24-212-207-43.cable.teksavvy.com.51275: Flags [P.], seq 14580:14880, ack 1, win 501, length 300
15:47:33.371350 IP 138.197.151.74.ssh > 24-212-207-43.cable.teksavvy.com.51275: Flags [P.], seq 14880:15052, ack 1, win 501, length 172
15:47:33.371484 IP 138.197.151.74.ssh > 24-212-207-43.cable.teksavvy.com.51275: Flags [P.], seq 15052:15224, ack 1, win 501, length 172
15:47:33.371660 IP 138.197.151.74.ssh > 24-212-207-43.cable.teksavvy.com.51275: Flags [P.], seq 15224:15396, ack 1, win 501, length 172
15:47:33.371799 IP 138.197.151.74.ssh > 24-212-207-43.cable.teksavvy.com.51275: Flags [P.], seq 15396:15568, ack 1, win 501, length 172
15:47:33.371928 IP 138.197.151.74.ssh > 24-212-207-43.cable.teksavvy.com.51275: Flags [P.], seq 15568:15740, ack 1, win 501, length 172
15:47:33.372067 IP 138.197.151.74.ssh > 24-212-207-43.cable.teksavvy.com.51275: Flags [P.], seq 15740:15912, ack 1, win 501, length 172
15:47:33.372202 IP 138.197.151.74.ssh > 24-212-207-43.cable.teksavvy.com.51275: Flags [P.], seq 15912:16084, ack 1, win 501, length 172
15:47:33.372336 IP 138.197.151.74.ssh > 24-212-207-43.cable.teksavvy.com.51275: Flags [P.], seq 16084:16256, ack 1, win 501, length 172
15:47:33.372473 IP 138.197.151.74.ssh > 24-212-207-43.cable.teksavvy.com.51275: Flags [P.], seq 16256:16428, ack 1, win 501, length 172
15:47:33.372609 IP 138.197.151.74.ssh > 24-212-207-43.cable.teksavvy.com.51275: Flags [P.], seq 16428:16600, ack 1, win 501, length 172
15:47:33.372746 IP 138.197.151.74.ssh > 24-212-207-43.cable.teksavvy.com.51275: Flags [P.], seq 16600:16772, ack 1, win 501, length 172
15:47:33.372888 IP 138.197.151.74.ssh > 24-212-207-43.cable.teksavvy.com.51275: Flags [P.], seq 16772:16944, ack 1, win 501, length 172
15:47:33.373018 IP 138.197.151.74.ssh > 24-212-207-43.cable.teksavvy.com.51275: Flags [P.], seq 16944:17116, ack 1, win 501, length 172
15:47:33.373145 IP 138.197.151.74.ssh > 24-212-207-43.cable.teksavvy.com.51275: Flags [P.], seq 17116:17288, ack 1, win 501, length 172
15:47:33.373686 IP 138.197.151.74.ssh > 24-212-207-43.cable.teksavvy.com.51275: Flags [P.], seq 17288:17460, ack 1, win 501, length 172
15:47:33.375757 IP 138.197.151.74.ssh > 24-212-207-43.cable.teksavvy.com.51275: Flags [P.], seq 17460:17632, ack 1, win 501, length 172
15:47:33.375910 IP 24-212-207-43.cable.teksavvy.com.51275 > 138.197.151.74.ssh: Flags [.], ack 12172, win 18771, length 0
15:47:33.376110 IP 138.197.151.74.ssh > 24-212-207-43.cable.teksavvy.com.51275: Flags [P.], seq 17632:17932, ack 1, win 501, length 300
15:47:33.376291 IP 138.197.151.74.ssh > 24-212-207-43.cable.teksavvy.com.51275: Flags [P.], seq 17932:18104, ack 1, win 501, length 172
15:47:33.376433 IP 138.197.151.74.ssh > 24-212-207-43.cable.teksavvy.com.51275: Flags [P.], seq 18104:18276, ack 1, win 501, length 172
15:47:33.376562 IP 138.197.151.74.ssh > 24-212-207-43.cable.teksavvy.com.51275: Flags [P.], seq 18276:18448, ack 1, win 501, length 172
15:47:33.376692 IP 138.197.151.74.ssh > 24-212-207-43.cable.teksavvy.com.51275: Flags [P.], seq 18448:18620, ack 1, win 501, length 172
15:47:33.376822 IP 138.197.151.74.ssh > 24-212-207-43.cable.teksavvy.com.51275: Flags [P.], seq 18620:18792, ack 1, win 501, length 172
15:47:33.376953 IP 138.197.151.74.ssh > 24-212-207-43.cable.teksavvy.com.51275: Flags [P.], seq 18792:18964, ack 1, win 501, length 172
15:47:33.377086 IP 138.197.151.74.ssh > 24-212-207-43.cable.teksavvy.com.51275: Flags [P.], seq 18964:19136, ack 1, win 501, length 172
15:47:33.377260 IP 138.197.151.74.ssh > 24-212-207-43.cable.teksavvy.com.51275: Flags [P.], seq 19136:19308, ack 1, win 501, length 172
15:47:33.377483 IP 138.197.151.74.ssh > 24-212-207-43.cable.teksavvy.com.51275: Flags [P.], seq 19308:19480, ack 1, win 501, length 172
15:47:33.377638 IP 138.197.151.74.ssh > 24-212-207-43.cable.teksavvy.com.51275: Flags [P.], seq 19480:19652, ack 1, win 501, length 172
15:47:33.377770 IP 138.197.151.74.ssh > 24-212-207-43.cable.teksavvy.com.51275: Flags [P.], seq 19652:19824, ack 1, win 501, length 172
15:47:33.377900 IP 138.197.151.74.ssh > 24-212-207-43.cable.teksavvy.com.51275: Flags [P.], seq 19824:19996, ack 1, win 501, length 172
15:47:33.378034 IP 138.197.151.74.ssh > 24-212-207-43.cable.teksavvy.com.51275: Flags [P.], seq 19996:20168, ack 1, win 501, length 172
15:47:33.378169 IP 138.197.151.74.ssh > 24-212-207-43.cable.teksavvy.com.51275: Flags [P.], seq 20168:20340, ack 1, win 501, length 172
15:47:33.378393 IP 138.197.151.74.ssh > 24-212-207-43.cable.teksavvy.com.51275: Flags [P.], seq 20340:20512, ack 1, win 501, length 172
15:47:33.378636 IP 138.197.151.74.ssh > 24-212-207-43.cable.teksavvy.com.51275: Flags [P.], seq 20512:20684, ack 1, win 501, length 172
15:47:33.378861 IP 138.197.151.74.ssh > 24-212-207-43.cable.teksavvy.com.51275: Flags [P.], seq 20684:20856, ack 1, win 501, length 172
15:47:33.379132 IP 138.197.151.74.ssh > 24-212-207-43.cable.teksavvy.com.51275: Flags [P.], seq 20856:21028, ack 1, win 501, length 172
15:47:33.379291 IP 138.197.151.74.ssh > 24-212-207-43.cable.teksavvy.com.51275: Flags [P.], seq 21028:21200, ack 1, win 501, length 172
15:47:33.379438 IP 138.197.151.74.ssh > 24-212-207-43.cable.teksavvy.com.51275: Flags [P.], seq 21200:21372, ack 1, win 501, length 172
15:47:33.379683 IP 138.197.151.74.ssh > 24-212-207-43.cable.teksavvy.com.51275: Flags [P.], seq 21372:21544, ack 1, win 501, length 172
15:47:33.382121 IP 24-212-207-43.cable.teksavvy.com.51275 > 138.197.151.74.ssh: Flags [.], ack 14580, win 18770, length 0
15:47:33.382386 IP 138.197.151.74.ssh > 24-212-207-43.cable.teksavvy.com.51275: Flags [P.], seq 21544:21844, ack 1, win 501, length 300
15:47:33.382635 IP 138.197.151.74.ssh > 24-212-207-43.cable.teksavvy.com.51275: Flags [P.], seq 21844:22016, ack 1, win 501, length 172
15:47:33.382873 IP 138.197.151.74.ssh > 24-212-207-43.cable.teksavvy.com.51275: Flags [P.], seq 22016:22188, ack 1, win 501, length 172
15:47:33.383107 IP 138.197.151.74.ssh > 24-212-207-43.cable.teksavvy.com.51275: Flags [P.], seq 22188:22360, ack 1, win 501, length 172
15:47:33.383274 IP 138.197.151.74.ssh > 24-212-207-43.cable.teksavvy.com.51275: Flags [P.], seq 22360:22532, ack 1, win 501, length 172
15:47:33.383453 IP 138.197.151.74.ssh > 24-212-207-43.cable.teksavvy.com.51275: Flags [P.], seq 22532:22704, ack 1, win 501, length 172
15:47:33.383683 IP 138.197.151.74.ssh > 24-212-207-43.cable.teksavvy.com.51275: Flags [P.], seq 22704:22876, ack 1, win 501, length 172
15:47:33.383843 IP 138.197.151.74.ssh > 24-212-207-43.cable.teksavvy.com.51275: Flags [P.], seq 22876:23048, ack 1, win 501, length 172
15:47:33.383985 IP 138.197.151.74.ssh > 24-212-207-43.cable.teksavvy.com.51275: Flags [P.], seq 23048:23220, ack 1, win 501, length 172
15:47:33.384140 IP 138.197.151.74.ssh > 24-212-207-43.cable.teksavvy.com.51275: Flags [P.], seq 23220:23392, ack 1, win 501, length 172
15:47:33.384307 IP 138.197.151.74.ssh > 24-212-207-43.cable.teksavvy.com.51275: Flags [P.], seq 23392:23564, ack 1, win 501, length 172
15:47:33.384498 IP 138.197.151.74.ssh > 24-212-207-43.cable.teksavvy.com.51275: Flags [P.], seq 23564:23736, ack 1, win 501, length 172
15:47:33.384759 IP 138.197.151.74.ssh > 24-212-207-43.cable.teksavvy.com.51275: Flags [P.], seq 23736:23908, ack 1, win 501, length 172
15:47:33.384964 IP 138.197.151.74.ssh > 24-212-207-43.cable.teksavvy.com.51275: Flags [P.], seq 23908:24080, ack 1, win 501, length 172
15:47:33.385120 IP 138.197.151.74.ssh > 24-212-207-43.cable.teksavvy.com.51275: Flags [P.], seq 24080:24252, ack 1, win 501, length 172
15:47:33.385260 IP 138.197.151.74.ssh > 24-212-207-43.cable.teksavvy.com.51275: Flags [P.], seq 24252:24424, ack 1, win 501, length 172
15:47:33.385404 IP 138.197.151.74.ssh > 24-212-207-43.cable.teksavvy.com.51275: Flags [P.], seq 24424:24596, ack 1, win 501, length 172
15:47:33.385465 IP 24-212-207-43.cable.teksavvy.com.51275 > 138.197.151.74.ssh: Flags [.], ack 17460, win 18772, length 0
15:47:33.385498 IP 24-212-207-43.cable.teksavvy.com.51275 > 138.197.151.74.ssh: Flags [.], ack 20512, win 18774, length 0
15:47:33.385653 IP 138.197.151.74.ssh > 24-212-207-43.cable.teksavvy.com.51275: Flags [P.], seq 24596:25016, ack 1, win 501, length 420
15:47:33.385801 IP 138.197.151.74.ssh > 24-212-207-43.cable.teksavvy.com.51275: Flags [P.], seq 25016:25188, ack 1, win 501, length 172
15:47:33.385938 IP 138.197.151.74.ssh > 24-212-207-43.cable.teksavvy.com.51275: Flags [P.], seq 25188:25360, ack 1, win 501, length 172
15:47:33.386107 IP 138.197.151.74.ssh > 24-212-207-43.cable.teksavvy.com.51275: Flags [P.], seq 25360:25532, ack 1, win 501, length 172
15:47:33.386242 IP 138.197.151.74.ssh > 24-212-207-43.cable.teksavvy.com.51275: Flags [P.], seq 25532:25704, ack 1, win 501, length 172
15:47:33.386374 IP 138.197.151.74.ssh > 24-212-207-43.cable.teksavvy.com.51275: Flags [P.], seq 25704:25876, ack 1, win 501, length 172
15:47:33.386537 IP 138.197.151.74.ssh > 24-212-207-43.cable.teksavvy.com.51275: Flags [P.], seq 25876:26048, ack 1, win 501, length 172
15:47:33.386676 IP 138.197.151.74.ssh > 24-212-207-43.cable.teksavvy.com.51275: Flags [P.], seq 26048:26220, ack 1, win 501, length 172
15:47:33.386813 IP 138.197.151.74.ssh > 24-212-207-43.cable.teksavvy.com.51275: Flags [P.], seq 26220:26392, ack 1, win 501, length 172
15:47:33.386951 IP 138.197.151.74.ssh > 24-212-207-43.cable.teksavvy.com.51275: Flags [P.], seq 26392:26564, ack 1, win 501, length 172
15:47:33.387107 IP 138.197.151.74.ssh > 24-212-207-43.cable.teksavvy.com.51275: Flags [P.], seq 26564:26736, ack 1, win 501, length 172
15:47:33.387240 IP 138.197.151.74.ssh > 24-212-207-43.cable.teksavvy.com.51275: Flags [P.], seq 26736:26908, ack 1, win 501, length 172
15:47:33.387699 IP 138.197.151.74.ssh > 24-212-207-43.cable.teksavvy.com.51275: Flags [P.], seq 26908:27080, ack 1, win 501, length 172
15:47:33.387858 IP 138.197.151.74.ssh > 24-212-207-43.cable.teksavvy.com.51275: Flags [P.], seq 27080:27252, ack 1, win 501, length 172
15:47:33.388014 IP 138.197.151.74.ssh > 24-212-207-43.cable.teksavvy.com.51275: Flags [P.], seq 27252:27424, ack 1, win 501, length 172
15:47:33.388150 IP 138.197.151.74.ssh > 24-212-207-43.cable.teksavvy.com.51275: Flags [P.], seq 27424:27596, ack 1, win 501, length 172
15:47:33.388503 IP 138.197.151.74.ssh > 24-212-207-43.cable.teksavvy.com.51275: Flags [P.], seq 27596:27768, ack 1, win 501, length 172
15:47:33.389025 IP 138.197.151.74.ssh > 24-212-207-43.cable.teksavvy.com.51275: Flags [P.], seq 27768:27940, ack 1, win 501, length 172
15:47:33.389198 IP 138.197.151.74.ssh > 24-212-207-43.cable.teksavvy.com.51275: Flags [P.], seq 27940:28112, ack 1, win 501, length 172
15:47:33.390053 IP 24-212-207-43.cable.teksavvy.com.51275 > 138.197.151.74.ssh: Flags [.], ack 20856, win 18773, length 0
15:47:33.390232 IP 138.197.151.74.ssh > 24-212-207-43.cable.teksavvy.com.51275: Flags [P.], seq 28112:28412, ack 1, win 501, length 300
15:47:33.390496 IP 138.197.151.74.ssh > 24-212-207-43.cable.teksavvy.com.51275: Flags [P.], seq 28412:28584, ack 1, win 501, length 172
15:47:33.390736 IP 138.197.151.74.ssh > 24-212-207-43.cable.teksavvy.com.51275: Flags [P.], seq 28584:28756, ack 1, win 501, length 172
15:47:33.390899 IP 138.197.151.74.ssh > 24-212-207-43.cable.teksavvy.com.51275: Flags [P.], seq 28756:28928, ack 1, win 501, length 172
15:47:33.391105 IP 138.197.151.74.ssh > 24-212-207-43.cable.teksavvy.com.51275: Flags [P.], seq 28928:29100, ack 1, win 501, length 172
15:47:33.391254 IP 138.197.151.74.ssh > 24-212-207-43.cable.teksavvy.com.51275: Flags [P.], seq 29100:29272, ack 1, win 501, length 172
15:47:33.391389 IP 138.197.151.74.ssh > 24-212-207-43.cable.teksavvy.com.51275: Flags [P.], seq 29272:29444, ack 1, win 501, length 172
15:47:33.391523 IP 138.197.151.74.ssh > 24-212-207-43.cable.teksavvy.com.51275: Flags [P.], seq 29444:29616, ack 1, win 501, length 172
15:47:33.391692 IP 138.197.151.74.ssh > 24-212-207-43.cable.teksavvy.com.51275: Flags [P.], seq 29616:29788, ack 1, win 501, length 172
15:47:33.392464 IP 24-212-207-43.cable.teksavvy.com.51275 > 138.197.151.74.ssh: Flags [.], ack 21544, win 18770, length 0
15:47:33.392500 IP 24-212-207-43.cable.teksavvy.com.51275 > 138.197.151.74.ssh: Flags [.], ack 22532, win 18774, length 0
15:47:33.392753 IP 138.197.151.74.ssh > 24-212-207-43.cable.teksavvy.com.51275: Flags [P.], seq 29788:30208, ack 1, win 501, length 420
15:47:33.392920 IP 138.197.151.74.ssh > 24-212-207-43.cable.teksavvy.com.51275: Flags [P.], seq 30208:30380, ack 1, win 501, length 172
15:47:33.393066 IP 138.197.151.74.ssh > 24-212-207-43.cable.teksavvy.com.51275: Flags [P.], seq 30380:30552, ack 1, win 501, length 172
15:47:33.393206 IP 138.197.151.74.ssh > 24-212-207-43.cable.teksavvy.com.51275: Flags [P.], seq 30552:30724, ack 1, win 501, length 172
15:47:33.393344 IP 138.197.151.74.ssh > 24-212-207-43.cable.teksavvy.com.51275: Flags [P.], seq 30724:30896, ack 1, win 501, length 172
15:47:33.393480 IP 138.197.151.74.ssh > 24-212-207-43.cable.teksavvy.com.51275: Flags [P.], seq 30896:31068, ack 1, win 501, length 172
15:47:33.393632 IP 138.197.151.74.ssh > 24-212-207-43.cable.teksavvy.com.51275: Flags [P.], seq 31068:31240, ack 1, win 501, length 172
15:47:33.393769 IP 138.197.151.74.ssh > 24-212-207-43.cable.teksavvy.com.51275: Flags [P.], seq 31240:31412, ack 1, win 501, length 172
15:47:33.394012 IP 138.197.151.74.ssh > 24-212-207-43.cable.teksavvy.com.51275: Flags [P.], seq 31412:31584, ack 1, win 501, length 172
15:47:33.395705 IP 138.197.151.74.ssh > 24-212-207-43.cable.teksavvy.com.51275: Flags [P.], seq 31584:31756, ack 1, win 501, length 172
15:47:33.395831 IP 24-212-207-43.cable.teksavvy.com.51275 > 138.197.151.74.ssh: Flags [.], ack 26564, win 18773, length 0
15:47:33.396004 IP 138.197.151.74.ssh > 24-212-207-43.cable.teksavvy.com.51275: Flags [P.], seq 31756:32056, ack 1, win 501, length 300
15:47:33.396226 IP 138.197.151.74.ssh > 24-212-207-43.cable.teksavvy.com.51275: Flags [P.], seq 32056:32228, ack 1, win 501, length 172
15:47:33.396458 IP 138.197.151.74.ssh > 24-212-207-43.cable.teksavvy.com.51275: Flags [P.], seq 32228:32400, ack 1, win 501, length 172
15:47:33.396649 IP 138.197.151.74.ssh > 24-212-207-43.cable.teksavvy.com.51275: Flags [P.], seq 32400:32572, ack 1, win 501, length 172
15:47:33.396794 IP 138.197.151.74.ssh > 24-212-207-43.cable.teksavvy.com.51275: Flags [P.], seq 32572:32744, ack 1, win 501, length 172
15:47:33.396925 IP 138.197.151.74.ssh > 24-212-207-43.cable.teksavvy.com.51275: Flags [P.], seq 32744:32916, ack 1, win 501, length 172
15:47:33.397070 IP 138.197.151.74.ssh > 24-212-207-43.cable.teksavvy.com.51275: Flags [P.], seq 32916:33088, ack 1, win 501, length 172
15:47:33.397290 IP 138.197.151.74.ssh > 24-212-207-43.cable.teksavvy.com.51275: Flags [P.], seq 33088:33260, ack 1, win 501, length 172
15:47:33.397454 IP 138.197.151.74.ssh > 24-212-207-43.cable.teksavvy.com.51275: Flags [P.], seq 33260:33432, ack 1, win 501, length 172
15:47:33.397597 IP 138.197.151.74.ssh > 24-212-207-43.cable.teksavvy.com.51275: Flags [P.], seq 33432:33604, ack 1, win 501, length 172
15:47:33.397787 IP 138.197.151.74.ssh > 24-212-207-43.cable.teksavvy.com.51275: Flags [P.], seq 33604:33776, ack 1, win 501, length 172
15:47:33.398084 IP 138.197.151.74.ssh > 24-212-207-43.cable.teksavvy.com.51275: Flags [P.], seq 33776:33948, ack 1, win 501, length 172
15:47:33.398233 IP 138.197.151.74.ssh > 24-212-207-43.cable.teksavvy.com.51275: Flags [P.], seq 33948:34120, ack 1, win 501, length 172
15:47:33.398440 IP 138.197.151.74.ssh > 24-212-207-43.cable.teksavvy.com.51275: Flags [P.], seq 34120:34292, ack 1, win 501, length 172
15:47:33.399733 IP 138.197.151.74.ssh > 24-212-207-43.cable.teksavvy.com.51275: Flags [P.], seq 34292:34464, ack 1, win 501, length 172
15:47:33.399895 IP 138.197.151.74.ssh > 24-212-207-43.cable.teksavvy.com.51275: Flags [P.], seq 34464:34636, ack 1, win 501, length 172
15:47:33.400032 IP 24-212-207-43.cable.teksavvy.com.51275 > 138.197.151.74.ssh: Flags [.], ack 27596, win 18769, length 0
15:47:33.400081 IP 138.197.151.74.ssh > 24-212-207-43.cable.teksavvy.com.51275: Flags [P.], seq 34636:34808, ack 1, win 501, length 172
15:47:33.400203 IP 24-212-207-43.cable.teksavvy.com.51275 > 138.197.151.74.ssh: Flags [.], ack 29788, win 18774, length 0
15:47:33.400395 IP 138.197.151.74.ssh > 24-212-207-43.cable.teksavvy.com.51275: Flags [P.], seq 34808:35228, ack 1, win 501, length 420
15:47:33.400560 IP 138.197.151.74.ssh > 24-212-207-43.cable.teksavvy.com.51275: Flags [P.], seq 35228:35400, ack 1, win 501, length 172
15:47:33.400693 IP 138.197.151.74.ssh > 24-212-207-43.cable.teksavvy.com.51275: Flags [P.], seq 35400:35572, ack 1, win 501, length 172
15:47:33.400830 IP 138.197.151.74.ssh > 24-212-207-43.cable.teksavvy.com.51275: Flags [P.], seq 35572:35744, ack 1, win 501, length 172
15:47:33.400961 IP 138.197.151.74.ssh > 24-212-207-43.cable.teksavvy.com.51275: Flags [P.], seq 35744:35916, ack 1, win 501, length 172
15:47:33.401090 IP 138.197.151.74.ssh > 24-212-207-43.cable.teksavvy.com.51275: Flags [P.], seq 35916:36088, ack 1, win 501, length 172
15:47:33.401223 IP 138.197.151.74.ssh > 24-212-207-43.cable.teksavvy.com.51275: Flags [P.], seq 36088:36260, ack 1, win 501, length 172
15:47:33.401360 IP 138.197.151.74.ssh > 24-212-207-43.cable.teksavvy.com.51275: Flags [P.], seq 36260:36432, ack 1, win 501, length 172
15:47:33.401495 IP 138.197.151.74.ssh > 24-212-207-43.cable.teksavvy.com.51275: Flags [P.], seq 36432:36604, ack 1, win 501, length 172
15:47:33.401628 IP 138.197.151.74.ssh > 24-212-207-43.cable.teksavvy.com.51275: Flags [P.], seq 36604:36776, ack 1, win 501, length 172
15:47:33.402071 IP 24-212-207-43.cable.teksavvy.com.51275 > 138.197.151.74.ssh: Flags [.], ack 31412, win 18774, length 0
15:47:33.402211 IP 138.197.151.74.ssh > 24-212-207-43.cable.teksavvy.com.51275: Flags [P.], seq 36776:37076, ack 1, win 501, length 300
15:47:33.402412 IP 138.197.151.74.ssh > 24-212-207-43.cable.teksavvy.com.51275: Flags [P.], seq 37076:37248, ack 1, win 501, length 172
15:47:33.402595 IP 138.197.151.74.ssh > 24-212-207-43.cable.teksavvy.com.51275: Flags [P.], seq 37248:37420, ack 1, win 501, length 172
15:47:33.402734 IP 138.197.151.74.ssh > 24-212-207-43.cable.teksavvy.com.51275: Flags [P.], seq 37420:37592, ack 1, win 501, length 172
15:47:33.402875 IP 138.197.151.74.ssh > 24-212-207-43.cable.teksavvy.com.51275: Flags [P.], seq 37592:37764, ack 1, win 501, length 172
15:47:33.406166 IP 24-212-207-43.cable.teksavvy.com.51275 > 138.197.151.74.ssh: Flags [.], ack 34292, win 18769, length 0
15:47:33.406392 IP 138.197.151.74.ssh > 24-212-207-43.cable.teksavvy.com.51275: Flags [P.], seq 37764:38064, ack 1, win 501, length 300
15:47:33.406599 IP 138.197.151.74.ssh > 24-212-207-43.cable.teksavvy.com.51275: Flags [P.], seq 38064:38236, ack 1, win 501, length 172
15:47:33.406741 IP 138.197.151.74.ssh > 24-212-207-43.cable.teksavvy.com.51275: Flags [P.], seq 38236:38408, ack 1, win 501, length 172
15:47:33.406879 IP 138.197.151.74.ssh > 24-212-207-43.cable.teksavvy.com.51275: Flags [P.], seq 38408:38580, ack 1, win 501, length 172
15:47:33.407017 IP 138.197.151.74.ssh > 24-212-207-43.cable.teksavvy.com.51275: Flags [P.], seq 38580:38752, ack 1, win 501, length 172
15:47:33.407174 IP 138.197.151.74.ssh > 24-212-207-43.cable.teksavvy.com.51275: Flags [P.], seq 38752:38924, ack 1, win 501, length 172
15:47:33.407312 IP 138.197.151.74.ssh > 24-212-207-43.cable.teksavvy.com.51275: Flags [P.], seq 38924:39096, ack 1, win 501, length 172
15:47:33.407449 IP 138.197.151.74.ssh > 24-212-207-43.cable.teksavvy.com.51275: Flags [P.], seq 39096:39268, ack 1, win 501, length 172
15:47:33.407580 IP 138.197.151.74.ssh > 24-212-207-43.cable.teksavvy.com.51275: Flags [P.], seq 39268:39440, ack 1, win 501, length 172
15:47:33.407752 IP 138.197.151.74.ssh > 24-212-207-43.cable.teksavvy.com.51275: Flags [P.], seq 39440:39612, ack 1, win 501, length 172
15:47:33.407890 IP 138.197.151.74.ssh > 24-212-207-43.cable.teksavvy.com.51275: Flags [P.], seq 39612:39784, ack 1, win 501, length 172
15:47:33.408019 IP 138.197.151.74.ssh > 24-212-207-43.cable.teksavvy.com.51275: Flags [P.], seq 39784:39956, ack 1, win 501, length 172
15:47:33.408154 IP 138.197.151.74.ssh > 24-212-207-43.cable.teksavvy.com.51275: Flags [P.], seq 39956:40128, ack 1, win 501, length 172
15:47:33.408340 IP 138.197.151.74.ssh > 24-212-207-43.cable.teksavvy.com.51275: Flags [P.], seq 40128:40300, ack 1, win 501, length 172
15:47:33.408573 IP 138.197.151.74.ssh > 24-212-207-43.cable.teksavvy.com.51275: Flags [P.], seq 40300:40472, ack 1, win 501, length 172
15:47:33.408805 IP 138.197.151.74.ssh > 24-212-207-43.cable.teksavvy.com.51275: Flags [P.], seq 40472:40644, ack 1, win 501, length 172
15:47:33.408951 IP 138.197.151.74.ssh > 24-212-207-43.cable.teksavvy.com.51275: Flags [P.], seq 40644:40816, ack 1, win 501, length 172
15:47:33.409082 IP 138.197.151.74.ssh > 24-212-207-43.cable.teksavvy.com.51275: Flags [P.], seq 40816:40988, ack 1, win 501, length 172
15:47:33.409216 IP 138.197.151.74.ssh > 24-212-207-43.cable.teksavvy.com.51275: Flags [P.], seq 40988:41160, ack 1, win 501, length 172
15:47:33.409354 IP 138.197.151.74.ssh > 24-212-207-43.cable.teksavvy.com.51275: Flags [P.], seq 41160:41332, ack 1, win 501, length 172
15:47:33.409527 IP 138.197.151.74.ssh > 24-212-207-43.cable.teksavvy.com.51275: Flags [P.], seq 41332:41504, ack 1, win 501, length 172
15:47:33.409669 IP 138.197.151.74.ssh > 24-212-207-43.cable.teksavvy.com.51275: Flags [P.], seq 41504:41676, ack 1, win 501, length 172
15:47:33.409818 IP 138.197.151.74.ssh > 24-212-207-43.cable.teksavvy.com.51275: Flags [P.], seq 41676:41848, ack 1, win 501, length 172
15:47:33.409999 IP 138.197.151.74.ssh > 24-212-207-43.cable.teksavvy.com.51275: Flags [P.], seq 41848:42020, ack 1, win 501, length 172
15:47:33.410201 IP 138.197.151.74.ssh > 24-212-207-43.cable.teksavvy.com.51275: Flags [P.], seq 42020:42192, ack 1, win 501, length 172
15:47:33.410444 IP 138.197.151.74.ssh > 24-212-207-43.cable.teksavvy.com.51275: Flags [P.], seq 42192:42364, ack 1, win 501, length 172
15:47:33.410633 IP 138.197.151.74.ssh > 24-212-207-43.cable.teksavvy.com.51275: Flags [P.], seq 42364:42536, ack 1, win 501, length 172
15:47:33.410782 IP 24-212-207-43.cable.teksavvy.com.51275 > 138.197.151.74.ssh: Flags [.], ack 37764, win 18770, length 0
15:47:33.410880 IP 138.197.151.74.ssh > 24-212-207-43.cable.teksavvy.com.51275: Flags [P.], seq 42536:42708, ack 1, win 501, length 172
15:47:33.410961 IP 138.197.151.74.ssh > 24-212-207-43.cable.teksavvy.com.51275: Flags [P.], seq 42708:42872, ack 1, win 501, length 164
15:47:33.411140 IP 138.197.151.74.ssh > 24-212-207-43.cable.teksavvy.com.51275: Flags [P.], seq 42872:43180, ack 1, win 501, length 308
15:47:33.411317 IP 138.197.151.74.ssh > 24-212-207-43.cable.teksavvy.com.51275: Flags [P.], seq 43180:43352, ack 1, win 501, length 172
15:47:33.411468 IP 138.197.151.74.ssh > 24-212-207-43.cable.teksavvy.com.51275: Flags [P.], seq 43352:43524, ack 1, win 501, length 172
15:47:33.411684 IP 138.197.151.74.ssh > 24-212-207-43.cable.teksavvy.com.51275: Flags [P.], seq 43524:43696, ack 1, win 501, length 172
15:47:33.411859 IP 138.197.151.74.ssh > 24-212-207-43.cable.teksavvy.com.51275: Flags [P.], seq 43696:43868, ack 1, win 501, length 172
15:47:33.411996 IP 138.197.151.74.ssh > 24-212-207-43.cable.teksavvy.com.51275: Flags [P.], seq 43868:44040, ack 1, win 501, length 172
15:47:33.412133 IP 138.197.151.74.ssh > 24-212-207-43.cable.teksavvy.com.51275: Flags [P.], seq 44040:44212, ack 1, win 501, length 172
15:47:33.412272 IP 138.197.151.74.ssh > 24-212-207-43.cable.teksavvy.com.51275: Flags [P.], seq 44212:44384, ack 1, win 501, length 172
15:47:33.412409 IP 138.197.151.74.ssh > 24-212-207-43.cable.teksavvy.com.51275: Flags [P.], seq 44384:44556, ack 1, win 501, length 172
15:47:33.412540 IP 138.197.151.74.ssh > 24-212-207-43.cable.teksavvy.com.51275: Flags [P.], seq 44556:44728, ack 1, win 501, length 172
15:47:33.412673 IP 138.197.151.74.ssh > 24-212-207-43.cable.teksavvy.com.51275: Flags [P.], seq 44728:44900, ack 1, win 501, length 172
15:47:33.412803 IP 138.197.151.74.ssh > 24-212-207-43.cable.teksavvy.com.51275: Flags [P.], seq 44900:45072, ack 1, win 501, length 172
15:47:33.412979 IP 138.197.151.74.ssh > 24-212-207-43.cable.teksavvy.com.51275: Flags [P.], seq 45072:45244, ack 1, win 501, length 172
15:47:33.415716 IP 138.197.151.74.ssh > 24-212-207-43.cable.teksavvy.com.51275: Flags [P.], seq 45244:45416, ack 1, win 501, length 172
15:47:33.415888 IP 138.197.151.74.ssh > 24-212-207-43.cable.teksavvy.com.51275: Flags [P.], seq 45416:45588, ack 1, win 501, length 172
15:47:33.416077 IP 138.197.151.74.ssh > 24-212-207-43.cable.teksavvy.com.51275: Flags [P.], seq 45588:45760, ack 1, win 501, length 172
15:47:33.416222 IP 138.197.151.74.ssh > 24-212-207-43.cable.teksavvy.com.51275: Flags [P.], seq 45760:45932, ack 1, win 501, length 172
15:47:33.416353 IP 138.197.151.74.ssh > 24-212-207-43.cable.teksavvy.com.51275: Flags [P.], seq 45932:46104, ack 1, win 501, length 172
15:47:33.416483 IP 138.197.151.74.ssh > 24-212-207-43.cable.teksavvy.com.51275: Flags [P.], seq 46104:46276, ack 1, win 501, length 172
15:47:33.416623 IP 138.197.151.74.ssh > 24-212-207-43.cable.teksavvy.com.51275: Flags [P.], seq 46276:46448, ack 1, win 501, length 172
15:47:33.416760 IP 138.197.151.74.ssh > 24-212-207-43.cable.teksavvy.com.51275: Flags [P.], seq 46448:46620, ack 1, win 501, length 172
15:47:33.416888 IP 138.197.151.74.ssh > 24-212-207-43.cable.teksavvy.com.51275: Flags [P.], seq 46620:46792, ack 1, win 501, length 172
15:47:33.417019 IP 138.197.151.74.ssh > 24-212-207-43.cable.teksavvy.com.51275: Flags [P.], seq 46792:46964, ack 1, win 501, length 172
15:47:33.417153 IP 138.197.151.74.ssh > 24-212-207-43.cable.teksavvy.com.51275: Flags [P.], seq 46964:47136, ack 1, win 501, length 172
15:47:33.417385 IP 138.197.151.74.ssh > 24-212-207-43.cable.teksavvy.com.51275: Flags [P.], seq 47136:47308, ack 1, win 501, length 172
15:47:33.417547 IP 138.197.151.74.ssh > 24-212-207-43.cable.teksavvy.com.51275: Flags [P.], seq 47308:47480, ack 1, win 501, length 172
15:47:33.417684 IP 138.197.151.74.ssh > 24-212-207-43.cable.teksavvy.com.51275: Flags [P.], seq 47480:47652, ack 1, win 501, length 172
15:47:33.417819 IP 138.197.151.74.ssh > 24-212-207-43.cable.teksavvy.com.51275: Flags [P.], seq 47652:47824, ack 1, win 501, length 172
15:47:33.417954 IP 138.197.151.74.ssh > 24-212-207-43.cable.teksavvy.com.51275: Flags [P.], seq 47824:47996, ack 1, win 501, length 172
15:47:33.418083 IP 138.197.151.74.ssh > 24-212-207-43.cable.teksavvy.com.51275: Flags [P.], seq 47996:48168, ack 1, win 501, length 172
15:47:33.418218 IP 138.197.151.74.ssh > 24-212-207-43.cable.teksavvy.com.51275: Flags [P.], seq 48168:48340, ack 1, win 501, length 172
15:47:33.418351 IP 138.197.151.74.ssh > 24-212-207-43.cable.teksavvy.com.51275: Flags [P.], seq 48340:48512, ack 1, win 501, length 172
15:47:33.418503 IP 138.197.151.74.ssh > 24-212-207-43.cable.teksavvy.com.51275: Flags [P.], seq 48512:48684, ack 1, win 501, length 172
15:47:33.418744 IP 138.197.151.74.ssh > 24-212-207-43.cable.teksavvy.com.51275: Flags [P.], seq 48684:48856, ack 1, win 501, length 172
15:47:33.418902 IP 138.197.151.74.ssh > 24-212-207-43.cable.teksavvy.com.51275: Flags [P.], seq 48856:49028, ack 1, win 501, length 172
15:47:33.419067 IP 138.197.151.74.ssh > 24-212-207-43.cable.teksavvy.com.51275: Flags [P.], seq 49028:49200, ack 1, win 501, length 172
15:47:33.419204 IP 138.197.151.74.ssh > 24-212-207-43.cable.teksavvy.com.51275: Flags [P.], seq 49200:49372, ack 1, win 501, length 172
15:47:33.419338 IP 138.197.151.74.ssh > 24-212-207-43.cable.teksavvy.com.51275: Flags [P.], seq 49372:49544, ack 1, win 501, length 172
15:47:33.419469 IP 138.197.151.74.ssh > 24-212-207-43.cable.teksavvy.com.51275: Flags [P.], seq 49544:49716, ack 1, win 501, length 172
15:47:33.419650 IP 138.197.151.74.ssh > 24-212-207-43.cable.teksavvy.com.51275: Flags [P.], seq 49716:49888, ack 1, win 501, length 172
15:47:33.419788 IP 138.197.151.74.ssh > 24-212-207-43.cable.teksavvy.com.51275: Flags [P.], seq 49888:50060, ack 1, win 501, length 172
15:47:33.419924 IP 138.197.151.74.ssh > 24-212-207-43.cable.teksavvy.com.51275: Flags [P.], seq 50060:50232, ack 1, win 501, length 172
15:47:33.420059 IP 138.197.151.74.ssh > 24-212-207-43.cable.teksavvy.com.51275: Flags [P.], seq 50232:50404, ack 1, win 501, length 172
15:47:33.420193 IP 138.197.151.74.ssh > 24-212-207-43.cable.teksavvy.com.51275: Flags [P.], seq 50404:50576, ack 1, win 501, length 172
15:47:33.420326 IP 138.197.151.74.ssh > 24-212-207-43.cable.teksavvy.com.51275: Flags [P.], seq 50576:50748, ack 1, win 501, length 172
15:47:33.420462 IP 138.197.151.74.ssh > 24-212-207-43.cable.teksavvy.com.51275: Flags [P.], seq 50748:50920, ack 1, win 501, length 172
15:47:33.420594 IP 138.197.151.74.ssh > 24-212-207-43.cable.teksavvy.com.51275: Flags [P.], seq 50920:51092, ack 1, win 501, length 172
15:47:33.420635 IP 24-212-207-43.cable.teksavvy.com.51275 > 138.197.151.74.ssh: Flags [.], ack 42020, win 18769, length 0
