root@lamp-ubuntu-s-1vcpu-1gb-tor1-01:~# tcpdump -i eth0
tcpdump: verbose output suppressed, use -v or -vv for full protocol decode
listening on eth0, link-type EN10MB (Ethernet), capture size 262144 bytes
15:25:50.221611 IP 138.197.151.74.ssh > 24-212-207-43.cable.teksavvy.com.51275: Flags [P.], seq 2847563732:2847563840, ack 2227293218, win 501, length 108
15:25:50.221739 IP 138.197.151.74.ssh > 24-212-207-43.cable.teksavvy.com.51275: Flags [P.], seq 108:144, ack 1, win 501, length 36
15:25:50.221866 IP 138.197.151.74.ssh > 24-212-207-43.cable.teksavvy.com.51275: Flags [P.], seq 144:252, ack 1, win 501, length 108
15:25:50.221992 IP 138.197.151.74.ssh > 24-212-207-43.cable.teksavvy.com.51275: Flags [P.], seq 252:288, ack 1, win 501, length 36
15:25:50.222710 IP 138.197.151.74.44003 > dns.google.domain: 5435+ PTR? 43.207.212.24.in-addr.arpa. (44)
15:25:50.231737 IP dns.google.domain > 138.197.151.74.44003: 5435 1/0/0 PTR 24-212-207-43.cable.teksavvy.com. (90)
15:25:50.232058 IP 138.197.151.74.48160 > dns.google.domain: 42978+ PTR? 74.151.197.138.in-addr.arpa. (45)
15:25:50.235324 IP 24-212-207-43.cable.teksavvy.com.51275 > 138.197.151.74.ssh: Flags [.], ack 288, win 2335, length 0
15:25:50.345768 IP dns.google.domain > 138.197.151.74.48160: 42978 NXDomain 0/1/0 (112)
15:25:50.346182 IP 138.197.151.74.ssh > 24-212-207-43.cable.teksavvy.com.51275: Flags [P.], seq 288:476, ack 1, win 501, length 188
15:25:50.346309 IP 138.197.151.74.ssh > 24-212-207-43.cable.teksavvy.com.51275: Flags [P.], seq 476:512, ack 1, win 501, length 36
15:25:50.346468 IP 138.197.151.74.ssh > 24-212-207-43.cable.teksavvy.com.51275: Flags [P.], seq 512:676, ack 1, win 501, length 164
15:25:50.346584 IP 138.197.151.74.ssh > 24-212-207-43.cable.teksavvy.com.51275: Flags [P.], seq 676:712, ack 1, win 501, length 36
15:25:50.346721 IP 138.197.151.74.ssh > 24-212-207-43.cable.teksavvy.com.51275: Flags [P.], seq 712:884, ack 1, win 501, length 172
15:25:50.346842 IP 138.197.151.74.ssh > 24-212-207-43.cable.teksavvy.com.51275: Flags [P.], seq 884:920, ack 1, win 501, length 36
15:25:50.347035 IP 138.197.151.74.ssh > 24-212-207-43.cable.teksavvy.com.51275: Flags [P.], seq 920:1084, ack 1, win 501, length 164
15:25:50.347163 IP 138.197.151.74.ssh > 24-212-207-43.cable.teksavvy.com.51275: Flags [P.], seq 1084:1120, ack 1, win 501, length 36
15:25:50.347437 IP 138.197.151.74.52935 > dns.google.domain: 27999+ PTR? 8.8.8.8.in-addr.arpa. (38)
15:25:50.348131 IP dns.google.domain > 138.197.151.74.52935: 27999 1/0/0 PTR dns.google. (62)
15:25:50.348377 IP 138.197.151.74.ssh > 24-212-207-43.cable.teksavvy.com.51275: Flags [P.], seq 1120:1260, ack 1, win 501, length 140
15:25:50.348487 IP 138.197.151.74.ssh > 24-212-207-43.cable.teksavvy.com.51275: Flags [P.], seq 1260:1296, ack 1, win 501, length 36
15:25:50.359092 IP 24-212-207-43.cable.teksavvy.com.51275 > 138.197.151.74.ssh: Flags [.], ack 1296, win 2337, length 0
15:25:50.359184 IP 138.197.151.74.ssh > 24-212-207-43.cable.teksavvy.com.51275: Flags [P.], seq 1296:4216, ack 1, win 501, length 2920
15:25:50.359284 IP 138.197.151.74.ssh > 24-212-207-43.cable.teksavvy.com.51275: Flags [P.], seq 4216:4408, ack 1, win 501, length 192
15:25:50.359429 IP 138.197.151.74.ssh > 24-212-207-43.cable.teksavvy.com.51275: Flags [P.], seq 4408:4564, ack 1, win 501, length 156
15:25:50.359538 IP 138.197.151.74.ssh > 24-212-207-43.cable.teksavvy.com.51275: Flags [P.], seq 4564:4600, ack 1, win 501, length 36
15:25:50.359759 IP 138.197.151.74.ssh > 24-212-207-43.cable.teksavvy.com.51275: Flags [P.], seq 4600:4772, ack 1, win 501, length 172
15:25:50.360146 IP 138.197.151.74.ssh > 24-212-207-43.cable.teksavvy.com.51275: Flags [P.], seq 4772:4808, ack 1, win 501, length 36
15:25:50.360352 IP 138.197.151.74.ssh > 24-212-207-43.cable.teksavvy.com.51275: Flags [P.], seq 4808:4980, ack 1, win 501, length 172
15:25:50.360487 IP 138.197.151.74.ssh > 24-212-207-43.cable.teksavvy.com.51275: Flags [P.], seq 4980:5016, ack 1, win 501, length 36
15:25:50.360681 IP 138.197.151.74.ssh > 24-212-207-43.cable.teksavvy.com.51275: Flags [P.], seq 5016:5188, ack 1, win 501, length 172
15:25:50.360890 IP 138.197.151.74.ssh > 24-212-207-43.cable.teksavvy.com.51275: Flags [P.], seq 5188:5224, ack 1, win 501, length 36
15:25:50.361086 IP 138.197.151.74.ssh > 24-212-207-43.cable.teksavvy.com.51275: Flags [P.], seq 5224:5396, ack 1, win 501, length 172
15:25:50.361249 IP 138.197.151.74.ssh > 24-212-207-43.cable.teksavvy.com.51275: Flags [P.], seq 5396:5432, ack 1, win 501, length 36
15:25:50.361388 IP 138.197.151.74.ssh > 24-212-207-43.cable.teksavvy.com.51275: Flags [P.], seq 5432:5604, ack 1, win 501, length 172
15:25:50.361484 IP 138.197.151.74.ssh > 24-212-207-43.cable.teksavvy.com.51275: Flags [P.], seq 5604:5640, ack 1, win 501, length 36
15:25:50.361598 IP 138.197.151.74.ssh > 24-212-207-43.cable.teksavvy.com.51275: Flags [P.], seq 5640:5812, ack 1, win 501, length 172
15:25:50.361701 IP 138.197.151.74.ssh > 24-212-207-43.cable.teksavvy.com.51275: Flags [P.], seq 5812:5848, ack 1, win 501, length 36
15:25:50.361847 IP 138.197.151.74.ssh > 24-212-207-43.cable.teksavvy.com.51275: Flags [P.], seq 5848:6020, ack 1, win 501, length 172
15:25:50.361949 IP 138.197.151.74.ssh > 24-212-207-43.cable.teksavvy.com.51275: Flags [P.], seq 6020:6056, ack 1, win 501, length 36
15:25:50.362107 IP 138.197.151.74.ssh > 24-212-207-43.cable.teksavvy.com.51275: Flags [P.], seq 6056:6228, ack 1, win 501, length 172
15:25:50.374284 IP 24-212-207-43.cable.teksavvy.com.51275 > 138.197.151.74.ssh: Flags [.], ack 5848, win 2333, length 0
15:25:50.374400 IP 138.197.151.74.ssh > 24-212-207-43.cable.teksavvy.com.51275: Flags [P.], seq 6228:8552, ack 1, win 501, length 2324
15:25:50.374435 IP 24-212-207-43.cable.teksavvy.com.51275 > 138.197.151.74.ssh: Flags [.], ack 6228, win 2338, length 0
15:25:50.374714 IP 138.197.151.74.ssh > 24-212-207-43.cable.teksavvy.com.51275: Flags [P.], seq 8552:8708, ack 1, win 501, length 156
15:25:50.374863 IP 138.197.151.74.ssh > 24-212-207-43.cable.teksavvy.com.51275: Flags [P.], seq 8708:8744, ack 1, win 501, length 36
15:25:50.375095 IP 138.197.151.74.ssh > 24-212-207-43.cable.teksavvy.com.51275: Flags [P.], seq 8744:8916, ack 1, win 501, length 172
15:25:50.375238 IP 138.197.151.74.ssh > 24-212-207-43.cable.teksavvy.com.51275: Flags [P.], seq 8916:8952, ack 1, win 501, length 36
15:25:50.375414 IP 138.197.151.74.ssh > 24-212-207-43.cable.teksavvy.com.51275: Flags [P.], seq 8952:9108, ack 1, win 501, length 156
15:25:50.375574 IP 138.197.151.74.ssh > 24-212-207-43.cable.teksavvy.com.51275: Flags [P.], seq 9108:9144, ack 1, win 501, length 36
15:25:50.375788 IP 138.197.151.74.ssh > 24-212-207-43.cable.teksavvy.com.51275: Flags [P.], seq 9144:9316, ack 1, win 501, length 172
15:25:50.375925 IP 138.197.151.74.ssh > 24-212-207-43.cable.teksavvy.com.51275: Flags [P.], seq 9316:9352, ack 1, win 501, length 36
15:25:50.376123 IP 138.197.151.74.ssh > 24-212-207-43.cable.teksavvy.com.51275: Flags [P.], seq 9352:9524, ack 1, win 501, length 172
15:25:50.376260 IP 138.197.151.74.ssh > 24-212-207-43.cable.teksavvy.com.51275: Flags [P.], seq 9524:9560, ack 1, win 501, length 36
15:25:50.376439 IP 138.197.151.74.ssh > 24-212-207-43.cable.teksavvy.com.51275: Flags [P.], seq 9560:9732, ack 1, win 501, length 172
15:25:50.376664 IP 138.197.151.74.ssh > 24-212-207-43.cable.teksavvy.com.51275: Flags [P.], seq 9732:10040, ack 1, win 501, length 308
15:25:50.377064 IP 138.197.151.74.ssh > 24-212-207-43.cable.teksavvy.com.51275: Flags [P.], seq 10040:11020, ack 1, win 501, length 980
15:25:50.377261 IP 138.197.151.74.ssh > 24-212-207-43.cable.teksavvy.com.51275: Flags [P.], seq 11020:11192, ack 1, win 501, length 172
15:25:50.377474 IP 138.197.151.74.ssh > 24-212-207-43.cable.teksavvy.com.51275: Flags [P.], seq 11192:11364, ack 1, win 501, length 172
15:25:50.377685 IP 138.197.151.74.ssh > 24-212-207-43.cable.teksavvy.com.51275: Flags [P.], seq 11364:11536, ack 1, win 501, length 172
15:25:50.377889 IP 138.197.151.74.ssh > 24-212-207-43.cable.teksavvy.com.51275: Flags [P.], seq 11536:11708, ack 1, win 501, length 172
15:25:50.378109 IP 138.197.151.74.ssh > 24-212-207-43.cable.teksavvy.com.51275: Flags [P.], seq 11708:11880, ack 1, win 501, length 172
15:25:50.378321 IP 138.197.151.74.ssh > 24-212-207-43.cable.teksavvy.com.51275: Flags [P.], seq 11880:12052, ack 1, win 501, length 172
15:25:50.378546 IP 138.197.151.74.ssh > 24-212-207-43.cable.teksavvy.com.51275: Flags [P.], seq 12052:12224, ack 1, win 501, length 172
15:25:50.378749 IP 138.197.151.74.ssh > 24-212-207-43.cable.teksavvy.com.51275: Flags [P.], seq 12224:12396, ack 1, win 501, length 172
15:25:50.378990 IP 138.197.151.74.ssh > 24-212-207-43.cable.teksavvy.com.51275: Flags [P.], seq 12396:12568, ack 1, win 501, length 172
15:25:50.379220 IP 138.197.151.74.ssh > 24-212-207-43.cable.teksavvy.com.51275: Flags [P.], seq 12568:12740, ack 1, win 501, length 172
15:25:50.379419 IP 138.197.151.74.ssh > 24-212-207-43.cable.teksavvy.com.51275: Flags [P.], seq 12740:12912, ack 1, win 501, length 172
15:25:50.379672 IP 138.197.151.74.ssh > 24-212-207-43.cable.teksavvy.com.51275: Flags [P.], seq 12912:13084, ack 1, win 501, length 172
15:25:50.379884 IP 138.197.151.74.ssh > 24-212-207-43.cable.teksavvy.com.51275: Flags [P.], seq 13084:13256, ack 1, win 501, length 172
15:25:50.380092 IP 138.197.151.74.ssh > 24-212-207-43.cable.teksavvy.com.51275: Flags [P.], seq 13256:13428, ack 1, win 501, length 172
15:25:50.380306 IP 138.197.151.74.ssh > 24-212-207-43.cable.teksavvy.com.51275: Flags [P.], seq 13428:13600, ack 1, win 501, length 172
15:25:50.380500 IP 138.197.151.74.ssh > 24-212-207-43.cable.teksavvy.com.51275: Flags [P.], seq 13600:13772, ack 1, win 501, length 172
15:25:50.380688 IP 138.197.151.74.ssh > 24-212-207-43.cable.teksavvy.com.51275: Flags [P.], seq 13772:13944, ack 1, win 501, length 172
15:25:50.380877 IP 138.197.151.74.ssh > 24-212-207-43.cable.teksavvy.com.51275: Flags [P.], seq 13944:14116, ack 1, win 501, length 172
15:25:50.381084 IP 138.197.151.74.ssh > 24-212-207-43.cable.teksavvy.com.51275: Flags [P.], seq 14116:14288, ack 1, win 501, length 172
15:25:50.381267 IP 138.197.151.74.ssh > 24-212-207-43.cable.teksavvy.com.51275: Flags [P.], seq 14288:14460, ack 1, win 501, length 172
15:25:50.381462 IP 138.197.151.74.ssh > 24-212-207-43.cable.teksavvy.com.51275: Flags [P.], seq 14460:14632, ack 1, win 501, length 172
15:25:50.381669 IP 138.197.151.74.ssh > 24-212-207-43.cable.teksavvy.com.51275: Flags [P.], seq 14632:14804, ack 1, win 501, length 172
15:25:50.381877 IP 138.197.151.74.ssh > 24-212-207-43.cable.teksavvy.com.51275: Flags [P.], seq 14804:14976, ack 1, win 501, length 172
15:25:50.382124 IP 138.197.151.74.ssh > 24-212-207-43.cable.teksavvy.com.51275: Flags [P.], seq 14976:15148, ack 1, win 501, length 172
15:25:50.382332 IP 138.197.151.74.ssh > 24-212-207-43.cable.teksavvy.com.51275: Flags [P.], seq 15148:15320, ack 1, win 501, length 172
15:25:50.396636 IP 24-212-207-43.cable.teksavvy.com.51275 > 138.197.151.74.ssh: Flags [.], ack 11536, win 2337, length 0
15:25:50.396741 IP 138.197.151.74.ssh > 24-212-207-43.cable.teksavvy.com.51275: Flags [P.], seq 15320:15492, ack 1, win 501, length 172
15:25:50.396777 IP 24-212-207-43.cable.teksavvy.com.51275 > 138.197.151.74.ssh: Flags [.], ack 15320, win 2338, length 0
15:25:50.397235 IP 138.197.151.74.ssh > 24-212-207-43.cable.teksavvy.com.51275: Flags [P.], seq 15492:15912, ack 1, win 501, length 420
15:25:50.397476 IP 138.197.151.74.ssh > 24-212-207-43.cable.teksavvy.com.51275: Flags [P.], seq 15912:16084, ack 1, win 501, length 172
15:25:50.397665 IP 138.197.151.74.ssh > 24-212-207-43.cable.teksavvy.com.51275: Flags [P.], seq 16084:16256, ack 1, win 501, length 172
15:25:50.397840 IP 138.197.151.74.ssh > 24-212-207-43.cable.teksavvy.com.51275: Flags [P.], seq 16256:16428, ack 1, win 501, length 172
15:25:50.398014 IP 138.197.151.74.ssh > 24-212-207-43.cable.teksavvy.com.51275: Flags [P.], seq 16428:16600, ack 1, win 501, length 172
15:25:50.398198 IP 138.197.151.74.ssh > 24-212-207-43.cable.teksavvy.com.51275: Flags [P.], seq 16600:16772, ack 1, win 501, length 172
15:25:50.398365 IP 138.197.151.74.ssh > 24-212-207-43.cable.teksavvy.com.51275: Flags [P.], seq 16772:16944, ack 1, win 501, length 172
15:25:50.398575 IP 138.197.151.74.ssh > 24-212-207-43.cable.teksavvy.com.51275: Flags [P.], seq 16944:17116, ack 1, win 501, length 172
15:25:50.398790 IP 138.197.151.74.ssh > 24-212-207-43.cable.teksavvy.com.51275: Flags [P.], seq 17116:17288, ack 1, win 501, length 172
15:25:50.398979 IP 138.197.151.74.ssh > 24-212-207-43.cable.teksavvy.com.51275: Flags [P.], seq 17288:17460, ack 1, win 501, length 172
15:25:50.399171 IP 138.197.151.74.ssh > 24-212-207-43.cable.teksavvy.com.51275: Flags [P.], seq 17460:17632, ack 1, win 501, length 172
15:25:50.399312 IP 138.197.151.74.ssh > 24-212-207-43.cable.teksavvy.com.51275: Flags [P.], seq 17632:17804, ack 1, win 501, length 172
15:25:50.399494 IP 138.197.151.74.ssh > 24-212-207-43.cable.teksavvy.com.51275: Flags [P.], seq 17804:17976, ack 1, win 501, length 172
15:25:50.399704 IP 138.197.151.74.ssh > 24-212-207-43.cable.teksavvy.com.51275: Flags [P.], seq 17976:18148, ack 1, win 501, length 172
15:25:50.399864 IP 138.197.151.74.ssh > 24-212-207-43.cable.teksavvy.com.51275: Flags [P.], seq 18148:18320, ack 1, win 501, length 172
15:25:50.400002 IP 138.197.151.74.ssh > 24-212-207-43.cable.teksavvy.com.51275: Flags [P.], seq 18320:18492, ack 1, win 501, length 172
15:25:50.400130 IP 138.197.151.74.ssh > 24-212-207-43.cable.teksavvy.com.51275: Flags [P.], seq 18492:18664, ack 1, win 501, length 172
15:25:50.400260 IP 138.197.151.74.ssh > 24-212-207-43.cable.teksavvy.com.51275: Flags [P.], seq 18664:18836, ack 1, win 501, length 172
15:25:50.400389 IP 138.197.151.74.ssh > 24-212-207-43.cable.teksavvy.com.51275: Flags [P.], seq 18836:19008, ack 1, win 501, length 172
15:25:50.400523 IP 138.197.151.74.ssh > 24-212-207-43.cable.teksavvy.com.51275: Flags [P.], seq 19008:19180, ack 1, win 501, length 172
15:25:50.400672 IP 138.197.151.74.ssh > 24-212-207-43.cable.teksavvy.com.51275: Flags [P.], seq 19180:19352, ack 1, win 501, length 172
15:25:50.400812 IP 138.197.151.74.ssh > 24-212-207-43.cable.teksavvy.com.51275: Flags [P.], seq 19352:19524, ack 1, win 501, length 172
15:25:50.400949 IP 138.197.151.74.ssh > 24-212-207-43.cable.teksavvy.com.51275: Flags [P.], seq 19524:19696, ack 1, win 501, length 172
15:25:50.401089 IP 138.197.151.74.ssh > 24-212-207-43.cable.teksavvy.com.51275: Flags [P.], seq 19696:19868, ack 1, win 501, length 172
15:25:50.401248 IP 138.197.151.74.ssh > 24-212-207-43.cable.teksavvy.com.51275: Flags [P.], seq 19868:20040, ack 1, win 501, length 172
15:25:50.401437 IP 138.197.151.74.ssh > 24-212-207-43.cable.teksavvy.com.51275: Flags [P.], seq 20040:20212, ack 1, win 501, length 172
15:25:50.401661 IP 138.197.151.74.ssh > 24-212-207-43.cable.teksavvy.com.51275: Flags [P.], seq 20212:20384, ack 1, win 501, length 172
15:25:50.401834 IP 138.197.151.74.ssh > 24-212-207-43.cable.teksavvy.com.51275: Flags [P.], seq 20384:20556, ack 1, win 501, length 172
15:25:50.401970 IP 138.197.151.74.ssh > 24-212-207-43.cable.teksavvy.com.51275: Flags [P.], seq 20556:20728, ack 1, win 501, length 172
15:25:50.402163 IP 138.197.151.74.ssh > 24-212-207-43.cable.teksavvy.com.51275: Flags [P.], seq 20728:20900, ack 1, win 501, length 172
15:25:50.402352 IP 138.197.151.74.ssh > 24-212-207-43.cable.teksavvy.com.51275: Flags [P.], seq 20900:21072, ack 1, win 501, length 172
15:25:50.402554 IP 138.197.151.74.ssh > 24-212-207-43.cable.teksavvy.com.51275: Flags [P.], seq 21072:21244, ack 1, win 501, length 172
15:25:50.402701 IP 138.197.151.74.ssh > 24-212-207-43.cable.teksavvy.com.51275: Flags [P.], seq 21244:21416, ack 1, win 501, length 172
15:25:50.402834 IP 138.197.151.74.ssh > 24-212-207-43.cable.teksavvy.com.51275: Flags [P.], seq 21416:21588, ack 1, win 501, length 172
15:25:50.403025 IP 138.197.151.74.ssh > 24-212-207-43.cable.teksavvy.com.51275: Flags [P.], seq 21588:21760, ack 1, win 501, length 172
15:25:50.403177 IP 138.197.151.74.ssh > 24-212-207-43.cable.teksavvy.com.51275: Flags [P.], seq 21760:21932, ack 1, win 501, length 172
15:25:50.403317 IP 138.197.151.74.ssh > 24-212-207-43.cable.teksavvy.com.51275: Flags [P.], seq 21932:22104, ack 1, win 501, length 172
15:25:50.403446 IP 138.197.151.74.ssh > 24-212-207-43.cable.teksavvy.com.51275: Flags [P.], seq 22104:22276, ack 1, win 501, length 172
15:25:50.403625 IP 138.197.151.74.ssh > 24-212-207-43.cable.teksavvy.com.51275: Flags [P.], seq 22276:22448, ack 1, win 501, length 172
15:25:50.403820 IP 138.197.151.74.ssh > 24-212-207-43.cable.teksavvy.com.51275: Flags [P.], seq 22448:22620, ack 1, win 501, length 172
15:25:50.404047 IP 138.197.151.74.ssh > 24-212-207-43.cable.teksavvy.com.51275: Flags [P.], seq 22620:22792, ack 1, win 501, length 172
15:25:50.404242 IP 138.197.151.74.ssh > 24-212-207-43.cable.teksavvy.com.51275: Flags [P.], seq 22792:22964, ack 1, win 501, length 172
15:25:50.404396 IP 138.197.151.74.ssh > 24-212-207-43.cable.teksavvy.com.51275: Flags [P.], seq 22964:23136, ack 1, win 501, length 172
15:25:50.404601 IP 138.197.151.74.ssh > 24-212-207-43.cable.teksavvy.com.51275: Flags [P.], seq 23136:23308, ack 1, win 501, length 172
15:25:50.404799 IP 138.197.151.74.ssh > 24-212-207-43.cable.teksavvy.com.51275: Flags [P.], seq 23308:23480, ack 1, win 501, length 172
15:25:50.405007 IP 138.197.151.74.ssh > 24-212-207-43.cable.teksavvy.com.51275: Flags [P.], seq 23480:23652, ack 1, win 501, length 172
15:25:50.405149 IP 138.197.151.74.ssh > 24-212-207-43.cable.teksavvy.com.51275: Flags [P.], seq 23652:23824, ack 1, win 501, length 172
15:25:50.405297 IP 138.197.151.74.ssh > 24-212-207-43.cable.teksavvy.com.51275: Flags [P.], seq 23824:23996, ack 1, win 501, length 172
15:25:50.405455 IP 138.197.151.74.ssh > 24-212-207-43.cable.teksavvy.com.51275: Flags [P.], seq 23996:24168, ack 1, win 501, length 172
15:25:50.405678 IP 138.197.151.74.ssh > 24-212-207-43.cable.teksavvy.com.51275: Flags [P.], seq 24168:24340, ack 1, win 501, length 172
15:25:50.405826 IP 138.197.151.74.ssh > 24-212-207-43.cable.teksavvy.com.51275: Flags [P.], seq 24340:24512, ack 1, win 501, length 172
15:25:50.405964 IP 138.197.151.74.ssh > 24-212-207-43.cable.teksavvy.com.51275: Flags [P.], seq 24512:24684, ack 1, win 501, length 172
15:25:50.406098 IP 138.197.151.74.ssh > 24-212-207-43.cable.teksavvy.com.51275: Flags [P.], seq 24684:24856, ack 1, win 501, length 172
15:25:50.406232 IP 138.197.151.74.ssh > 24-212-207-43.cable.teksavvy.com.51275: Flags [P.], seq 24856:25028, ack 1, win 501, length 172
15:25:50.406398 IP 138.197.151.74.ssh > 24-212-207-43.cable.teksavvy.com.51275: Flags [P.], seq 25028:25200, ack 1, win 501, length 172
15:25:50.406567 IP 138.197.151.74.ssh > 24-212-207-43.cable.teksavvy.com.51275: Flags [P.], seq 25200:25372, ack 1, win 501, length 172
15:25:50.406699 IP 138.197.151.74.ssh > 24-212-207-43.cable.teksavvy.com.51275: Flags [P.], seq 25372:25544, ack 1, win 501, length 172
15:25:50.406864 IP 138.197.151.74.ssh > 24-212-207-43.cable.teksavvy.com.51275: Flags [P.], seq 25544:25716, ack 1, win 501, length 172
15:25:50.407043 IP 138.197.151.74.ssh > 24-212-207-43.cable.teksavvy.com.51275: Flags [P.], seq 25716:25888, ack 1, win 501, length 172
15:25:50.407240 IP 138.197.151.74.ssh > 24-212-207-43.cable.teksavvy.com.51275: Flags [P.], seq 25888:26060, ack 1, win 501, length 172
15:25:50.407411 IP 138.197.151.74.ssh > 24-212-207-43.cable.teksavvy.com.51275: Flags [P.], seq 26060:26232, ack 1, win 501, length 172
15:25:50.407663 IP 138.197.151.74.ssh > 24-212-207-43.cable.teksavvy.com.51275: Flags [P.], seq 26232:26404, ack 1, win 501, length 172
15:25:50.407809 IP 138.197.151.74.ssh > 24-212-207-43.cable.teksavvy.com.51275: Flags [P.], seq 26404:26576, ack 1, win 501, length 172
15:25:50.407940 IP 138.197.151.74.ssh > 24-212-207-43.cable.teksavvy.com.51275: Flags [P.], seq 26576:26748, ack 1, win 501, length 172
15:25:50.408071 IP 138.197.151.74.ssh > 24-212-207-43.cable.teksavvy.com.51275: Flags [P.], seq 26748:26920, ack 1, win 501, length 172
15:25:50.408204 IP 138.197.151.74.ssh > 24-212-207-43.cable.teksavvy.com.51275: Flags [P.], seq 26920:27092, ack 1, win 501, length 172
15:25:50.408334 IP 138.197.151.74.ssh > 24-212-207-43.cable.teksavvy.com.51275: Flags [P.], seq 27092:27264, ack 1, win 501, length 172
15:25:50.408473 IP 138.197.151.74.ssh > 24-212-207-43.cable.teksavvy.com.51275: Flags [P.], seq 27264:27436, ack 1, win 501, length 172
15:25:50.408622 IP 138.197.151.74.ssh > 24-212-207-43.cable.teksavvy.com.51275: Flags [P.], seq 27436:27608, ack 1, win 501, length 172
15:25:50.408758 IP 138.197.151.74.ssh > 24-212-207-43.cable.teksavvy.com.51275: Flags [P.], seq 27608:27780, ack 1, win 501, length 172
15:25:50.408890 IP 138.197.151.74.ssh > 24-212-207-43.cable.teksavvy.com.51275: Flags [P.], seq 27780:27952, ack 1, win 501, length 172
15:25:50.409019 IP 138.197.151.74.ssh > 24-212-207-43.cable.teksavvy.com.51275: Flags [P.], seq 27952:28124, ack 1, win 501, length 172
15:25:50.409153 IP 138.197.151.74.ssh > 24-212-207-43.cable.teksavvy.com.51275: Flags [P.], seq 28124:28296, ack 1, win 501, length 172
15:25:50.409283 IP 138.197.151.74.ssh > 24-212-207-43.cable.teksavvy.com.51275: Flags [P.], seq 28296:28468, ack 1, win 501, length 172
15:25:50.409415 IP 138.197.151.74.ssh > 24-212-207-43.cable.teksavvy.com.51275: Flags [P.], seq 28468:28640, ack 1, win 501, length 172
15:25:50.409596 IP 138.197.151.74.ssh > 24-212-207-43.cable.teksavvy.com.51275: Flags [P.], seq 28640:28812, ack 1, win 501, length 172
15:25:50.409735 IP 138.197.151.74.ssh > 24-212-207-43.cable.teksavvy.com.51275: Flags [P.], seq 28812:28984, ack 1, win 501, length 172
15:25:50.409872 IP 138.197.151.74.ssh > 24-212-207-43.cable.teksavvy.com.51275: Flags [P.], seq 28984:29156, ack 1, win 501, length 172
15:25:50.410009 IP 138.197.151.74.ssh > 24-212-207-43.cable.teksavvy.com.51275: Flags [P.], seq 29156:29328, ack 1, win 501, length 172
15:25:50.410084 IP 24-212-207-43.cable.teksavvy.com.51275 > 138.197.151.74.ssh: Flags [.], ack 18148, win 2334, length 0
15:25:50.410235 IP 138.197.151.74.ssh > 24-212-207-43.cable.teksavvy.com.51275: Flags [P.], seq 29328:29628, ack 1, win 501, length 300
15:25:50.410382 IP 138.197.151.74.ssh > 24-212-207-43.cable.teksavvy.com.51275: Flags [P.], seq 29628:29800, ack 1, win 501, length 172
15:25:50.410515 IP 138.197.151.74.ssh > 24-212-207-43.cable.teksavvy.com.51275: Flags [P.], seq 29800:29972, ack 1, win 501, length 172
15:25:50.410646 IP 138.197.151.74.ssh > 24-212-207-43.cable.teksavvy.com.51275: Flags [P.], seq 29972:30144, ack 1, win 501, length 172
15:25:50.410777 IP 138.197.151.74.ssh > 24-212-207-43.cable.teksavvy.com.51275: Flags [P.], seq 30144:30316, ack 1, win 501, length 172
15:25:50.410905 IP 138.197.151.74.ssh > 24-212-207-43.cable.teksavvy.com.51275: Flags [P.], seq 30316:30488, ack 1, win 501, length 172
15:25:50.411106 IP 138.197.151.74.ssh > 24-212-207-43.cable.teksavvy.com.51275: Flags [P.], seq 30488:30660, ack 1, win 501, length 172
15:25:50.411246 IP 138.197.151.74.ssh > 24-212-207-43.cable.teksavvy.com.51275: Flags [P.], seq 30660:30832, ack 1, win 501, length 172
15:25:50.411379 IP 138.197.151.74.ssh > 24-212-207-43.cable.teksavvy.com.51275: Flags [P.], seq 30832:31004, ack 1, win 501, length 172
15:25:50.411508 IP 138.197.151.74.ssh > 24-212-207-43.cable.teksavvy.com.51275: Flags [P.], seq 31004:31176, ack 1, win 501, length 172
15:25:50.411664 IP 138.197.151.74.ssh > 24-212-207-43.cable.teksavvy.com.51275: Flags [P.], seq 31176:31348, ack 1, win 501, length 172
15:25:50.412115 IP 138.197.151.74.ssh > 24-212-207-43.cable.teksavvy.com.51275: Flags [P.], seq 31348:31520, ack 1, win 501, length 172
15:25:50.412298 IP 138.197.151.74.ssh > 24-212-207-43.cable.teksavvy.com.51275: Flags [P.], seq 31520:31692, ack 1, win 501, length 172
15:25:50.412445 IP 138.197.151.74.ssh > 24-212-207-43.cable.teksavvy.com.51275: Flags [P.], seq 31692:31864, ack 1, win 501, length 172
15:25:50.412582 IP 138.197.151.74.ssh > 24-212-207-43.cable.teksavvy.com.51275: Flags [P.], seq 31864:32036, ack 1, win 501, length 172
15:25:50.412791 IP 138.197.151.74.ssh > 24-212-207-43.cable.teksavvy.com.51275: Flags [P.], seq 32036:32208, ack 1, win 501, length 172
15:25:50.413000 IP 138.197.151.74.ssh > 24-212-207-43.cable.teksavvy.com.51275: Flags [P.], seq 32208:32380, ack 1, win 501, length 172
15:25:50.413146 IP 138.197.151.74.ssh > 24-212-207-43.cable.teksavvy.com.51275: Flags [P.], seq 32380:32552, ack 1, win 501, length 172
15:25:50.413277 IP 138.197.151.74.ssh > 24-212-207-43.cable.teksavvy.com.51275: Flags [P.], seq 32552:32724, ack 1, win 501, length 172
15:25:50.413408 IP 138.197.151.74.ssh > 24-212-207-43.cable.teksavvy.com.51275: Flags [P.], seq 32724:32896, ack 1, win 501, length 172
15:25:50.413564 IP 138.197.151.74.ssh > 24-212-207-43.cable.teksavvy.com.51275: Flags [P.], seq 32896:33068, ack 1, win 501, length 172
15:25:50.413714 IP 138.197.151.74.ssh > 24-212-207-43.cable.teksavvy.com.51275: Flags [P.], seq 33068:33240, ack 1, win 501, length 172
15:25:50.413851 IP 24-212-207-43.cable.teksavvy.com.51275 > 138.197.151.74.ssh: Flags [.], ack 18664, win 2338, length 0
15:25:50.413953 IP 138.197.151.74.ssh > 24-212-207-43.cable.teksavvy.com.51275: Flags [P.], seq 33240:33412, ack 1, win 501, length 172
15:25:50.414083 IP 138.197.151.74.ssh > 24-212-207-43.cable.teksavvy.com.51275: Flags [P.], seq 33412:33568, ack 1, win 501, length 156
15:25:50.414202 IP 138.197.151.74.ssh > 24-212-207-43.cable.teksavvy.com.51275: Flags [P.], seq 33568:33740, ack 1, win 501, length 172
15:25:50.414269 IP 138.197.151.74.ssh > 24-212-207-43.cable.teksavvy.com.51275: Flags [P.], seq 33740:33912, ack 1, win 501, length 172
15:25:50.414421 IP 138.197.151.74.ssh > 24-212-207-43.cable.teksavvy.com.51275: Flags [P.], seq 33912:34220, ack 1, win 501, length 308
15:25:50.414576 IP 138.197.151.74.ssh > 24-212-207-43.cable.teksavvy.com.51275: Flags [P.], seq 34220:34392, ack 1, win 501, length 172
15:25:50.414752 IP 138.197.151.74.ssh > 24-212-207-43.cable.teksavvy.com.51275: Flags [P.], seq 34392:34564, ack 1, win 501, length 172
15:25:50.415014 IP 138.197.151.74.ssh > 24-212-207-43.cable.teksavvy.com.51275: Flags [P.], seq 34564:34736, ack 1, win 501, length 172
15:25:50.415231 IP 138.197.151.74.ssh > 24-212-207-43.cable.teksavvy.com.51275: Flags [P.], seq 34736:34908, ack 1, win 501, length 172
15:25:50.415382 IP 138.197.151.74.ssh > 24-212-207-43.cable.teksavvy.com.51275: Flags [P.], seq 34908:35080, ack 1, win 501, length 172
15:25:50.415527 IP 138.197.151.74.ssh > 24-212-207-43.cable.teksavvy.com.51275: Flags [P.], seq 35080:35252, ack 1, win 501, length 172
15:25:50.415585 IP 24-212-207-43.cable.teksavvy.com.51275 > 138.197.151.74.ssh: Flags [.], ack 22104, win 2336, length 0
15:25:50.415637 IP 24-212-207-43.cable.teksavvy.com.51275 > 138.197.151.74.ssh: Flags [.], ack 26060, win 2336, length 0
15:25:50.415801 IP 138.197.151.74.ssh > 24-212-207-43.cable.teksavvy.com.51275: Flags [P.], seq 35252:35672, ack 1, win 501, length 420
15:25:50.415946 IP 138.197.151.74.ssh > 24-212-207-43.cable.teksavvy.com.51275: Flags [P.], seq 35672:35844, ack 1, win 501, length 172
15:25:50.416079 IP 138.197.151.74.ssh > 24-212-207-43.cable.teksavvy.com.51275: Flags [P.], seq 35844:36016, ack 1, win 501, length 172
15:25:50.416210 IP 138.197.151.74.ssh > 24-212-207-43.cable.teksavvy.com.51275: Flags [P.], seq 36016:36188, ack 1, win 501, length 172
15:25:50.416340 IP 138.197.151.74.ssh > 24-212-207-43.cable.teksavvy.com.51275: Flags [P.], seq 36188:36360, ack 1, win 501, length 172
15:25:50.416477 IP 138.197.151.74.ssh > 24-212-207-43.cable.teksavvy.com.51275: Flags [P.], seq 36360:36532, ack 1, win 501, length 172
15:25:50.416606 IP 138.197.151.74.ssh > 24-212-207-43.cable.teksavvy.com.51275: Flags [P.], seq 36532:36704, ack 1, win 501, length 172
15:25:50.416737 IP 138.197.151.74.ssh > 24-212-207-43.cable.teksavvy.com.51275: Flags [P.], seq 36704:36876, ack 1, win 501, length 172
15:25:50.416867 IP 138.197.151.74.ssh > 24-212-207-43.cable.teksavvy.com.51275: Flags [P.], seq 36876:37048, ack 1, win 501, length 172
15:25:50.416994 IP 138.197.151.74.ssh > 24-212-207-43.cable.teksavvy.com.51275: Flags [P.], seq 37048:37220, ack 1, win 501, length 172
15:25:50.417124 IP 138.197.151.74.ssh > 24-212-207-43.cable.teksavvy.com.51275: Flags [P.], seq 37220:37392, ack 1, win 501, length 172
15:25:50.417255 IP 138.197.151.74.ssh > 24-212-207-43.cable.teksavvy.com.51275: Flags [P.], seq 37392:37564, ack 1, win 501, length 172
15:25:50.417381 IP 138.197.151.74.ssh > 24-212-207-43.cable.teksavvy.com.51275: Flags [P.], seq 37564:37736, ack 1, win 501, length 172
15:25:50.417509 IP 138.197.151.74.ssh > 24-212-207-43.cable.teksavvy.com.51275: Flags [P.], seq 37736:37908, ack 1, win 501, length 172
15:25:50.417638 IP 138.197.151.74.ssh > 24-212-207-43.cable.teksavvy.com.51275: Flags [P.], seq 37908:38080, ack 1, win 501, length 172
15:25:50.417793 IP 138.197.151.74.ssh > 24-212-207-43.cable.teksavvy.com.51275: Flags [P.], seq 38080:38252, ack 1, win 501, length 172
15:25:50.417951 IP 138.197.151.74.ssh > 24-212-207-43.cable.teksavvy.com.51275: Flags [P.], seq 38252:38424, ack 1, win 501, length 172
15:25:50.418082 IP 138.197.151.74.ssh > 24-212-207-43.cable.teksavvy.com.51275: Flags [P.], seq 38424:38596, ack 1, win 501, length 172
15:25:50.418235 IP 138.197.151.74.ssh > 24-212-207-43.cable.teksavvy.com.51275: Flags [P.], seq 38596:38768, ack 1, win 501, length 172
15:25:50.418366 IP 138.197.151.74.ssh > 24-212-207-43.cable.teksavvy.com.51275: Flags [P.], seq 38768:38940, ack 1, win 501, length 172
15:25:50.418493 IP 138.197.151.74.ssh > 24-212-207-43.cable.teksavvy.com.51275: Flags [P.], seq 38940:39112, ack 1, win 501, length 172
15:25:50.418630 IP 138.197.151.74.ssh > 24-212-207-43.cable.teksavvy.com.51275: Flags [P.], seq 39112:39284, ack 1, win 501, length 172
15:25:50.418780 IP 24-212-207-43.cable.teksavvy.com.51275 > 138.197.151.74.ssh: Flags [.], ack 26748, win 2334, length 0
15:25:50.418798 IP 138.197.151.74.ssh > 24-212-207-43.cable.teksavvy.com.51275: Flags [P.], seq 39284:39456, ack 1, win 501, length 172
15:25:50.418992 IP 138.197.151.74.ssh > 24-212-207-43.cable.teksavvy.com.51275: Flags [P.], seq 39456:39756, ack 1, win 501, length 300
15:25:50.419175 IP 138.197.151.74.ssh > 24-212-207-43.cable.teksavvy.com.51275: Flags [P.], seq 39756:39928, ack 1, win 501, length 172
15:25:50.419314 IP 138.197.151.74.ssh > 24-212-207-43.cable.teksavvy.com.51275: Flags [P.], seq 39928:40100, ack 1, win 501, length 172
15:25:50.419447 IP 138.197.151.74.ssh > 24-212-207-43.cable.teksavvy.com.51275: Flags [P.], seq 40100:40272, ack 1, win 501, length 172
15:25:50.419587 IP 138.197.151.74.ssh > 24-212-207-43.cable.teksavvy.com.51275: Flags [P.], seq 40272:40444, ack 1, win 501, length 172
15:25:50.419749 IP 138.197.151.74.ssh > 24-212-207-43.cable.teksavvy.com.51275: Flags [P.], seq 40444:40616, ack 1, win 501, length 172
15:25:50.419884 IP 138.197.151.74.ssh > 24-212-207-43.cable.teksavvy.com.51275: Flags [P.], seq 40616:40788, ack 1, win 501, length 172
15:25:50.420024 IP 138.197.151.74.ssh > 24-212-207-43.cable.teksavvy.com.51275: Flags [P.], seq 40788:40960, ack 1, win 501, length 172
15:25:50.420163 IP 138.197.151.74.ssh > 24-212-207-43.cable.teksavvy.com.51275: Flags [P.], seq 40960:41132, ack 1, win 501, length 172
15:25:50.420299 IP 138.197.151.74.ssh > 24-212-207-43.cable.teksavvy.com.51275: Flags [P.], seq 41132:41304, ack 1, win 501, length 172
15:25:50.420434 IP 138.197.151.74.ssh > 24-212-207-43.cable.teksavvy.com.51275: Flags [P.], seq 41304:41476, ack 1, win 501, length 172
15:25:50.420469 IP 24-212-207-43.cable.teksavvy.com.51275 > 138.197.151.74.ssh: Flags [.], ack 31176, win 2335, length 0
15:25:50.420634 IP 138.197.151.74.ssh > 24-212-207-43.cable.teksavvy.com.51275: Flags [P.], seq 41476:41776, ack 1, win 501, length 300
15:25:50.420770 IP 138.197.151.74.ssh > 24-212-207-43.cable.teksavvy.com.51275: Flags [P.], seq 41776:41948, ack 1, win 501, length 172
15:25:50.420900 IP 138.197.151.74.ssh > 24-212-207-43.cable.teksavvy.com.51275: Flags [P.], seq 41948:42120, ack 1, win 501, length 172
15:25:50.421030 IP 138.197.151.74.ssh > 24-212-207-43.cable.teksavvy.com.51275: Flags [P.], seq 42120:42292, ack 1, win 501, length 172
15:25:50.421157 IP 138.197.151.74.ssh > 24-212-207-43.cable.teksavvy.com.51275: Flags [P.], seq 42292:42464, ack 1, win 501, length 172
15:25:50.421288 IP 138.197.151.74.ssh > 24-212-207-43.cable.teksavvy.com.51275: Flags [P.], seq 42464:42636, ack 1, win 501, length 172
15:25:50.421426 IP 138.197.151.74.ssh > 24-212-207-43.cable.teksavvy.com.51275: Flags [P.], seq 42636:42808, ack 1, win 501, length 172
15:25:50.421558 IP 138.197.151.74.ssh > 24-212-207-43.cable.teksavvy.com.51275: Flags [P.], seq 42808:42980, ack 1, win 501, length 172
15:25:50.421695 IP 138.197.151.74.ssh > 24-212-207-43.cable.teksavvy.com.51275: Flags [P.], seq 42980:43152, ack 1, win 501, length 172
15:25:50.421831 IP 138.197.151.74.ssh > 24-212-207-43.cable.teksavvy.com.51275: Flags [P.], seq 43152:43324, ack 1, win 501, length 172
15:25:50.421960 IP 138.197.151.74.ssh > 24-212-207-43.cable.teksavvy.com.51275: Flags [P.], seq 43324:43496, ack 1, win 501, length 172
15:25:50.422100 IP 138.197.151.74.ssh > 24-212-207-43.cable.teksavvy.com.51275: Flags [P.], seq 43496:43668, ack 1, win 501, length 172
15:25:50.422287 IP 138.197.151.74.ssh > 24-212-207-43.cable.teksavvy.com.51275: Flags [P.], seq 43668:43840, ack 1, win 501, length 172
15:25:50.422437 IP 138.197.151.74.ssh > 24-212-207-43.cable.teksavvy.com.51275: Flags [P.], seq 43840:44012, ack 1, win 501, length 172
15:25:50.422577 IP 138.197.151.74.ssh > 24-212-207-43.cable.teksavvy.com.51275: Flags [P.], seq 44012:44184, ack 1, win 501, length 172
15:25:50.422707 IP 138.197.151.74.ssh > 24-212-207-43.cable.teksavvy.com.51275: Flags [P.], seq 44184:44356, ack 1, win 501, length 172
15:25:50.422840 IP 24-212-207-43.cable.teksavvy.com.51275 > 138.197.151.74.ssh: Flags [.], ack 32896, win 2334, length 0
15:25:50.422906 IP 138.197.151.74.ssh > 24-212-207-43.cable.teksavvy.com.51275: Flags [P.], seq 44356:44528, ack 1, win 501, length 172
15:25:50.423141 IP 138.197.151.74.ssh > 24-212-207-43.cable.teksavvy.com.51275: Flags [P.], seq 44528:44828, ack 1, win 501, length 300
15:25:50.423283 IP 138.197.151.74.ssh > 24-212-207-43.cable.teksavvy.com.51275: Flags [P.], seq 44828:45000, ack 1, win 501, length 172
15:25:50.423426 IP 138.197.151.74.ssh > 24-212-207-43.cable.teksavvy.com.51275: Flags [P.], seq 45000:45172, ack 1, win 501, length 172
15:25:50.423666 IP 138.197.151.74.ssh > 24-212-207-43.cable.teksavvy.com.51275: Flags [P.], seq 45172:45344, ack 1, win 501, length 172
15:25:50.423818 IP 138.197.151.74.ssh > 24-212-207-43.cable.teksavvy.com.51275: Flags [P.], seq 45344:45516, ack 1, win 501, length 172
15:25:50.423951 IP 138.197.151.74.ssh > 24-212-207-43.cable.teksavvy.com.51275: Flags [P.], seq 45516:45688, ack 1, win 501, length 172
15:25:50.424088 IP 138.197.151.74.ssh > 24-212-207-43.cable.teksavvy.com.51275: Flags [P.], seq 45688:45860, ack 1, win 501, length 172
15:25:50.424227 IP 138.197.151.74.ssh > 24-212-207-43.cable.teksavvy.com.51275: Flags [P.], seq 45860:46032, ack 1, win 501, length 172
15:25:50.424384 IP 138.197.151.74.ssh > 24-212-207-43.cable.teksavvy.com.51275: Flags [P.], seq 46032:46204, ack 1, win 501, length 172
15:25:50.424518 IP 138.197.151.74.ssh > 24-212-207-43.cable.teksavvy.com.51275: Flags [P.], seq 46204:46376, ack 1, win 501, length 172
15:25:50.424647 IP 138.197.151.74.ssh > 24-212-207-43.cable.teksavvy.com.51275: Flags [P.], seq 46376:46548, ack 1, win 501, length 172
15:25:50.424787 IP 138.197.151.74.ssh > 24-212-207-43.cable.teksavvy.com.51275: Flags [P.], seq 46548:46720, ack 1, win 501, length 172
15:25:50.424922 IP 138.197.151.74.ssh > 24-212-207-43.cable.teksavvy.com.51275: Flags [P.], seq 46720:46892, ack 1, win 501, length 172
15:25:50.425052 IP 138.197.151.74.ssh > 24-212-207-43.cable.teksavvy.com.51275: Flags [P.], seq 46892:47064, ack 1, win 501, length 172
15:25:50.425291 IP 138.197.151.74.ssh > 24-212-207-43.cable.teksavvy.com.51275: Flags [P.], seq 47064:47236, ack 1, win 501, length 172
15:25:50.425337 IP 24-212-207-43.cable.teksavvy.com.51275 > 138.197.151.74.ssh: Flags [.], ack 34392, win 2336, length 0
15:25:50.425511 IP 138.197.151.74.ssh > 24-212-207-43.cable.teksavvy.com.51275: Flags [P.], seq 47236:47536, ack 1, win 501, length 300
15:25:50.425651 IP 138.197.151.74.ssh > 24-212-207-43.cable.teksavvy.com.51275: Flags [P.], seq 47536:47708, ack 1, win 501, length 172
15:25:50.425783 IP 138.197.151.74.ssh > 24-212-207-43.cable.teksavvy.com.51275: Flags [P.], seq 47708:47880, ack 1, win 501, length 172
15:25:50.425915 IP 138.197.151.74.ssh > 24-212-207-43.cable.teksavvy.com.51275: Flags [P.], seq 47880:48052, ack 1, win 501, length 172
15:25:50.426047 IP 138.197.151.74.ssh > 24-212-207-43.cable.teksavvy.com.51275: Flags [P.], seq 48052:48224, ack 1, win 501, length 172
15:25:50.426177 IP 138.197.151.74.ssh > 24-212-207-43.cable.teksavvy.com.51275: Flags [P.], seq 48224:48396, ack 1, win 501, length 172
15:25:50.426307 IP 138.197.151.74.ssh > 24-212-207-43.cable.teksavvy.com.51275: Flags [P.], seq 48396:48568, ack 1, win 501, length 172
15:25:50.426499 IP 138.197.151.74.ssh > 24-212-207-43.cable.teksavvy.com.51275: Flags [P.], seq 48568:48740, ack 1, win 501, length 172
15:25:50.426696 IP 138.197.151.74.ssh > 24-212-207-43.cable.teksavvy.com.51275: Flags [P.], seq 48740:48912, ack 1, win 501, length 172
15:25:50.426836 IP 138.197.151.74.ssh > 24-212-207-43.cable.teksavvy.com.51275: Flags [P.], seq 48912:49084, ack 1, win 501, length 172
15:25:50.427019 IP 138.197.151.74.ssh > 24-212-207-43.cable.teksavvy.com.51275: Flags [P.], seq 49084:49256, ack 1, win 501, length 172
15:25:50.427230 IP 138.197.151.74.ssh > 24-212-207-43.cable.teksavvy.com.51275: Flags [P.], seq 49256:49428, ack 1, win 501, length 172
15:25:50.427386 IP 138.197.151.74.ssh > 24-212-207-43.cable.teksavvy.com.51275: Flags [P.], seq 49428:49600, ack 1, win 501, length 172
15:25:50.427525 IP 138.197.151.74.ssh > 24-212-207-43.cable.teksavvy.com.51275: Flags [P.], seq 49600:49772, ack 1, win 501, length 172
15:25:50.427688 IP 138.197.151.74.ssh > 24-212-207-43.cable.teksavvy.com.51275: Flags [P.], seq 49772:49944, ack 1, win 501, length 172
15:25:50.427822 IP 138.197.151.74.ssh > 24-212-207-43.cable.teksavvy.com.51275: Flags [P.], seq 49944:50116, ack 1, win 501, length 172
15:25:50.427966 IP 138.197.151.74.ssh > 24-212-207-43.cable.teksavvy.com.51275: Flags [P.], seq 50116:50288, ack 1, win 501, length 172
15:25:50.428158 IP 138.197.151.74.ssh > 24-212-207-43.cable.teksavvy.com.51275: Flags [P.], seq 50288:50460, ack 1, win 501, length 172
15:25:50.428292 IP 138.197.151.74.ssh > 24-212-207-43.cable.teksavvy.com.51275: Flags [P.], seq 50460:50632, ack 1, win 501, length 172
15:25:50.428423 IP 138.197.151.74.ssh > 24-212-207-43.cable.teksavvy.com.51275: Flags [P.], seq 50632:50804, ack 1, win 501, length 172
15:25:50.428554 IP 138.197.151.74.ssh > 24-212-207-43.cable.teksavvy.com.51275: Flags [P.], seq 50804:50976, ack 1, win 501, length 172
15:25:50.428691 IP 138.197.151.74.ssh > 24-212-207-43.cable.teksavvy.com.51275: Flags [P.], seq 50976:51148, ack 1, win 501, length 172
15:25:50.428795 IP 24-212-207-43.cable.teksavvy.com.51275 > 138.197.151.74.ssh: Flags [.], ack 37220, win 2334, length 0
15:25:50.428873 IP 138.197.151.74.ssh > 24-212-207-43.cable.teksavvy.com.51275: Flags [P.], seq 51148:51320, ack 1, win 501, length 172
15:25:50.429086 IP 138.197.151.74.ssh > 24-212-207-43.cable.teksavvy.com.51275: Flags [P.], seq 51320:51620, ack 1, win 501, length 300
